"","Pos","Pos+","Artist and Title","Spins","Spins+","Bullet","Bullet+","Aud","Aud+","Days","iTunes","PkPos","PkSpins","PkBllt","PkAud"
"1",1,"=","MAROON 5 F/CHRISTINA AGUILERA Moves Like...",13547,"+28",300,"-162",89.665,"-0.217",82,"3",1,13547,1893,89.882
"2",2,"+1","GYM CLASS HEROES Stereo Hearts f/Adam Le...",10689,"+268",1596,"+32",63.185,"+1.869",92,"7",2,10689,1596,63.185
"3",3,"-1","BAD MEETS EVIL Lighters f/Bruno Mars",10682,"-146",-1024,"-61",65.063,"-1.074",95,"21",2,11835,1599,78.403
"4",4,"=","FOSTER THE PEOPLE Pumped Up Kicks",10358,"+127",710,"-29",62.086,"+0.646",77,"4",3,10358,1302,62.086
"5",5,"+1","ADELE Someone Like You",9425,"+344",1832,"+35",69.02,"+1.906",53,"2",5,9425,1982,69.02
"6",6,"-1","BRITNEY SPEARS I Wanna Go",8891,"-292",-1773,"-44",57.155,"-1.500",107,"48",1,12853,1768,82.422
"7",7,"=","COBRA STARSHIP You Make Me Feel... f/Sab...",8576,"+81",389,"-36",55.286,"+0.867",107,"13",7,8576,1017,55.286
"8",8,"=","KATY PERRY Last Friday Night (T.G.I.F.)",8264,"-146",-1909,"+135",47.448,"-1.174",124,"46",1,14935,2322,96.531
"9",9,"=","LMFAO Party Rock Anthem",8201,"-56",-710,"+52",53.204,"-0.377",141,"10",1,14043,1859,94.193
"10",10,"=","NICKI MINAJ Super Bass",7893,"-194",-1659,"+96",53.327,"-0.832",141,"28",3,12009,1188,73.23
"11",11,"=","RIHANNA Cheers (Drink To That)",7678,"-157",-406,"-227",38.908,"-1.429",63,"12",10,8085,1594,43.942
"12",12,"=","PITBULL Give Me Everything f/Ne-Yo",7229,"-76",-598,"-38",50.298,"-1.011",141,"34",1,14233,1811,95.596
"13",13,"=","LADY GAGA You And I",7186,"-29",223,"-93",41.345,"-0.345",51,"11",13,7215,1553,41.69
"14",14,"=","DEV In The Dark",6314,"+89",227,"+15",41.136,"+0.959",62,"14",14,6314,1224,41.136
"15",15,"=","ONEREPUBLIC Good Life",5963,"-115",-1036,"+37",37.508,"-1.350",141,"40",6,9571,978,57.364
"16",16,"=","DAVID GUETTA Without You f/Usher",5947,"+208",1122,"+48",38.123,"+1.117",33,"8",16,5947,1586,38.123
"17",17,"=","JASON DERULO It Girl",4639,"+57",593,"-40",22.453,"+0.221",42,"15",17,4639,1048,22.453
"18",18,"+1","KELLY CLARKSON Mr. Know It All",3779,"+89",833,"-46",20.968,"+0.489",25,"29",18,3779,1093,20.968
"19",19,"-1","THE SCRIPT Nothing",3776,"+47",219,"+67",18.444,"+0.271",61,"26",18,3776,722,18.444
"20",20,"=","ALEXANDRA STAN Mr. Saxobeat",3647,"+25",251,"-52",29.035,"+0.769",67,"31",20,3647,567,29.035
"21",21,"+1","LMFAO Sexy And I Know It",3608,"+159",1143,"+13",21.675,"+1.058",33,"6",21,3608,1143,21.675
"22",22,"-1","LIL WAYNE How To Love",3440,"-37",-835,"+84",24.7,"-0.462",116,"20",9,8047,1328,45.275
"23",23,"=","IYAZ Pretty Girls",3006,"-212",-1430,"-97",12.624,"-0.793",116,"60",17,4770,659,22.767
"24",24,"=","ANDY GRAMMER Keep Your Head Up",2905,"+49",215,"+6",11.2,"+0.228",95,"86",24,2905,355,11.2
"25",25,"=","LADY GAGA The Edge Of Glory",2647,"-42",-655,"+61",15.894,"-0.256",141,"47",3,11672,2193,68.045
"26",26,"=","AFROJACK Take Over Control f/Eva Simons",2534,"-57",-260,"-61",18.564,"-0.019",101,"56",25,2836,435,23.455
"27",27,"=","NEW BOYZ Better With The Lights Off",2389,"+39",308,"+1",8.282,"+0.094",55,"43",27,2389,423,8.282
"28",28,"=","KELLY ROWLAND Motivation f/Lil Wayne",2092,"-213",-864,"-187",9.775,"-0.775",86,"62",21,2998,415,15.279
"29",29,"+1","PATRICK STUMP This City f/Lupe Fiasco",1673,"+58",177,"+34",7.817,"+0.127",32,"143",29,1673,386,7.817
"30",30,"-1","THE BAND PERRY If I Die Young",1660,"-110",-1289,"+45",10.86,"-0.500",141,"30",11,6052,768,32.555
"31",31,"=","SELENA GOMEZ & THE SCENE Love You Like A...",1503,"+24",233,"-17",6.987,"+0.016",37,"39",31,1503,306,6.987
"32",32,"=","MATT NATHANSON Faster",1252,"-2",91,"-21",4.598,"-0.074",79,"108",32,1254,166,4.672
"33",33,"=","LLOYD Dedication To My Ex...",1223,"+26",252,"-36",4.676,"+0.129",26,"198",33,1223,315,4.676
"34",34,"+3","GAVIN DEGRAW Not Over You",1091,"+38",302,"-8",3.691,"+0.203",35,"--",34,1091,310,3.691
"35",35,"+1","WIZ KHALIFA No Sleep",1077,"-4",-7,"-11",3.552,"-0.008",46,"83",34,1093,246,3.907
"36",36,"-1","DEMI LOVATO Skyscraper",1068,"-17",-37,"-22",6.111,"+0.205",48,"--",35,1122,194,6.477
"37",37,"-3","DJ KHALED I'm On One f/Drake, Rick Ross",1052,"-44",-187,"-45",8.292,"+0.009",43,"63",32,1238,297,10.079
"38",38,"=","NICKI MINAJ Fly f/Rihanna",993,"+76",552,"+15",5.166,"+0.076",11,"54",38,993,552,5.166
"39",39,"+2","RIHANNA We Found Love f/Calvin Harris",982,"+250",982,"+250",12.058,"+2.613",4,"5",39,982,982,12.058
"40",40,"-1","BRITNEY SPEARS Criminal",915,"+74",556,"-2",5.228,"+0.200",8,"405",39,915,558,5.228
"41",41,"-1","JESSIE J Domino",830,"+64",314,"+23",3.895,"+0.247",13,"246",40,830,314,3.895
"42",42,"+1","SEAN PAUL Got 2 Luv U f/Alexis Jordan",651,"+13",126,"-2",2.857,"+0.217",18,"114",42,651,135,2.857
"43",43,"-1","SWEDISH HOUSE MAFIA Save The World",640,"-58",-334,"-39",3.182,"-0.209",55,"160",36,1017,229,4.776
"44",44,"=","BREATHE CAROLINA Blackout",629,"+8",67,"+8",1.449,"+0.073",35,"260",40,629,92,1.449
"45",45,"=","LADY ANTEBELLUM Just A Kiss",581,"+46",235,"+24",2.346,"+0.168",8,"--",45,581,235,2.346
"46",46,"+1","FLO RIDA Good Feeling",580,"+60",367,"+15",2.172,"+0.432",4,"221",46,580,367,2.172
"47",47,"-1","NICOLE SCHERZINGER Don't Hold Your Breat...",572,"+52",440,"-6",1.402,"+0.076",3,"668",46,572,446,1.402
"48",48,"=","KREAYSHAWN Gucci Gucci",520,"+8",-24,"+10",2.398,"+0.094",21,"75",43,546,112,2.568
"49",49,"=","WE THE KINGS Say You Like Me",490,"+5",70,"-38",1.13,"+0.016",10,"--",45,490,320,1.13
"50",50,"--","THE CAB Bad",376,"--",75,"--",0.681,"--",1,"--",50,376,75,0.681
