"","Pos","Pos+","Artist and Title","Spins","Spins+","Bullet","Bullet+","Aud","Aud+","Days","iTunes","PkPos","PkSpins","PkBllt","PkAud"
"1",1,"=","KATY PERRY Last Friday Night (T.G.I.F.)",14814,"-24",-24,"-85",95.844,"-0.373",74,"6",1,14935,2322,96.531
"2",2,"=","LMFAO Party Rock Anthem",13700,"-87",-288,"-93",92.22,"-0.649",91,"4",1,14043,1859,94.193
"3",3,"=","PITBULL Give Me Everything f/Ne-Yo",11513,"-182",-1083,"-59",76.398,"-1.160",91,"12",1,14233,1811,95.596
"4",4,"=","NICKI MINAJ Super Bass",11069,"+15",552,"-108",67.67,"-0.461",91,"9",4,11069,1188,68.131
"5",5,"=","BRITNEY SPEARS I Wanna Go",10820,"+247",1549,"+31",73.597,"+1.497",57,"10",5,10820,1768,73.597
"6",6,"=","ONEREPUBLIC Good Life",9469,"+4",122,"-51",53.555,"+0.493",91,"11",6,9496,978,53.555
"7",7,"=","HOT CHELLE RAE Tonight Tonight",9363,"+65",299,"-17",51.25,"+0.196",91,"7",7,9363,838,51.25
"8",8,"=","LADY GAGA The Edge Of Glory",8907,"-183",-900,"-82",51.949,"-1.319",91,"22",3,11672,2193,68.045
"9",9,"=","LIL WAYNE How To Love",7533,"+127",878,"+28",43.33,"+0.560",66,"8",9,7533,1328,43.33
"10",10,"+1","BAD MEETS EVIL Lighters f/Bruno Mars",7193,"+241",1585,"+76",49.643,"+1.602",45,"5/92",10,7193,1585,49.643
"11",11,"-1","ADELE Rolling In The Deep",7088,"-168",-992,"+2",44.344,"-1.488",91,"16",1,14295,2273,96.15
"12",12,"+1","THE BAND PERRY If I Die Young",5411,"+118",740,"+66",28.438,"+0.745",91,"15",12,5411,740,28.438
"13",13,"-1","DAVID GUETTA/FLO RIDA/NICKI M. Where The...",5340,"+35",190,"-38",26.727,"+0.069",91,"31",12,5340,615,26.932
"14",14,"=","BLACK EYED PEAS Just Can't Get Enough",5030,"-72",-343,"-16",32.597,"-0.674",91,"55",2,13366,715,84.474
"15",15,"=","BEYONCE Best Thing I Never Had",4574,"+20",71,"-6",21.775,"+0.082",63,"27",15,4574,856,22.192
"16",16,"+1","CHRIS BROWN She Ain't You",4328,"+22",269,"-36",22.757,"+0.164",80,"58",16,4328,635,22.757
"17",17,"-1","LUPE FIASCO The Show Goes On",4307,"-102",-842,"+93",23.759,"-0.673",91,"68",6,8825,1043,53.459
"18",18,"=","COBRA STARSHIP You Make Me Feel... f/Sab...",4094,"+69",846,"-73",21.873,"+0.385",57,"18",18,4094,1017,21.873
"19",19,"=","MAROON 5 F/CHRISTINA AGUILERA Moves Like...",3985,"+99",756,"-50",21.343,"+0.766",32,"1",19,3985,951,21.343
"20",20,"=","JENNIFER LOPEZ I'm Into You f/Lil Wayne",3807,"+27",311,"-32",20.561,"-0.048",66,"50",19,3807,611,20.698
"21",21,"=","FOSTER THE PEOPLE Pumped Up Kicks",3319,"+149",974,"+3",19.519,"+1.082",27,"3",21,3319,1009,19.519
"22",22,"+3","RIHANNA Cheers (Drink To That)",3133,"+226",1563,"+12",21.823,"+1.292",13,"36",22,3133,1594,21.823
"23",23,"=","PITBULL Rain Over Me",3132,"+45",544,"-50",18.734,"+0.290",31,"28",23,3132,813,18.734
"24",24,"=","GYM CLASS HEROES Stereo Hearts f/Adam Le...",3034,"+123",817,"+20",15.815,"+0.750",42,"14",24,3034,817,15.815
"25",25,"-3","JASON DERULO Don't Wanna Go Home",2838,"-285",-1922,"+36",13.549,"-1.376",89,"46",9,7292,1463,37.775
"26",26,"=","BLACK EYED PEAS Don't Stop The Party",2599,"+3",341,"-68",10.061,"-0.288",39,"136",25,2599,492,10.349
"27",27,"=","IYAZ Pretty Girls",2316,"+69",306,"+52",10.13,"+0.459",66,"73",27,2316,353,10.13
"28",28,"=","AVRIL LAVIGNE Smile",2062,"+3",31,"+9",8.287,"+0.043",73,"60",27,2064,320,8.325
"29",29,"=","COLDPLAY Every Teardrop Is A Waterfall",1986,"+28",205,"+13",10.35,"+0.037",46,"51",29,1986,446,10.35
"30",30,"=","KELLY ROWLAND Motivation f/Lil Wayne",1709,"+38",289,"-16",7.053,"+0.101",36,"49",30,1709,338,7.053
"31",31,"=","MARTIN SOLVEIG & DRAGONETTE Hello",1650,"+1",-100,"-1",13.696,"-0.489",91,"91",18,4031,605,23.761
"32",32,"=","AFROJACK Take Over Control f/Eva Simons",1443,"+22",108,"+23",15.366,"+0.466",51,"75",32,1443,234,15.366
"33",33,"=","ANDY GRAMMER Keep Your Head Up",1418,"+21",166,"-17",5.081,"+0.116",45,"69",33,1418,280,5.081
"34",34,"+1","THE SCRIPT Nothing",1137,"+43",289,"-66",4.948,"+0.180",11,"200",34,1137,722,4.948
"35",35,"-1","NICOLE SCHERZINGER Right There",985,"-135",-1395,"+196",4.374,"-0.510",75,"99",16,4411,720,21.085
"36",36,"+1","ALEXANDRA STAN Mr. Saxobeat",927,"+36",266,"-1",11.482,"+0.333",17,"61",36,927,267,11.482
"37",37,"+2","DEV In The Dark",894,"+51",328,"+17",6.447,"+0.316",12,"125",37,894,328,6.447
"38",38,"-2","TINIE TEMPAH Till I'm Gone f/Wiz Khalifa",888,"-24",-34,"-55",2.411,"-0.055",21,"164",36,926,293,2.55
"39",39,"-1","MAROON 5 Never Gonna Leave This Bed",829,"-40",-176,"+1",3.623,"-0.133",91,"87",23,2433,312,10.24
"40",40,"+1","CODY SIMPSON On My Mind",820,"+19",74,"+9",2.367,"+0.045",51,"441",40,820,113,2.367
"41",41,"-1","BIG SEAN My Last f/Chris Brown",818,"-19",-244,"+13",4.908,"-0.009",66,"142",37,1099,169,6.66
"42",42,"=","MATT NATHANSON Faster",756,"+9",105,"+5",2.08,"+0.045",29,"106",42,756,166,2.08
"43",43,"=","JOE JONAS See No More",708,"-2",14,"+2",3.553,"+0.051",27,"269",42,737,157,3.688
"44",44,"=","RIHANNA California King Bed",647,"-27",-645,"+172",3.007,"-0.057",86,"59",19,3856,616,16.018
"45",45,"=","LUPE FIASCO Out Of My Head f/Trey Songz",638,"+1",64,"-17",4.602,"+0.052",16,"100",45,638,148,4.602
"46",46,"+1","NEW BOYZ Better With The Lights Off",603,"+27",231,"+5",2.013,"+0.016",5,"63",46,603,233,2.013
"47",47,"-1","JASON ALDEAN/KELLY CLARKSON Don't You Wa...",590,"-4",-31,"-14",2.359,"+0.037",29,"78",46,621,147,2.359
"48",48,"+1","ADELE Someone Like You",531,"+33",228,"+11",3.132,"+0.289",3,"42",48,531,228,3.132
"49",49,"-1","SWEDISH HOUSE MAFIA Save The World",514,"+9",112,"-29",2.369,"-0.058",5,"240",48,514,229,2.427
"50",50,"--","LADY GAGA You And I",487,"--",317,"--",4.311,"--",1,"--",50,487,317,4.311
