"","Pos","Pos+","Artist and Title","Spins","Spins+","Bullet","Bullet+","Aud","Aud+","Days","iTunes","PkPos","PkSpins","PkBllt","PkAud"
"1",1,"=","MAROON 5 F/CHRISTINA AGUILERA Moves Like...",13804,-46,-193,-72,92.022,0.06,106,"5",1,14127,1893,93.336
"2",2,"=","ADELE Someone Like You",13442,-10,290,-76,91.218,-0.435,77,"3",2,13456,2614,91.686
"3",3,"=","GYM CLASS HEROES Stereo Hearts f/Adam Le...",13366,21,203,-185,82.809,0.391,116,"6",2,13366,1685,82.809
"4",4,"=","FOSTER THE PEOPLE Pumped Up Kicks",11484,-46,-583,-1,66.721,-0.343,101,"4",3,12112,1356,70.246
"5",5,"=","COBRA STARSHIP You Make Me Feel... f/Sab...",11095,17,355,-5,68.84,0.158,131,"10",5,11095,1097,68.84
"6",6,"=","DAVID GUETTA Without You f/Usher",9680,117,1133,-158,57.773,0.803,57,"7",6,9680,1586,57.773
"7",7,"=","LADY GAGA You And I",7810,-1,123,-10,42.84,-0.222,75,"15",7,7824,1553,44.474
"8",8,"=","DEV In The Dark",7700,-43,250,-208,50.559,-0.116,86,"19",8,7743,1224,50.675
"9",9,"=","LMFAO Sexy And I Know It",7580,121,1122,-46,49.754,1.064,57,"2",9,7580,1530,49.754
"10",10,"=","LMFAO Party Rock Anthem",6852,-52,-491,3,47.139,-0.397,165,"12/85",1,14043,1859,94.193
"11",11,"=","RIHANNA We Found Love f/Calvin Harris",6675,135,1155,-81,45.317,0.927,28,"1",11,6675,2184,45.317
"12",12,"=","BAD MEETS EVIL Lighters f/Bruno Mars",6310,-143,-1195,183,38.741,-0.601,119,"45",2,11835,1599,78.403
"13",13,"=","PITBULL Give Me Everything f/Ne-Yo",5981,-33,-419,14,41.774,-0.525,165,"32",1,14233,1811,95.596
"14",14,"=","JASON DERULO It Girl",5814,-1,257,-39,27.282,0.015,66,"13",14,5815,1048,27.337
"15",15,"=","NICKI MINAJ Super Bass",5635,-99,-402,-70,38.251,-0.798,165,"22",3,12009,1188,73.23
"16",16,"=","KATY PERRY Last Friday Night (T.G.I.F.)",5100,-7,-477,113,26.896,-0.284,148,"48",1,14935,2322,96.531
"17",17,"+1","KELLY CLARKSON Mr. Know It All",5021,52,305,42,24.953,0.067,49,"14",17,5021,1093,24.953
"18",18,"-1","BRITNEY SPEARS I Wanna Go",4932,-82,-987,114,32.718,-0.421,131,"60",1,12853,1768,82.422
"19",19,"=","ALEXANDRA STAN Mr. Saxobeat",4546,-7,81,-38,37.901,-0.327,91,"43",19,4585,673,38.816
"20",20,"=","THE SCRIPT Nothing",4144,-51,-175,-54,19.958,-0.076,85,"37",18,4360,722,20.667
"21",21,"=","BRUNO MARS It Will Rain",3469,191,1337,33,19.709,0.94,20,"21",21,3469,1337,19.709
"22",22,"=","ANDY GRAMMER Keep Your Head Up",3133,-44,2,-107,13.759,-0.134,119,"94",21,3187,355,13.893
"23",23,"=","KATY PERRY The One That Got Away",3055,170,1573,-58,18.013,1.667,16,"66",23,3055,1631,18.013
"24",24,"=","NICKI MINAJ Fly f/Rihanna",2914,128,616,-20,14.804,1.183,35,"28",23,2914,700,14.804
"25",25,"=","BRITNEY SPEARS Criminal",2738,63,544,-70,13.511,0.588,32,"47",25,2738,669,13.511
"26",26,"+1","FLO RIDA Good Feeling",2554,197,867,146,13.791,1.09,28,"16",26,2554,867,13.791
"27",27,"-1","LIL WAYNE How To Love",2439,-45,-249,-47,16.534,-0.355,140,"31",9,8047,1328,45.275
"28",28,"=","SELENA GOMEZ & THE SCENE Love You Like A...",2377,59,361,-5,11.957,0.311,61,"27",26,2377,366,11.957
"29",29,"=","RIHANNA Cheers (Drink To That)",2151,-142,-1444,197,11.078,-0.796,87,"20",10,8085,1594,43.942
"30",30,"=","NEW BOYZ Better With The Lights Off",2096,-181,-652,-209,7.664,-0.73,79,"51",23,2777,423,10.454
"31",31,"=","LLOYD Dedication To My Ex...",1806,-2,157,-22,5.883,-0.013,50,"141",29,1808,315,6.04
"32",32,"=","PATRICK STUMP This City f/Lupe Fiasco",1622,-104,-378,-110,6.731,-0.709,56,"195",25,2046,386,8.768
"33",33,"=","GAVIN DEGRAW Not Over You",1510,43,127,34,6.391,0.409,59,"38",31,1510,310,6.391
"34",34,"=","JESSIE J Domino",1482,22,200,-8,6.101,0.084,37,"63",34,1482,335,6.101
"35",35,"=","NICOLE SCHERZINGER Don't Hold Your Breat...",1280,15,34,5,3.629,0.097,27,"214",35,1280,446,3.629
"36",36,"+2","T-PAIN 5 O'clock f/Wiz Khalifa",1277,134,463,89,10.085,0.852,15,"17",36,1277,463,10.085
"37",37,"-1","HOT CHELLE RAE I Like It Like That f/New...",1270,49,278,51,5.318,0.286,23,"75",36,1270,407,5.318
"38",38,"+1","LADY ANTEBELLUM Just A Kiss",1172,43,172,22,4.956,0.308,32,"29",38,1172,262,4.956
"39",39,"-2","THE BAND PERRY If I Die Young",1138,-43,-128,-28,7.611,-0.41,165,"35",11,6052,768,32.555
"40",40,"=","NICKELBACK When We Stand Together",1135,8,184,-20,4.105,-0.016,21,"50",38,1135,457,4.121
"41",41,"=","ENRIQUE IGLESIAS I Like How It Feels",1111,-1,111,-41,5.475,-0.184,21,"265",38,1112,322,5.77
"42",42,"+1","BREATHE CAROLINA Blackout",1049,28,115,-2,4.26,0.254,59,"119",40,1049,154,4.26
"43",43,"-1","JENNIFER LOPEZ Papi",1033,-2,133,-98,4.664,-0.012,15,"135",41,1035,488,4.676
"44",44,"=","SEAN PAUL Got 2 Luv U f/Alexis Jordan",978,9,102,16,3.991,0.186,42,"92",41,978,196,3.991
"45",45,"=","AFROJACK Take Over Control f/Eva Simons",905,-40,-346,62,10.309,-0.528,125,"67",24,2836,435,23.455
"46",46,"=","DRAKE Headlines",781,31,292,-12,5.477,0.439,7,"24",46,781,304,5.477
"47",47,"=","BEYONCE Countdown",650,7,132,-32,1.654,0.129,8,"--",47,650,255,1.654
"48",48,"=","WE THE KINGS Say You Like Me",620,9,10,12,1.327,0.036,34,"--",45,620,320,1.377
"49",49,"=","COLDPLAY Paradise",579,12,16,-26,2.219,-0.117,9,"9",47,623,250,2.495
"50",50,"=","THE CAB Bad",437,-5,-4,-10,0.832,-0.018,6,"--",50,442,83,0.85
