"Pos","Pos.","Artist.and.Title","Spins","Spins.","Bullet","Bullet.","Aud","Aud.","Days","iTunes","PkPos","PkSpins","PkBllt","PkAud"
1,"=","KELLY CLARKSON Stronger (What Doesn't Ki...",13475,"-6",66,"-173",98.511,"-0.156",71,"7",1,13549,2321,99.332
2,"+1","DAVID GUETTA Turn Me On f/Nicki Minaj",12287,"+120",471,"+115",90.088,"+0.573",99,"15",2,12287,1674,90.088
3,"-1","ADELE Set Fire To The Rain",12159,"-14",-837,"-10",93.97,"-0.625",115,"11",1,13928,2301,95.946
4,"=","WANTED Glad You Came",10204,"+177",1087,"+113",74.177,"+0.874",71,"2",4,10204,1330,74.177
5,"=","GYM CLASS HEROES Ass Back Home",10128,"+134",782,"+59",72.116,"+0.700",116,"23",4,10128,1379,72.116
6,"=","JESSIE J Domino",9213,"-89",-1273,"+81",60.349,"-0.872",185,"28",2,12024,1524,67.403
7,"+1","KATY PERRY Part Of Me",8760,"+166",1055,"+64",61.96,"+1.031",35,"10",7,8760,3625,61.96
8,"-1","PITBULL F/CHRIS BROWN International Love",8646,"+20",-378,"+38",61.849,"-0.671",137,"21",5,9155,1086,62.67
9,"=","FLO RIDA Good Feeling",7671,"-41",-760,"+49",57.884,"-0.577",176,"25",1,13154,1657,85.747
10,"=","WIZ KHALIFA/SNOOP DOGG Young, Wild & Fre...",7182,"+57",63,"+44",48.489,"-0.066",116,"13",10,7182,1174,48.863
11,"=","RIHANNA We Found Love f/Calvin Harris",6804,"-71",-655,"-57",57.53,"-0.493",176,"43",1,14238,2184,95.593
12,"=","DRAKE Take Care f/Rihanna",6791,"+114",718,"+32",56.44,"+0.382",72,"14",12,6791,1220,56.44
13,"=","FUN. We Are Young f/Janelle Monae",6475,"+442",2535,"+189",52.307,"+3.116",26,"1",13,6475,2535,52.307
14,"=","CALVIN HARRIS Feel So Close",5998,"+72",554,"-188",44.761,"-0.253",39,"12",13,5998,1329,45.121
15,"=","OUTASIGHT Tonight Is The Night",5907,"+96",280,"+63",35.623,"+0.471",139,"40",13,5907,572,35.623
16,"+1","NICKI MINAJ Starships",5255,"+97",537,"-116",37.233,"+0.855",34,"6/57",16,5255,1834,37.233
17,"+1","FLO RIDA Wild Ones f/Sia",4878,"+183",1148,"+82",38.467,"+1.291",44,"4",17,4878,1148,38.467
18,"+1","CHRIS BROWN Turn Up The Music",4758,"+86",307,"+21",31.914,"+0.897",47,"19",18,4758,987,31.914
19,"+3","KARMIN Broken Hearted",3567,"+183",834,"+108",22.487,"+1.146",29,"45",19,3567,928,22.487
20,"+1","TRAIN Drive By",3553,"+29",180,"-95",19.542,"+0.151",64,"8",20,3553,527,19.542
21,"+2","ONE DIRECTION What Makes You Beautiful",3479,"+140",1305,"-50",21.691,"+0.840",19,"5",21,3479,1355,21.691
22,"+2","B.O.B So Good",2259,"+144",701,"+41",19.598,"+0.790",16,"24",22,2259,826,19.598
23,"+3","CHRISTINA PERRI A Thousand Years",2001,"+87",148,"+40",9.423,"+0.700",74,"33",23,2001,280,9.423
24,"+1","COLDPLAY Princess Of China",1989,"-23",-43,"-21",10.408,"-0.098",114,"54",24,2042,363,10.812
25,"+2","RIHANNA Talk That Talk f/Jay Z",1841,"+58",338,"+2",11.359,"+0.209",41,"55",25,1841,339,11.359
26,"+2","ADELE Rumour Has It",1790,"+155",793,"+87",10.191,"+0.693",15,"30",26,1790,793,10.191
27,"+2","GOTYE Somebody That I Used To Know",1662,"+104",587,"+39",12.31,"+0.773",18,"3",27,1662,587,12.31
28,"+3","JASON DERULO Breathing",1573,"+76",130,"+65",6.744,"+0.718",44,"138",28,1573,432,6.744
29,"+3","DEV & ENRIQUE IGLESIAS Naked",1501,"+52",175,"+45",8.49,"+0.444",58,"156",29,1501,318,8.49
30,"=","JAY Z & KANYE WEST N***** In Paris",1476,"-30",-195,"-9",11.462,"-0.227",134,"48",15,5155,785,36.602
31,"+2","J. COLE Workout",1275,"-6",-150,"+90",11.902,"+0.087",147,"93",12,5803,659,35.209
32,"+2","TYGA Rack City",1171,"-24",-80,"-23",5.232,"-0.305",52,"22",32,1257,287,8.937
33,"+3","DRAKE The Motto f/Lil Wayne",1115,"+3",122,"+5",11.258,"+0.418",29,"18",33,1115,237,11.258
34,"+3","HAVANA BROWN We Run The Night f/Pitbull",1108,"+27",68,"+32",10.233,"+0.217",36,"83",34,1125,237,10.526
35,"+3","ELLIE GOULDING Lights",1052,"+27",87,"-11",5.037,"+0.201",38,"80",35,1052,201,5.037
36,"+3","K'NAAN F/NELLY FURTADO Is Anybody Out Th...",1012,"+33",93,"-25",6.791,"+0.028",15,"258",36,1012,461,6.791
37,"-2","LMFAO Sorry For Party Rocking",941,"-188",-1306,"+49",4.061,"-0.792",69,"68",19,3980,1009,16.853
38,"+2","CARLY RAE JEPSEN Call Me Maybe",850,"+24",368,"-22",4.236,"+0.369",8,"9",38,850,410,4.236
39,"+2","ALL-AMERICAN REJECTS Beekeeper's Daughte...",764,"+0",9,"-8",2.637,"-0.009",30,"697",39,768,204,2.646
40,"+3","NEON HITCH F U Betta",714,"+29",176,"+26",1.908,"+0.139",15,"804",40,714,201,1.908
41,"+1","DEMI LOVATO Give Your Heart A Break",708,"+16",104,"-3",4.043,"+0.040",19,"89",41,708,107,4.043
42,"+2","CHIDDY BANG Ray Charles",653,"-12",-45,"-29",2.01,"+0.015",31,"469",41,711,150,2.02
43,"+2","CHRIS RENE Young Homie",571,"+20",97,"+5",1.566,"-0.012",8,"59",43,571,171,1.578
44,"+3","J. COLE Can't Get Enough f/Trey Songz",537,"+19",103,"-6",3.373,"+0.217",8,"122",44,537,156,3.373
45,"+1","CADY GROVES This Little Girl",537,"+3",4,"+9",1.118,"-0.018",25,"657",44,553,89,1.158
46,"--","USHER Climax",488,"--",283,"--",2.673,"--",1,"44",46,488,283,2.673
47,"+1","SEAN PAUL She Doesn't Mind",483,"+9",137,"-10",1.8,"+0.064",8,"219",47,483,158,1.8
48,"+2","WALLPAPER F**king Best Song Everrr",480,"+50",171,"+27",2.999,"+0.300",3,"--",48,480,175,2.999
49,"=","AVICII Levels",446,"+5",-82,"+46",3.829,"-0.194",74,"108",33,1352,260,9.722
50,"--","CHILDISH GAMBINO Heartbeat",360,"--",-195,"--",1.534,"--",55,"135",43,667,131,2.366
