"Pos","Pos.","Artist.and.Title","Spins","Spins.","Bullet","Bullet.","Aud","Aud.","Days","iTunes","PkPos","PkSpins","PkBllt","PkAud"
1,"=","GOTYE Somebody That I Used To Know",14242,"+30",1027,"-206",106.337,"-0.057",83,"2",1,14242,2018,106.394
2,"=","FUN. We Are Young f/Janelle Monae",13073,"-87",-710,"+36",98.357,"-0.725",91,"4",1,14439,2738,110.772
3,"=","FLO RIDA Wild Ones f/Sia",12406,"-49",-99,"-9",93.219,"-0.313",109,"5",2,12595,1940,93.589
4,"=","NICKI MINAJ Starships",12059,"+29",454,"-37",87.938,"+0.235",99,"10/40",4,12059,1834,87.938
5,"=","ONE DIRECTION What Makes You Beautiful",11267,"+37",528,"-74",75.447,"+0.512",84,"9",5,11267,1579,75.447
6,"+1","CARLY RAE JEPSEN Call Me Maybe",10009,"+238",1488,"+66",75.917,"+2.048",73,"1",6,10009,1488,75.917
7,"-1","WANTED Glad You Came",9900,"-110",-748,"+68",77.45,"-0.845",136,"16",1,13712,1363,101.962
8,"=","MAROON 5 Payphone f/Wiz Khalifa",8798,"+174",1137,"+0",63.261,"+1.295",37,"3",8,8798,3415,63.261
9,"=","ADELE Rumour Has It",6720,"-234",-1433,"-124",39.032,"-1.526",80,"44",8,8497,1514,56.313
10,"+1","JUSTIN BIEBER Boyfriend",6608,"-12",-198,"+20",40.666,"-0.018",58,"6",9,7937,4726,51.492
11,"-1","KATY PERRY Part Of Me",6570,"-88",-1541,"+170",51.424,"-0.626",100,"37",3,12039,3625,78.553
12,"=","KARMIN Broken Hearted",6387,"-7",325,"-49",39.189,"+0.252",94,"--",12,6394,936,39.189
13,"+1","USHER Scream",6259,"+155",1180,"-29",42.37,"+0.897",27,"7",13,6259,2323,42.37
14,"-1","KELLY CLARKSON Stronger (What Doesn't Ki...",6152,"-45",-631,"+107",42.783,"-0.116",136,"28",1,13549,2321,99.332
15,"=","TRAIN Drive By",6101,"+2",126,"+5",34.53,"+0.217",129,"14",14,6123,601,35.3
16,"=","RIHANNA Where Have You Been",5837,"+133",840,"+41",42.456,"+1.560",38,"13",16,5837,1884,42.456
17,"=","CALVIN HARRIS Feel So Close",5287,"-132",-776,"-8",38.139,"-0.926",104,"30",7,8145,1329,55.352
18,"=","PITBULL Back In Time",4977,"+49",308,"-44",30.712,"-0.108",55,"8",18,4977,925,30.82
19,"=","ELLIE GOULDING Lights",4686,"+95",539,"-46",30.546,"+0.825",103,"22",19,4686,786,30.546
20,"=","DRAKE Take Care f/Rihanna",3821,"-106",-621,"-37",31.835,"-0.678",137,"69",8,7620,1220,60.618
21,"+1","DAVID GUETTA Titanium f/Sia",3512,"+148",559,"+94",24.788,"+0.852",45,"18",21,3512,694,24.788
22,"-1","DEMI LOVATO Give Your Heart A Break",3400,"+13",248,"-54",22.057,"-0.061",84,"32",21,3400,665,22.118
23,"+1","GYM CLASS HEROES Fighter f/Ryan Tedder",2860,"+206",1412,"+96",17.078,"+1.273",23,"58",23,2860,1412,17.078
24,"-1","JENNIFER LOPEZ Dance Again f/Pitbull",2593,"-238",-1595,"-80",15.069,"-1.021",54,"20",17,4851,2243,30.831
25,"=","HAVANA BROWN We Run The Night f/Pitbull",2511,"+34",278,"+0",19.623,"+0.221",101,"50",24,2511,278,19.623
26,"+1","RITA ORA How We Do (Party)",1946,"+63",298,"+19",10.866,"+0.278",27,"153",26,1946,620,10.866
27,"-1","CHRIS RENE Young Homie",1932,"+10",88,"-5",8.669,"+0.115",73,"125",25,1932,226,8.669
28,"=","TAYLOR SWIFT Eyes Open",1429,"-57",-498,"+49",6.764,"-0.195",59,"43",20,3925,1442,22.308
29,"+1","CALVIN HARRIS Let's Go f/Ne-Yo",1403,"+68",459,"+6",12.706,"+0.445",25,"94",29,1403,459,12.706
30,"+4","KIRKO BANGZ Drank In My Cup",1347,"+56",312,"+37",5.868,"+0.334",50,"65",30,1347,312,5.868
31,"=","HOT CHELLE RAE Honestly",1339,"+8",130,"+7",5.937,"+0.015",52,"127",30,1339,284,5.937
32,"-3","DRAKE The Motto f/Lil Wayne",1314,"-38",-315,"+18",13.373,"-0.338",94,"42",25,2047,321,19.147
33,"=","NEON HITCH F U Betta",1250,"-75",-462,"-56",6.372,"-0.329",80,"--",28,1758,247,7.978
34,"-2","B.O.B So Good",1209,"-118",-600,"-38",5.296,"-0.546",81,"--",18,4675,1013,31.923
35,"=","ONE DIRECTION One Thing",1205,"+62",543,"-9",8.152,"+0.192",17,"78",35,1205,552,8.152
36,"=","NEON TREES Everybody Talks",1074,"+5",81,"-25",5.29,"+0.009",44,"--",33,1074,211,5.29
37,"=","GROUPLOVE Tongue Tied",1015,"+28",197,"+8",4.69,"+0.248",29,"79",36,1015,284,4.69
38,"+2","THE WANTED Chasing The Sun",914,"+55",410,"+23",8.732,"+0.323",19,"--",38,914,410,8.732
39,"-1","COLDPLAY Paradise",883,"+11",119,"-6",5.921,"+0.070",63,"54",37,892,255,5.921
40,"-1","JASON MRAZ I Won't Give Up",873,"+11",49,"-4",4.145,"+0.053",38,"--",36,873,210,4.145
41,"=","B.O.B Both Of Us f/Taylor Swift",840,"+58",478,"-8",4.506,"+0.212",10,"90",41,840,486,4.506
42,"=","NELLY FURTADO Big Hoops (Bigger The Bett...",754,"+0",125,"-33",2.384,"+0.074",18,"--",40,754,318,2.384
43,"=","CHER LLOYD Want U Back",707,"+41",299,"+0",2.742,"+0.181",11,"77",43,707,335,2.742
44,"=","OUTASIGHT Now Or Never",543,"+17",145,"-10",1.459,"+0.043",13,"--",44,543,206,1.459
45,"=","SAMMY ADAMS Only One",436,"+24",227,"+7",1.501,"+0.028",4,"--",45,436,227,1.501
46,"=","THE CAB La La",381,"+6",7,"-1",0.799,"+0.005",46,"--",45,381,82,0.904
47,"=","RIHANNA Birthday Cake",345,"+1",-11,"+2",1.354,"+0.005",51,"63",40,479,116,1.742
48,"+1","SELENA GOMEZ & THE SCENE Hit The Lights",337,"-1",-37,"+0",1.27,"-0.081",27,"--",44,379,75,1.54
49,"-1","KEVIN RUDOLF Don't Give Up",336,"-3",-23,"-3",0.648,"-0.015",24,"--",45,359,132,0.708
50,"--","KATY PERRY Wide Awake",300,"--",257,"--",2.838,"--",1,"21",50,300,257,2.838
