"","Pos","Pos+","Artist and Title","Spins","Spins+","Bullet","Bullet+","Aud","Aud+","Days","iTunes","PkPos","PkSpins","PkBllt","PkAud"
"1",1,"=","KELLY CLARKSON Stronger (What Doesn't Ki...",13446,39,460,-15,85.972,0.411,65,"3",1,13446,2321,85.972
"2",2,"=","ADELE Set Fire To The Rain",12882,-113,-695,-71,86.953,-0.438,109,"10",1,13928,2301,91.812
"3",3,"=","DAVID GUETTA Turn Me On f/Nicki Minaj",11904,88,318,56,75.945,0.997,93,"15",3,11904,1674,75.945
"4",4,"=","JESSIE J Domino",10243,-243,-1426,-168,57.572,-0.804,179,"23",2,12024,1524,67.403
"5",5,"=","GYM CLASS HEROES Ass Back Home",9400,54,612,-17,59.119,-0.114,110,"19",5,9400,1379,59.233
"6",6,"=","WANTED Glad You Came",9266,150,984,16,57.473,1.081,65,"2",6,9266,1330,57.473
"7",7,"=","PITBULL F/CHRIS BROWN International Love",9011,-13,-45,-24,56.845,0.01,131,"20",5,9155,1086,56.845
"8",8,"=","FLO RIDA Good Feeling",8282,-149,-913,-60,54.437,-1.554,170,"26",1,13154,1657,85.747
"9",9,"=","KATY PERRY Part Of Me",7807,103,912,-71,49.01,0.669,29,"9",9,7807,3625,49.01
"10",10,"=","RIHANNA We Found Love f/Calvin Harris",7272,-186,-1050,-60,51.371,-1.059,170,"35",1,14238,2184,95.593
"11",11,"=","WIZ KHALIFA/SNOOP DOGG Young, Wild & Fre...",7163,44,370,17,43.942,0.149,110,"12",10,7163,1174,43.942
"12",12,"=","DRAKE Take Care f/Rihanna",6158,85,401,43,46.906,0.746,66,"14",12,6158,1220,46.906
"13",13,"+1","OUTASIGHT Tonight Is The Night",5666,39,187,-30,30.292,0.242,133,"36",13,5666,572,30.292
"14",14,"-1","BRUNO MARS It Will Rain",5634,-112,-544,-92,30.987,-0.466,162,"51",1,13635,2024,86.477
"15",15,"=","CALVIN HARRIS Feel So Close",5585,141,1306,-23,38.305,0.67,33,"13",15,5585,1329,38.305
"16",16,"=","GAVIN DEGRAW Not Over You",5236,-102,-931,45,28.77,-0.953,201,"39",10,7039,547,37.933
"17",17,"=","NICKI MINAJ Starships",4812,94,909,-22,29.347,0.416,28,"5/61",17,4812,1834,29.347
"18",18,"=","CHRIS BROWN Turn Up The Music",4459,8,313,-108,25.117,-0.048,41,"21",18,4459,987,25.165
"19",19,"=","FUN. We Are Young f/Janelle Monae",4252,312,1810,130,32.597,2.817,20,"1",19,4252,1810,32.597
"20",20,"=","FLO RIDA Wild Ones f/Sia",3865,135,706,59,27.847,0.471,38,"4",20,3865,973,27.847
"21",21,"=","TRAIN Drive By",3407,34,478,-49,15.322,0.078,58,"8",21,3407,527,15.322
"22",22,"=","KARMIN Broken Hearted",2819,86,637,-64,15.211,0.768,23,"60",22,2819,928,15.211
"23",23,"+1","ONE DIRECTION What Makes You Beautiful",2378,204,1101,93,13.134,1.052,13,"11",23,2378,1101,13.134
"24",24,"+1","COLDPLAY Princess Of China",2035,3,45,8,9.161,-0.133,108,"45",24,2035,363,9.624
"25",25,"-2","LMFAO Sorry For Party Rocking",1957,-290,-1659,-209,7.201,-0.973,63,"58",19,3980,1009,16.853
"26",26,"=","CHRISTINA PERRI A Thousand Years",1882,29,238,4,8.836,0.158,68,"29",26,1882,280,8.836
"27",27,"+1","B.O.B So Good",1662,104,747,-8,14.966,0.838,10,"32",27,1662,826,14.966
"28",28,"-1","JAY Z & KANYE WEST N***** In Paris",1640,-31,-273,37,10.349,-0.148,128,"42",15,5155,785,36.602
"29",29,"=","RIHANNA Talk That Talk f/Jay Z",1544,41,307,-10,7.759,0.451,35,"48",29,1544,317,7.759
"30",30,"=","JASON DERULO Breathing",1433,-10,24,-42,4.723,-0.127,38,"163",30,1448,432,5.108
"31",31,"=","J. COLE Workout",1363,-61,-496,-33,11.305,-0.546,141,"90",12,5803,659,35.209
"32",32,"=","DEV & ENRIQUE IGLESIAS Naked",1353,27,160,-1,5.307,0.269,52,"165",32,1353,318,5.307
"33",33,"=","TYGA Rack City",1249,-2,46,-27,5.214,-0.121,46,"18",32,1251,287,8.937
"34",34,"=","GOTYE Somebody That I Used To Know",1132,59,385,18,7.664,0.545,12,"6",34,1132,385,7.664
"35",35,"+1","ADELE Rumour Has It",1093,96,463,62,5.762,0.429,9,"34",35,1093,475,5.762
"36",36,"-1","HAVANA BROWN We Run The Night f/Pitbull",1078,38,197,6,8.353,0.424,30,"75",35,1078,237,8.353
"37",37,"=","DRAKE The Motto f/Lil Wayne",1011,18,139,-18,7.472,-0.253,23,"17",36,1011,237,8.682
"38",38,"=","ELLIE GOULDING Lights",974,9,109,-31,3.856,0.017,32,"78",38,974,201,3.856
"39",39,"=","K'NAAN F/NELLY FURTADO Is Anybody Out Th...",936,17,425,-36,5.287,0.103,9,"309",39,936,461,5.287
"40",40,"=","ALL-AMERICAN REJECTS Beekeeper's Daughte...",758,3,39,-9,2.012,0.023,24,"737",40,762,204,2.012
"41",41,"=","CHIDDY BANG Ray Charles",700,2,73,-6,1.881,0.088,25,"394",41,700,150,1.881
"42",42,"=","DEMI LOVATO Give Your Heart A Break",610,6,23,12,2.908,0.072,13,"183",42,610,96,2.908
"43",43,"+1","NEON HITCH F U Betta",550,12,140,-17,1.043,0.029,9,"--",43,550,201,1.043
"44",44,"+1","CADY GROVES This Little Girl",539,6,43,0,1.04,0.009,19,"--",44,539,89,1.04
"45",45,"-2","CHILDISH GAMBINO Heartbeat",536,-19,-123,-15,1.992,0.001,51,"--",43,667,131,2.366
"46",46,"+1","CARLY RAE JEPSEN Call Me Maybe",534,52,334,20,1.894,0.128,2,"7",46,534,334,1.894
"47",47,"+1","CHRIS RENE Young Homie",497,23,166,2,1.243,0.127,2,"408",47,497,166,1.243
"48",48,"-2","AVICII Levels",481,-46,-408,13,5.124,-0.506,68,"98",33,1352,260,9.722
"49",49,"=","J. COLE Can't Get Enough f/Trey Songz",453,19,150,13,2.075,0.013,2,"--",49,453,150,2.075
"50",50,"=","SEAN PAUL She Doesn't Mind",371,25,97,22,1.062,0.06,2,"242",50,371,97,1.062
