"Pos","Pos+","Artist and Title","Spins","Spins+","Bullet","Bullet+","Aud","Aud+","Days","iTunes","PkPos","PkSpins","PkBllt","PkAud"
1,"+1","BIG SEAN Marvin & Chardonnay",3516,21,108,1,22.451,0.293,85,"44",1,3516,552,22.451
2,"-1","MIGUEL Quickie",3510,-21,150,-54,21.977,-0.225,102,"174",1,3628,553,23.786
3,"=","JAY Z & KANYE WEST Otis f/Otis Redding",3407,-47,-264,-38,22.998,-0.183,66,"45",1,3830,1048,24.559
5,"-1","BEYONCE Best Thing I Never Had",3290,-54,-129,-32,19.322,-0.21,112,"67",2,3535,520,21.086
4,"+1","DRAKE Headlines",3290,36,302,-5,23.016,0.364,49,"25",4,3290,686,23.016
6,"=","LIL WAYNE How To Love",3069,-30,-196,-13,19.257,-0.303,114,"15",1,4266,891,27.756
7,"+1","LIL WAYNE She Will f/Drake",3000,104,325,82,19.863,0.778,42,"249",7,3000,954,19.863
8,"-1","DJ KHALED I'm On One f/Drake, Rick Ross",2980,-52,-137,-60,22.178,-0.304,131,"54",1,4543,989,32.584
9,"=","WALE That Way f/Jeremih & Rick Ross",2789,27,252,-5,17.839,0.399,95,"155",9,2789,421,17.839
10,"=","CHRIS BROWN Wet The Bed",2542,52,279,25,16.94,0.321,61,"254",10,2542,405,16.94
11,"=","MINDLESS BEHAVIOR Mrs. Right f/Diggy Sim...",2490,10,269,-68,15.208,0.182,64,"--",10,2490,388,15.208
12,"=","DRAKE Marvin's Room",2285,-33,-170,-12,17.719,-0.191,91,"60",8,2476,460,19.185
13,"+1","JAY Z & KANYE WEST N***** In Paris",1828,30,405,-38,14.664,0.224,26,"--",13,1828,594,14.664
14,"-1","KELLY ROWLAND Motivation f/Lil Wayne",1823,-71,-287,-42,14.19,-0.59,137,"56",1,4671,741,34.283
15,"+1","MEEK MILL I'm A Boss f/Rick Ross",1522,-4,195,-43,7.717,-0.129,54,"411",15,1526,319,7.901
16,"-1","NICKI MINAJ Super Bass",1515,-32,-342,17,8.304,-0.322,108,"20",4,3412,554,20.752
17,"+1","ACE HOOD Body 2 Body f/Chris Brown",1491,64,95,93,8.57,0.239,68,"--",16,1491,229,8.57
18,"-1","LUPE FIASCO Out Of My Head f/Trey Songz",1443,-25,-216,12,9.21,-0.252,137,"318",9,2490,303,17.864
19,"=","TREY SONGZ Unusual f/Drake",1129,-41,-167,-28,7.801,-0.301,137,"--",6,3159,477,20.6
20,"=","MONICA Anything f/Rick Ross & Lil Kim",1122,-35,-190,-8,6.196,-0.352,72,"--",17,1445,311,9.022
21,"+1","J. COLE Workout",1088,31,90,28,5.016,0.228,56,"--",21,1088,255,5.016
22,"+1","DIGGY Copy, Paste",1033,37,85,44,7.181,0.328,47,"--",22,1033,239,7.181
23,"-2","RIHANNA Man Down",1031,-36,-103,-26,6.987,-0.508,137,"--",8,2726,421,17.159
24,"=","LLOYD Dedication To My Ex...",1003,9,89,-20,4.852,0.011,45,"273",24,1003,234,4.904
25,"=","HAMILTON PARK Thing Called Us",998,10,1,8,3.785,0.04,77,"--",22,1012,182,3.794
26,"+4","BEYONCE Party f/Kanye & Andre",994,119,418,103,8.605,0.597,28,"--",26,994,418,8.605
27,"-1","MARSHA AMBROSIUS Late Nights & Early Mor...",979,22,-20,28,5.516,0.112,39,"--",23,1005,288,5.71
28,"-1","NICKI MINAJ Fly f/Rihanna",964,16,128,-7,6.352,0.18,23,"57",27,964,389,6.352
29,"-1","VERSE SIMMONDS Boo Thang f/Kelly Rowland",957,16,3,17,3.828,0.07,70,"--",26,966,244,3.872
30,"-1","TYRESE Too Easy f/Ludacris",904,27,139,5,4.18,0.122,29,"--",29,904,309,4.557
31,"+1","FUTURE Tony Montana",851,41,272,5,4.17,0.198,51,"--",31,851,300,4.17
32,"-1","DJ DRAMA Oh My f/Fab, Wiz, Roscoe",799,-55,-232,-28,4.628,-0.329,137,"848",13,1842,363,11.166
33,"=","YOUNG JEEZY Shake Life",756,-47,-169,-24,3.209,-0.217,50,"--",24,954,331,4.016
34,"=","KELLY ROWLAND Lay It On Me f/Big Sean",672,14,129,-7,3.036,0.124,15,"308",34,672,332,3.036
35,"+1","BEI MAEJOR Trouble f/J. Cole",641,16,123,-4,3.196,0.084,18,"566",35,641,186,3.196
36,"-1","MELANIE FIONA 4 AM",639,7,78,-10,2.817,0.006,25,"736",34,639,209,2.817
37,"+1","ELLE VARNER Only Wannna Give It To You",616,38,281,-7,3.287,0.226,8,"--",37,616,288,3.287
38,"+1","PHYLLISIA I Love You f/Yung Joc",571,9,145,-29,1.776,0.011,21,"--",38,571,176,1.776
39,"+1","RED CAFE Fly Together f/Rick Ross",541,-10,149,-60,2.52,-0.064,10,"--",39,551,259,2.813
40,"-3","GAME Pot Of Gold f/Chris Brown",523,-65,-284,-33,1.739,-0.258,71,"--",23,963,333,3.453
41,"+1","CEE LO GREEN Fool For You f/Melanie Fion...",481,-12,33,-32,3.048,-0.1,32,"482",39,493,174,3.357
42,"-1","CJ HILTON So Fresh f/Nas",476,-43,-183,-26,1.818,-0.217,85,"--",26,902,282,3.862
43,"+1","FRANK OCEAN Swim Good",446,10,2,11,2.01,-0.058,27,"--",40,453,326,2.15
44,"-1","2 CHAINZ Spend It",425,-13,19,-27,1.993,-0.091,44,"--",43,438,111,2.213
46,"-1","J. DASH WOP",420,1,-18,-13,0.976,-0.012,19,"199",41,440,135,1.059
45,"+1","BIRDMAN Y.U. Mad f/Nicki Minaj",420,73,254,48,2.454,0.283,3,"41",45,420,254,2.454
47,"=","CALI SWAG DISTRICT Burn Out (Drive Fast)",312,18,36,20,0.9,-0.005,11,"--",46,312,69,0.905
48,"+1","BOOM MAN Up In Here f/2 Chainz/Yo Gotti",273,11,7,19,0.579,-0.015,16,"--",47,273,35,0.703
49,"+1","ROSCOE DASH Good Good Night",272,16,76,12,0.764,0.036,4,"--",49,272,85,0.764
50,"-2","KIYANA Take Me Away",264,1,-19,9,0.961,0.053,15,"--",46,291,43,0.961
