"Pos","Pos+","Artist and Title","Spins","Spins+","Bullet","Bullet+","Aud","Aud+","Days","PkPos","PkSpins","PkBllt","PkAud"
1,"=","KELLY ROWLAND Motivation f/Lil Wayne",4546,-6,174,-21,33.583,0.055,29,1,4588,741,33.687
2,"=","MIGUEL Sure Thing",4089,-15,270,24,29.835,-0.026,29,1,4364,460,30.251
3,"=","BIG SEAN My Last f/Chris Brown",3511,3,289,-52,23.908,-0.246,29,3,3511,461,24.154
4,"=","CHRIS BROWN She Ain't You",3402,17,529,-49,23.816,-0.094,29,4,3402,630,23.91
5,"=","MARSHA AMBROSIUS Far Away",3061,9,334,3,19.727,-0.089,29,5,3066,397,19.884
6,"=","CHRIS BROWN Look At Me Now",2805,-11,-63,2,21.385,-0.09,29,2,3494,0,26.238
7,"=","DJ KHALED I'm On One f/Drake, Rick Ross",2631,106,934,-21,19.371,0.503,23,7,2631,955,19.371
8,"=","ACE HOOD Hustle Hard",2328,-6,-17,13,13.899,0.1,29,7,2503,97,14.627
9,"=","YC Racks f/Future",2189,-44,-359,5,11.111,-0.175,29,4,3411,104,19.707
10,"=","LLOYD Cupid",2138,-2,127,-6,12.592,-0.082,29,10,2145,195,12.674
11,"=","JAMIE FOXX Best Night Of My Life",2054,10,186,-25,11.976,0.03,29,11,2054,311,11.976
12,"=","NICKI MINAJ Did It On'em",1997,-20,-118,7,10.44,0.066,29,5,3129,0,17.338
13,"=","KANYE WEST All Of The Lights",1935,-38,-49,-38,15.048,-0.174,29,7,2818,0,21.956
14,"=","TREY SONGZ Unusual f/Drake",1903,38,399,10,14.264,0.066,29,14,1903,477,14.264
15,"=","KERI HILSON One Night Stand",1750,-15,69,-13,9.419,-0.116,29,14,1779,229,9.642
16,"=","WIZ KHALIFA Roll Up",1545,-35,-252,35,8.961,-0.104,29,6,3062,0,16.439
17,"+1","MARY J. BLIGE Someone To Love Me (Naked)",1393,-12,-29,-28,6.924,-0.062,29,17,1422,100,7.848
18,"-1","DIDDY-DIRTY MONEY Your Love f/Trey Songz",1348,-90,-517,-55,5.808,-0.393,29,12,2053,94,9.345
19,"=","LIL WAYNE John f/Rick Ross",1303,-27,-177,-6,8.577,-0.158,29,14,1723,37,10.408
20,"+1","YOUNG JEEZY Ballin f/Lil Wayne",1255,35,161,10,6.923,0.076,29,20,1255,359,6.923
21,"-1","BEYONCE Run The World (Girls)",1232,-66,-352,-54,4.957,-0.354,29,16,1686,271,9.235
22,"=","LUPE FIASCO Out Of My Head f/Trey Songz",1153,32,236,23,7.754,-0.01,29,22,1153,236,7.975
23,"=","MEEK MILL/RICK ROSS Tupac Back",1137,22,103,-1,5.543,-0.074,29,23,1137,380,5.962
24,"=","TRAVIS PORTER Bring It Back",1115,11,-9,-2,6.335,0.001,29,22,1288,3,7.626
25,"=","RIHANNA Man Down",1104,33,218,24,7.087,0.354,29,25,1104,421,7.087
26,"=","WAKA FLOCKA FLAME Grove St. Party f/Kebo...",919,-20,-263,13,5.983,-0.138,29,20,1513,10,9.225
27,"+2","RICK ROSS 9 Piece f/Lil Wayne",882,7,-9,7,5.096,-0.047,29,27,903,297,5.697
28,"+2","WIZ KHALIFA On My Level f/Too Short",880,8,258,-39,4.527,0.135,15,28,880,356,4.527
29,"-2","K. MICHELLE How Many Times",861,-44,-97,-43,3.897,-0.238,29,24,1030,106,4.983
30,"-2","K' LA All Your Love",857,-21,-3,-21,3.346,-0.014,29,27,955,157,3.67
31,"=","YO GOTTI We Can Get It On",850,-3,87,-12,4.235,0.057,29,28,853,99,4.39
32,"+1","LIL WAYNE How To Love",809,119,637,72,6.926,0.853,6,32,809,637,6.926
33,"-1","SNOOP DOGG Platinum f/R. Kelly",711,-16,-6,-21,2.417,-0.106,29,31,799,112,3.192
34,"+1","BIG K.R.I.T. Country Sh**",637,10,103,3,2.375,0.028,25,34,637,277,2.375
35,"-1","ROCKO Goin Steady",635,-36,-168,-34,2.885,-0.166,29,26,932,0,3.761
36,"+2","BIRDMAN I Get Money f/Lil Wayne",605,9,21,12,2.439,0.073,29,33,695,186,2.799
37,"-1","LLOYD BANKS I Don't Deserve You f/Jeremi...",598,-11,-88,17,4.279,0.011,29,25,993,49,6.428
38,"-1","GORILLA ZOE Twisted f/Lil Jon",582,-23,-111,-36,2.008,-0.062,29,34,712,129,2.596
39,"=","SEAN GARRETT In Da Box f/Rick Ross",533,16,120,-9,2.269,0.067,16,38,533,176,2.269
40,"=","JENNIFER HUDSON No One Gonna Love You",523,29,259,-12,2.348,0.056,9,40,523,271,2.348
41,"=","FRANK OCEAN Novacane",486,25,109,30,4.293,0.13,21,41,486,148,4.297
42,"+2","BEYONCE Best Thing I Never Had",471,62,432,23,3.467,-0.03,4,42,471,432,3.497
43,"+3","T-PAIN Booty Wurk (One Cheek At A...",455,69,235,83,3.565,0.525,14,43,455,235,3.565
44,"-2","KIRKO BANGZ What Yo Name Iz",436,-7,5,-3,3.226,-0.072,29,39,580,42,3.768
45,"-2","DJ DRAMA Oh My f/Fab, Wiz, Roscoe",426,-10,-66,-20,2.976,-0.048,29,39,503,104,3.879
46,"-1","MELANIE FIONA Gone And Never Coming Back",390,-4,5,17,1.819,-0.07,29,37,629,5,2.553
47,"+1","BOBBY V Grab Somebody f/Twista",378,41,206,34,2.127,0.108,3,47,378,206,2.127
48,"-1","JENNIFER LOPEZ I'm Into You f/Lil Wayne",351,-24,-62,-28,1.001,-0.059,29,40,442,38,1.57
49,"=","ESTELLE Break My Heart f/Rick Ross",341,8,80,4,2.81,0.087,15,47,341,86,2.81
50,"=","JILL SCOTT So In Love f/Anthony Hamilton",328,3,110,-9,2.338,0.054,6,49,328,119,2.338
