"Pos","Pos+","Artist and Title","Spins","Spins+","Bullet","Bullet+","Aud","Aud+","Days","iTunes","PkPos","PkSpins","PkBllt","PkAud"
1,"=","DJ KHALED I'm On One f/Drake, Rick Ross",4221,"+3",-92,"+42",31.12,"+0.035",83,"28",1,4543,989,32.584
2,"=","LIL WAYNE How To Love",4178,"-21",-71,"-35",26.976,"-0.426",66,"7",1,4266,891,27.756
3,"=","KELLY ROWLAND Motivation f/Lil Wayne",3754,"-9",-182,"+3",28.186,"-0.176",89,"40",1,4671,741,34.283
4,"=","NICKI MINAJ Super Bass",3067,"-17",90,"-78",17.72,"-0.285",60,"8",4,3099,554,18.634
5,"=","CHRIS BROWN She Ain't You",3037,"-40",-206,"-24",21.291,"-0.362",89,"47",4,3708,630,25.447
6,"=","MIGUEL Sure Thing",2868,"+3",-35,"+23",23.632,"+0.136",89,"88",1,4364,460,30.251
7,"=","BIG SEAN My Last f/Chris Brown",2747,"-62",-298,"-35",20.756,"-0.290",89,"119",2,3871,461,26.108
8,"=","TREY SONGZ Unusual f/Drake",2734,"-63",-254,"-39",18.603,"-0.326",89,"419",6,3159,477,20.6
9,"+1","BEYONCE Best Thing I Never Had",2674,"+19",69,"-16",16.547,"+0.203",64,"21",9,2674,520,16.547
10,"-1","RIHANNA Man Down",2668,"-10",-32,"-5",16.128,"-0.229",89,"142",8,2726,421,17.159
11,"=","MIGUEL Quickie",2492,"+74",302,"+30",16.824,"+0.714",54,"183",11,2492,553,16.824
12,"=","LUPE FIASCO Out Of My Head f/Trey Songz",2341,"+12",164,"-17",16.608,"+0.217",89,"85",11,2341,303,16.903
13,"=","JAY Z & KANYE WEST Otis f/Otis Redding",2052,"+75",669,"-38",15.852,"+0.311",18,"25",13,2052,1048,15.852
14,"+1","BIG SEAN Marvin & Chardonnay",1809,"+73",247,"+70",12.711,"+0.378",37,"86",14,1809,552,12.711
15,"-1","DJ DRAMA Oh My f/Fab, Wiz, Roscoe",1805,"+12",113,"+3",11.146,"-0.020",89,"270",13,1805,363,11.166
16,"+1","WIZ KHALIFA On My Level f/Too Short",1579,"+14",-104,"+28",7.43,"-0.040",75,"--",14,1733,356,10.111
17,"-1","FRANK OCEAN Novacane",1545,"-36",-140,"-30",8.626,"-0.234",81,"366",14,1747,240,10.925
18,"=","DRAKE Marvin's Room",1411,"+21",315,"-42",10.365,"+0.308",43,"31",18,1411,417,10.365
19,"+1","WALE That Way f/Jeremih & Rick Ross",1376,"+30",82,"+27",8.192,"+0.166",47,"349",19,1376,373,8.192
20,"-1","YOUNG JEEZY Ballin f/Lil Wayne",1336,"-46",-393,"-8",6.737,"-0.202",89,"598",9,2234,359,13.189
21,"+1","ESTELLE Break My Heart f/Rick Ross",1043,"+3",64,"-39",6.483,"-0.084",75,"869",21,1043,200,6.814
22,"-1","YO GOTTI We Can Get It On",1020,"-27",-214,"-33",5.137,"-0.025",89,"--",18,1286,183,6.7
23,"=","LLOYD Cupid",946,"-30",-308,"+43",3.967,"-0.270",89,"--",7,2694,335,14.796
24,"=","TINIE TEMPAH Till I'm Gone f/Wiz Khalifa",910,"+9",66,"+3",3.291,"-0.046",50,"163",23,910,177,3.416
25,"=","MINDLESS BEHAVIOR Mrs. Right f/Diggy Sim...",883,"+24",323,"-34",4.924,"+0.237",16,"235",25,883,359,4.924
26,"=","CHRIS BROWN Wet The Bed",860,"+66",405,"+14",5.367,"+0.518",13,"985",26,860,405,5.367
27,"=","JENNIFER HUDSON No One Gonna Love You",802,"+20",-6,"+34",3.903,"+0.076",69,"--",25,825,271,3.911
28,"=","MONICA Anything f/Rick Ross & Lil Kim",798,"+20",178,"-30",6.009,"+0.124",24,"404",27,798,221,6.009
29,"=","CJ HILTON So Fresh f/Nas",758,"+13",22,"+5",3.277,"-0.001",37,"--",26,758,282,3.474
30,"=","MAINO Let It Fly (Hands In The Air)",744,"+15",61,"+5",3.111,"+0.022",43,"751",28,744,224,3.227
31,"=","DJ KHALED It Ain't Over f/Mary J. Blige",656,"-1",77,"-21",3.278,"-0.017",21,"--",31,657,239,3.295
32,"=","BIG K.R.I.T. Country Sh**",620,"-25",-186,"-17",1.592,"-0.066",85,"--",22,907,277,3.22
33,"+1","SEAN GARRETT In Da Box f/Rick Ross",618,"+27",70,"+24",1.671,"+0.047",76,"--",32,720,176,3.294
34,"-1","LIL WAYNE John f/Rick Ross",614,"-3",-5,"-16",6.518,"+0.047",89,"156",14,1723,74,10.408
35,"=","ACE HOOD Body 2 Body f/Chris Brown",595,"+6",165,"-4",2.97,"+0.061",20,"379",35,595,182,2.97
36,"+1","GAME Pot Of Gold f/Chris Brown",576,"+1",48,"-17",2.431,"-0.047",23,"233",34,576,333,2.478
37,"-1","HAMILTON PARK Thing Called Us",574,"-4",3,"-13",2.575,"+0.005",29,"--",31,590,182,2.716
38,"=","VERSE SIMMONDS Boo Thang f/Kelly Rowland",553,"-15",49,"-38",2.258,"-0.149",22,"--",37,568,244,2.441
39,"=","JAMIE FOXX Best Night Of My Life",499,"+2",15,"+32",3.846,"-0.084",89,"--",10,2117,311,12.458
40,"+4","J. COLE Workout",493,"+35",221,"+21",1.982,"+0.189",8,"--",40,493,221,1.982
41,"-1","LEDISI Pieces Of Me",482,"-6",-40,"-7",1.975,"-0.007",46,"--",36,522,213,2.199
42,"=","LONNY BEREAL Favor f/Kelly Rowland",468,"+5",66,"+6",1.429,"+0.067",43,"--",42,468,83,1.429
43,"=","RAY J Bananas",465,"+5",4,"+10",2.026,"-0.028",35,"--",41,472,183,2.054
44,"+4","MEEK MILL I'm A Boss f/Rick Ross",452,"+52",233,"+51",3.288,"+0.310",6,"--",44,452,233,3.288
45,"=","KERI HILSON Lose Control (Let Me Down)",433,"-1",37,"+9",1.584,"-0.022",15,"--",44,434,307,1.606
46,"+4","YOUNG JEEZY Shake Life",411,"+44",253,"+30",1.751,"+0.160",2,"285",46,411,253,1.751
47,"--","DRAKE Headlines",389,"--",389,"--",4.346,"--",1,"--",47,389,389,4.346
48,"--","B. TAYLOR Fire In Your Eyes f/P Perrette",300,"--",-29,"--",0.591,"--",35,"--",44,359,75,0.69
49,"--","FUTURE Tony Montana",277,"--",40,"--",1.548,"--",4,"--",49,277,40,1.548
50,"--","2 CHAINZ Spend It",239,"--",43,"--",1.69,"--",1,"--",50,239,43,1.69
