"Pos","Pos+","Artist and Title","Spins","Spins+","Bullet","Bullet+","Aud","Aud+","Days","PkPos","PkSpins","PkBllt","PkAud"
1,"=","DJ KHALED I'm On One f/Drake, Rick Ross",4249,"-46",160,"-91",30.285,"-0.091",49,1,4309,989,30.516
2,"=","KELLY ROWLAND Motivation f/Lil Wayne",4099,"-83",-341,"-51",28.93,"-0.740",55,1,4671,741,34.283
3,"=","BIG SEAN My Last f/Chris Brown",3651,"-47",-192,"-25",23.023,"-0.952",55,2,3871,461,26.108
4,"+1","CHRIS BROWN She Ain't You",3437,"-45",-243,"-23",22.58,"-0.706",55,4,3708,630,25.447
5,"+1","LIL WAYNE How To Love",3362,"-11",454,"-113",21.342,"-0.125",32,5,3377,891,22.065
6,"-2","MIGUEL Sure Thing",3356,"-142",-380,"-159",23.75,"-1.251",55,1,4364,460,30.251
7,"=","TREY SONGZ Unusual f/Drake",2739,"-32",80,"-76",18.516,"-0.353",55,7,2800,477,19.41
8,"=","LLOYD Cupid",2501,"-41",-192,"-40",12.931,"-0.263",55,7,2694,335,14.796
9,"=","MARSHA AMBROSIUS Far Away",2107,"-94",-642,"-16",11.775,"-0.720",55,5,3066,397,19.884
10,"=","YOUNG JEEZY Ballin f/Lil Wayne",2081,"+11",141,"-32",11.137,"+0.245",55,10,2081,359,11.137
11,"=","RIHANNA Man Down",1924,"-33",-7,"-93",12.847,"-0.412",55,11,2012,421,14.077
12,"=","ACE HOOD Hustle Hard",1755,"+23",-27,"+59",10.77,"+0.246",55,7,2503,97,14.627
13,"=","NICKI MINAJ Super Bass",1691,"-3",320,"-92",10.275,"-0.087",26,13,1694,554,10.645
14,"=","LUPE FIASCO Out Of My Head f/Trey Songz",1613,"-26",22,"-62",12.733,"-0.213",55,12,1691,303,13.311
15,"=","JAMIE FOXX Best Night Of My Life",1484,"-47",-392,"+18",9.055,"-0.308",55,10,2117,311,12.458
16,"=","YC Racks f/Future",1418,"+25",-121,"+61",8.264,"+0.220",55,4,3411,104,19.707
17,"=","WIZ KHALIFA On My Level f/Too Short",1320,"+27",172,"+11",6.481,"+0.132",41,17,1320,356,6.481
18,"=","FRANK OCEAN Novacane",1292,"+37",225,"+14",8.117,"+0.119",47,18,1292,236,8.117
19,"+3","RICK ROSS 9 Piece f/Lil Wayne",1232,"+22",100,"+12",6.032,"+0.190",55,19,1232,297,6.032
20,"-1","BEYONCE Best Thing I Never Had",1216,"-12",19,"-50",6.387,"-0.008",30,19,1257,481,6.713
21,"-1","MIGUEL Quickie",1215,"-10",176,"-55",7.642,"-0.238",20,20,1237,553,8.317
22,"-1","KERI HILSON One Night Stand",1123,"-102",-463,"-65",6.417,"-0.726",55,13,1779,229,11.051
23,"=","YO GOTTI We Can Get It On",1091,"-21",-25,"-55",5.677,"-0.229",55,22,1151,183,6.259
24,"=","MEEK MILL/RICK ROSS Tupac Back",1080,"+17",-8,"+21",6.051,"+0.377",55,19,1185,380,6.473
25,"+1","DJ DRAMA Oh My f/Fab, Wiz, Roscoe",982,"+70",360,"+39",5.421,"+0.552",55,25,982,360,5.421
26,"-1","T-PAIN Booty Wurk (One Cheek At A...",940,"+7",-18,"+25",5.626,"+0.220",40,25,976,373,5.64
27,"=","NICKI MINAJ Did It On'em",896,"-6",-159,"+52",5.209,"+0.117",55,5,3129,0,17.338
28,"+1","BIG K.R.I.T. Country Sh**",869,"+8",37,"-9",3.091,"+0.119",51,28,869,277,3.091
29,"+1","TRAVIS PORTER Bring It Back",849,"+11",-20,"+28",5.391,"+0.300",55,22,1288,9,7.626
30,"-2","LIL WAYNE John f/Rick Ross",830,"-33",-93,"-58",7.259,"-0.163",55,14,1723,37,10.408
31,"=","WIZ KHALIFA Roll Up",821,"+17",-51,"+30",4.834,"+0.208",55,6,3062,0,16.439
32,"=","JENNIFER HUDSON No One Gonna Love You",768,"-7",-7,"-19",3.361,"-0.084",35,32,804,271,3.728
33,"=","ESTELLE Break My Heart f/Rick Ross",762,"+16",101,"+11",5.443,"+0.251",41,33,762,200,5.443
34,"=","SEAN GARRETT In Da Box f/Rick Ross",716,"+15",12,"+5",3.263,"+0.130",42,33,716,176,3.263
35,"=","ACE HOOD Go & Get It",569,"+7",44,"-1",2.644,"+0.039",19,35,569,229,2.644
36,"=","MARY J. BLIGE Someone To Love Me (Naked)",516,"-3",-141,"+71",1.891,"-0.039",55,17,1422,100,7.848
37,"=","TINIE TEMPAH Till I'm Gone f/Wiz Khalifa",461,"-2",37,"-26",1.809,"+0.072",16,37,473,177,1.809
38,"=","BOBBY V Grab Somebody f/Twista",446,"-5",-9,"+0",1.711,"-0.017",29,38,483,216,2.291
39,"+1","LEDISI Pieces Of Me",397,"+8",31,"-7",1.626,"+0.077",12,39,416,213,1.871
40,"+1","MAINO Let It Fly (Hands In The Air)",392,"+32",146,"+15",1.916,"+0.147",9,40,392,146,1.916
41,"-2","JILL SCOTT So In Love f/Anthony Hamilton",390,"-13",1,"-19",2.643,"-0.005",32,39,403,119,2.648
42,"+2","CJ HILTON So Fresh f/Nas",335,"+56",274,"+49",1.935,"+0.330",3,42,335,274,1.935
43,"=","WALE That Way f/Jeremih & Rick Ross",320,"+20",68,"+12",2.871,"+0.176",13,43,320,96,2.871
44,"+1","BIG SEAN Marvin & Chardonnay",296,"+23",176,"+15",2.667,"+0.284",3,44,296,176,2.667
45,"-3","DRAKE Marvin's Room",296,"-12",23,"-29",3.395,"+0.045",9,42,308,216,3.395
46,"=","LONNY BEREAL Favor f/Kelly Rowland",253,"+3",48,"-8",0.721,"+0.006",9,46,253,83,0.768
48,"--","RAY J Bananas",227,"--",171,"--",0.821,"--",1,48,227,171,0.821
49,"-1","B. TAYLOR Fire In Your Eyes f/P Perrette",206,"+0",46,"+1",0.34,"+0.004",2,48,206,46,0.34
50,"=","KIRK FRANKLIN I Smile",200,"+0",-39,"+26",1.248,"-0.048",38,45,294,42,1.749
