"Pos","Pos+","Artist and Title","Spins","Spins+","Bullet","Bullet+","Aud","Aud+","Days","iTunes","PkPos","PkSpins","PkBllt","PkAud"
1,"=","LIL WAYNE How To Love",3729,"-49",-176,"-29",22.631,"-0.223",88,"17",1,4266,891,27.756
2,"+1","JAY Z & KANYE WEST Otis f/Otis Redding",3650,"+72",452,"+26",23.072,"+0.316",40,"18",2,3650,1048,23.072
3,"-1","DJ KHALED I'm On One f/Drake, Rick Ross",3540,"-74",-248,"-76",27.223,"-0.475",105,"60",1,4543,989,32.584
4,"=","MIGUEL Quickie",3531,"+24",294,"-62",23.228,"-0.105",76,"194",4,3531,553,23.333
5,"=","BEYONCE Best Thing I Never Had",3459,"+32",225,"+4",21.086,"+0.130",86,"33",3,3459,520,21.086
6,"=","KELLY ROWLAND Motivation f/Lil Wayne",3188,"-25",-169,"-5",24.262,"-0.357",111,"68",1,4671,741,34.283
7,"=","NICKI MINAJ Super Bass",2993,"-55",-298,"-20",16.774,"-0.239",82,"16",4,3412,554,20.752
8,"=","BIG SEAN Marvin & Chardonnay",2840,"+28",84,"-27",18.687,"+0.141",59,"79",8,2840,552,18.82
9,"=","LUPE FIASCO Out Of My Head f/Trey Songz",2482,"-7",30,"-27",17.668,"-0.196",111,"183",9,2490,303,17.864
10,"=","DRAKE Marvin's Room",2266,"+38",438,"-4",17.597,"+0.355",65,"67",10,2266,460,17.597
11,"=","MIGUEL Sure Thing",2114,"-97",-463,"-49",18.489,"-0.623",111,"150",1,4364,460,30.251
12,"+2","WALE That Way f/Jeremih & Rick Ross",2001,"+41",250,"+11",12.121,"+0.245",69,"345",12,2001,373,12.121
13,"=","BIG SEAN My Last f/Chris Brown",1969,"+6",-136,"+66",16.712,"-0.168",111,"153",2,3871,461,26.108
14,"-2","CHRIS BROWN She Ain't You",1946,"-51",-444,"+40",14.812,"-0.385",111,"91",4,3708,630,25.447
15,"=","LIL WAYNE She Will f/Drake",1853,"+65",665,"-61",12.461,"+0.403",16,"28",15,1853,954,12.461
16,"=","DRAKE Headlines",1840,"+74",377,"+33",13.336,"+0.607",23,"30",16,1840,686,13.336
17,"=","CHRIS BROWN Wet The Bed",1734,"+62",294,"+15",12.083,"+0.428",35,"436",17,1734,405,12.083
18,"=","MINDLESS BEHAVIOR Mrs. Right f/Diggy Sim...",1618,"+12",283,"-41",9.441,"+0.074",38,"251",18,1618,359,9.441
19,"+1","RIHANNA Man Down",1524,"-28",-319,"+47",9.599,"-0.172",111,"--",8,2726,421,17.159
20,"-1","TREY SONGZ Unusual f/Drake",1511,"-44",-313,"+42",10.575,"-0.336",111,"918",6,3159,477,20.6
21,"=","DJ DRAMA Oh My f/Fab, Wiz, Roscoe",1471,"-27",-243,"+0",7.504,"-0.251",111,"695",13,1842,363,11.166
22,"=","MONICA Anything f/Rick Ross & Lil Kim",1426,"+5",157,"-40",8.863,"+0.002",46,"--",21,1426,311,9.022
23,"=","ACE HOOD Body 2 Body f/Chris Brown",1112,"+15",163,"-20",6.122,"+0.133",42,"--",23,1112,229,6.122
24,"=","TINIE TEMPAH Till I'm Gone f/Wiz Khalifa",980,"-21",-13,"-7",3.562,"-0.133",72,"224",23,1024,177,4.016
25,"=","ESTELLE Break My Heart f/Rick Ross",951,"-40",-189,"-54",4.478,"-0.277",97,"--",19,1185,200,6.814
26,"+2","MEEK MILL I'm A Boss f/Rick Ross",864,"+17",82,"+3",5.015,"+0.064",28,"--",26,864,319,5.015
27,"-1","GAME Pot Of Gold f/Chris Brown",863,"-4",18,"-22",3.051,"-0.130",45,"--",26,867,333,3.237
28,"-1","CJ HILTON So Fresh f/Nas",856,"-5",-33,"-13",3.473,"-0.034",59,"--",26,902,282,3.862
29,"=","HAMILTON PARK Thing Called Us",831,"+14",109,"-9",3.061,"-0.001",51,"--",29,831,182,3.062
30,"=","J. COLE Workout",830,"+16",65,"+13",3.546,"+0.086",30,"--",29,830,255,3.546
31,"=","YOUNG JEEZY Shake Life",752,"-5",27,"-26",3.735,"+0.004",24,"--",31,757,331,3.735
32,"+1","MAINO Let It Fly (Hands In The Air)",683,"+0",4,"+2",2.381,"+0.020",65,"572",28,761,224,3.227
33,"-1","WIZ KHALIFA On My Level f/Too Short",682,"-38",-267,"-1",2.645,"-0.211",97,"--",14,1733,356,10.111
34,"+2","MARSHA AMBROSIUS Late Nights & Early Mor...",675,"+31",210,"-7",3.831,"+0.128",13,"--",34,675,288,3.831
36,"-2","VERSE SIMMONDS Boo Thang f/Kelly Rowland",664,"+9",72,"+10",2.746,"+0.055",44,"--",34,664,244,2.746
35,"+2","DIGGY Copy, Paste",664,"+35",225,"+17",5.029,"+0.136",21,"--",35,664,225,5.029
37,"-2","FRANK OCEAN Novacane",619,"-32",-244,"+8",3.123,"-0.312",103,"567",14,1747,240,10.925
38,"+1","LLOYD Dedication To My Ex...",612,"+20",79,"+18",3.078,"+0.132",19,"971",38,612,234,3.078
39,"-1","YOUNG JEEZY Ballin f/Lil Wayne",596,"-13",-143,"+3",2.47,"-0.050",111,"--",9,2234,359,13.189
40,"=","DJ KHALED It Ain't Over f/Mary J. Blige",518,"-16",-98,"+1",2.168,"-0.103",43,"--",31,730,239,3.732
41,"+2","TYRESE Too Easy f/Ludacris",418,"+48",256,"+40",2.72,"+0.255",3,"295",41,418,256,2.72
42,"=","RAY J Bananas",375,"-16",-101,"-9",1.294,"-0.059",57,"--",40,519,183,2.452
43,"-2","SEAN GARRETT In Da Box f/Rick Ross",353,"-55",-253,"-50",0.915,"-0.174",98,"--",31,736,180,3.294
44,"=","CEE LO GREEN Fool For You f/Melanie Fion...",345,"-2",152,"-21",2.586,"+0.016",6,"--",44,347,174,2.586
45,"=","2 CHAINZ Spend It",315,"-5",-15,"-5",1.815,"+0.031",18,"--",45,346,111,2.178
46,"=","FUTURE Tony Montana",306,"-1",-7,"-1",1.551,"-0.005",25,"--",46,314,60,1.777
47,"--","FRANK OCEAN Swim Good",296,"--",260,"--",1.275,"--",1,"--",47,296,260,1.275
48,"=","JAWAN HARRIS Keisha",294,"-10",15,"-15",1.239,"-0.042",14,"--",48,306,50,1.334
49,"-2","KERI HILSON Lose Control (Let Me Down)",287,"-20",-114,"-18",0.767,"-0.112",37,"--",41,459,307,1.638
50,"=","BEYONCE Party f/Kanye & Andre",276,"+5",42,"-6",3.495,"-0.035",2,"--",50,276,48,3.53
