"Pos","Pos+","Artist and Title","Spins","Spins+","Bullet","Bullet+","Aud","Aud+","Days","iTunes","PkPos","PkSpins","PkBllt","PkAud"
1,"=","DRAKE The Motto f/Lil Wayne",4022,54,151,28,29.115,0.308,89,"20",1,4022,755,29.238
2,"=","CHRIS BROWN Strip f/Kevin McCall",3608,11,-11,-69,24.42,0.096,86,"66",2,3644,434,24.945
3,"=","TYGA Rack City",3526,13,208,-35,20.392,-0.16,81,"19",3,3526,726,20.775
4,"+3","BEYONCE Love On Top",3056,89,589,1,20.793,0.693,51,"--",4,3056,589,20.793
5,"-1","YOUNG JEEZY I Do f/JAY Z & Andre 3000",3049,-70,-445,-72,18.949,-0.143,95,"214",1,3789,635,22.939
6,"-1","WALE Lotus Flower Bomb f/Miguel",3036,-46,-263,-78,23.308,-0.002,139,"185",1,4405,550,29.754
7,"-1","DRAKE Make Me Proud f/Nicki Minaj",2946,-41,-257,-12,21.144,-0.639,128,"96",1,4265,505,28.828
8,"=","MELANIE FIONA 4 AM",2568,-26,-64,-90,14.719,0.022,181,"155",7,2669,533,14.719
9,"=","MARY J. BLIGE Mr. Wrong",2443,36,63,16,13.042,0.146,111,"--",9,2443,307,13.18
10,"=","DIGGY Do It Like You f/Jeremih",2288,13,145,-20,13.67,0.161,102,"246",10,2288,351,13.67
11,"=","TREY SONGZ Sex Ain't Better Than Love",2259,13,106,-11,15.679,0.004,50,"368",11,2259,469,15.679
12,"+1","RIHANNA Talk That Talk f/Jay-Z",2127,17,66,14,13.045,0.005,44,"73",12,2127,549,13.103
13,"-1","J. COLE Can't Get Enough f/Trey Songz",2123,-26,-201,27,15.825,-0.03,121,"--",4,3048,459,19.366
14,"=","KIRKO BANGZ Drank In My Cup",1904,29,171,-21,11.793,0.288,147,"111",14,1904,305,11.793
15,"=","FUTURE Magic f/T.I.",1870,23,302,-18,8.882,0.102,45,"150",15,1870,343,8.882
16,"=","RICK ROSS You The Boss f/Nicki Minaj",1696,-5,-152,23,10.828,0.043,141,"422",3,3659,534,22.449
17,"=","JAY Z & KANYE WEST Gotta Have It",1555,-57,-372,-6,10.469,-0.216,86,"114",11,2245,497,13.57
18,"+1","TRAVIS PORTER Ayy Ladies f/Tyga",1543,47,294,10,8.676,0.269,42,"133",18,1543,378,8.676
19,"-1","BEYONCE Countdown",1506,-13,-441,69,9.839,0.017,136,"218",9,2476,505,15.947
20,"=","FRENCH MONTANA Shot Caller",1404,6,-44,-14,6.056,-0.024,55,"846",20,1465,305,7.031
21,"+1","USHER Climax",1368,145,814,50,8.674,0.417,10,"37",21,1368,814,8.674
22,"-1","WAKA FLOCKA FLAME Round Of Applause f/Dr...",1271,-39,-242,-17,6.597,-0.323,131,"175",12,2156,306,13.13
23,"=","FAT JOE Another Round f/Chris Brown",1169,10,344,-54,7.147,-0.002,59,"154",23,1169,398,7.149
24,"=","MONICA & BRANDY It All Belongs To Me",1069,46,321,-43,4.738,0.166,13,"--",24,1069,595,4.738
25,"+1","LOVERANCE Up! f/50 Cent",1011,46,242,-11,5.599,0.164,38,"228",25,1011,335,5.599
26,"-1","TYRESE Stay",998,11,60,-11,6.112,0.078,65,"--",24,998,317,6.112
27,"=","WALE Sabotage f/Lloyd",990,42,244,22,5.774,0.17,24,"--",27,990,299,5.774
28,"+2","JENNIFER HUDSON Think Like A Man f/Ne-Yo",812,4,78,-39,3.317,-0.031,24,"559",28,816,237,3.414
29,"-1","MIGUEL Girls Like You",793,-42,-287,-36,4.358,-0.241,105,"--",21,1185,188,5.668
30,"-1","ROBIN THICKE Pretty Lil' Heart f/Lil Way...",774,-53,-221,-38,3.671,-0.239,90,"580",22,1124,272,5.032
31,"=","CASH OUT Cashin Out",754,22,130,3,2.8,0.128,30,"--",31,754,143,2.8
32,"=","J. COLE Nobody's Perfect",749,18,81,-13,3.734,0.163,24,"--",32,749,297,3.734
33,"+3","RIHANNA Birthday Cake",723,97,687,89,9.239,1.337,4,"65",33,723,687,9.239
34,"-1","ASHANTI The Woman You Love f/Busta",680,-9,8,-36,3.351,0.013,33,"--",31,702,202,3.406
35,"-1","YOUNG JEEZY SupaFreak f/2 Chainz",655,-15,-15,-27,4.879,-0.046,37,"665",30,686,174,5.44
36,"-1","MONICA Until It's Gone",624,-41,-107,-57,2.927,-0.112,143,"--",15,1566,276,7.91
37,"=","ESTELLE Thank You",605,9,-2,-2,3.405,0.102,124,"334",33,634,84,3.405
38,"=","MGK Wild Boy f/Waka Flocka Flame",597,10,54,-6,2.39,-0.007,41,"149",38,597,171,2.494
39,"+3","YOUNG JEEZY Leave You Alone f/Ne-Yo",551,68,371,28,3.66,0.116,4,"959",39,551,371,3.66
40,"-1","THE-DREAM Roc",543,9,41,4,2.642,-0.02,30,"--",39,543,251,2.743
41,"-1","JOHN LEGEND Tonight (Best You Ever Had)",540,9,104,-16,2.332,0.085,16,"--",40,540,233,2.332
42,"+1","DRAKE Take Care f/Rihanna",467,-4,-7,-6,6.715,-0.033,44,"22",38,496,123,6.892
43,"-2","MINDLESS BEHAVIOR Girls Talkin Bout",466,-39,-229,-28,1.789,-0.248,100,"--",26,898,197,3.611
44,"=","MYSTIKAL Original f/Lil Wayne & Birdman",362,-6,-5,-22,1.275,-0.022,16,"--",44,380,162,1.407
45,"=","ROCKO Squares Out Your Circle",340,0,9,-7,0.835,-0.028,13,"--",45,349,112,0.884
46,"=","LL COOL J No More",317,-2,-11,-5,0.886,-0.023,31,"--",44,374,123,1.202
47,"=","YO GOTTI Harder f/Rick Ross",307,-2,-26,-10,0.649,-0.003,34,"--",45,347,153,0.753
48,"=","LIL TWIST Turnt Up f/Busta Rhymes",286,-2,-18,-11,0.965,0.014,16,"--",48,305,136,1.016
49,"+1","ELLE VARNER Refill",283,24,207,11,1.706,0.134,2,"--",49,283,207,1.706
50,"-1","DIRTY DAVE DA FLY GUY I Got A Sack",274,14,102,6,0.621,0.05,2,"--",49,274,102,0.621
