"Pos","Pos+","Artist and Title","Spins","Spins+","Bullet","Bullet+","Aud","Aud+","Days","iTunes","PkPos","PkSpins","PkBllt","PkAud"
1,"=","WALE Lotus Flower Bomb f/Miguel",4098,-37,-221,-10,29.382,-0.036,97,"94",1,4405,550,29.754
2,"=","DRAKE Make Me Proud f/Nicki Minaj",3941,49,296,12,27.374,0.279,86,"48",2,3941,505,27.374
3,"+1","RICK ROSS You The Boss f/Nicki Minaj",3659,6,393,-24,22.288,0.272,99,"159",3,3659,534,22.288
4,"-1","BIG SEAN Dance (A$$)",3627,-31,-159,-18,23.745,-0.23,110,"27",2,3855,477,25.691
5,"=","BEYONCE Party f/Kanye & Andre",3104,-53,-242,-16,21.606,-0.548,142,"859",1,4426,708,28.224
6,"+1","YOUNG JEEZY I Do f/JAY Z & Andre 3000",2875,77,287,41,18.839,0.278,53,"221",6,2875,635,18.839
7,"-1","JAY Z & KANYE WEST N***** In Paris",2828,-98,-471,-76,21.327,-0.965,140,"11",1,4191,624,29.189
8,"=","J. COLE Can't Get Enough f/Trey Songz",2797,2,135,-34,17.52,-0.043,79,"--",7,2797,459,17.93
9,"+1","BEYONCE Countdown",2212,62,436,6,14.985,0.23,94,"188",9,2212,505,14.985
10,"-1","LIL WAYNE She Will f/Drake",2060,-100,-337,-86,13.321,-0.624,156,"141",1,4043,954,29.033
11,"+1","CHRIS BROWN Strip f/Kevin McCall",2059,65,433,36,13.338,0.405,44,"60",11,2059,433,13.338
12,"-1","T-PAIN 5 O'clock f/Wiz Khalifa",1996,-98,-670,-4,10.018,-0.666,114,"37",4,3130,442,16.639
13,"=","JAY Z & KANYE WEST Gotta Have It",1983,19,329,-13,12.612,-0.067,44,"176",13,1983,497,12.679
14,"+1","WAKA FLOCKA FLAME Round Of Applause f/Dr...",1933,18,96,3,12.678,0.194,89,"210",13,1933,306,12.678
15,"-1","WALE That Way f/Jeremih & Rick Ross",1914,-36,-312,-42,15.382,-0.204,209,"--",3,3726,421,25.014
16,"=","MELANIE FIONA 4 AM",1832,71,356,66,10.406,0.573,139,"336",16,1832,356,10.406
17,"=","MARY J. BLIGE Mr. Wrong",1805,55,216,61,9.986,0.331,69,"--",15,1805,307,9.986
18,"=","TYGA Rack City",1796,96,595,50,10.529,0.585,39,"6",18,1796,595,10.529
19,"=","DRAKE The Motto f/Lil Wayne",1712,71,472,5,13.69,0.582,47,"12",19,1712,475,13.69
20,"=","DIGGY Do It Like You f/Jeremih",1586,14,107,15,9.475,0.078,60,"222",18,1586,351,9.651
21,"=","MONICA Until It's Gone",1277,-10,-12,-15,5.377,-0.065,101,"--",15,1566,276,7.91
22,"=","KIRKO BANGZ Drank In My Cup",1146,9,-11,25,6.531,0.087,105,"226",22,1171,196,6.531
23,"=","ROBIN THICKE Pretty Lil' Heart f/Lil Way...",936,-4,-18,3,4.461,-0.023,48,"685",23,961,272,4.751
24,"=","MIGUEL Girls Like You",893,5,161,-27,3.991,-0.04,63,"--",24,893,188,4.031
25,"=","B.O.B Strange Clouds f/Lil Wayne",849,-16,-98,-27,3.12,-0.182,75,"46",25,947,175,3.882
26,"=","MINDLESS BEHAVIOR Girls Talkin Bout",712,13,102,22,3.266,0.018,58,"915",26,712,197,3.266
27,"+2","MEEK MILL House Party f/Young Chris",664,32,61,47,4.658,0.334,73,"374",27,665,188,4.722
28,"-1","FUTURE Go Harder",653,-18,-108,-25,1.667,-0.019,42,"--",27,761,242,1.942
29,"-1","ELLE VARNER Only Wannna Give It To You",628,-41,-421,36,3.395,-0.186,122,"--",14,1929,293,10.186
30,"+1","BEYONCE Love On Top",626,20,280,-11,5.153,0.248,9,"--",30,626,291,5.153
31,"-1","CJ HILTON Cold Summer",614,2,16,0,2.271,-0.025,65,"--",30,614,120,2.56
32,"=","TREY SONGZ Sex Ain't Better Than Love",589,43,309,1,5.421,0.459,8,"--",32,589,309,5.421
33,"=","ESTELLE Thank You",528,6,20,21,2.672,-0.002,82,"--",33,634,84,3.017
34,"+2","FRENCH MONTANA Shot Caller",502,50,183,41,3.65,0.359,13,"--",34,502,183,3.65
35,"-1","ROSCOE DASH Good Good Night",478,-27,-150,-2,1.845,-0.208,118,"398",26,1000,207,4.717
36,"+1","WIZ KHALIFA/SNOOP DOGG Young, Wild & Fre...",446,-4,54,-23,1.487,0.032,51,"7",36,450,127,1.487
37,"-2","T.I. I'm Flexin f/Big K.R.I.T.",438,-17,-176,17,1.393,-0.028,103,"--",19,1327,420,7.072
38,"+1","PROBLEM Last Love",394,-8,-49,-2,1.004,-0.002,67,"--",33,678,176,2.047
39,"-1","RED CAFE Fly Together f/Rick Ross",385,-39,-327,5,1.565,-0.199,124,"--",23,1177,259,5.235
40,"=","JAY-Z Glory f/B.I.C.",375,-13,309,-79,2.511,-0.433,4,"--",40,388,388,2.944
41,"=","MAINO That Could Be Us",370,14,3,14,1.974,0.223,37,"--",40,384,75,2.183
42,"+3","FUTURE Magic f/T.I.",362,34,171,43,2.32,0.082,3,"--",42,362,171,2.32
43,"-1","BUSTA RHYMES Why Stop Now f/Chris Brown",351,-2,-45,-7,1.268,-0.002,29,"--",41,396,173,1.619
44,"+4","RIHANNA Talk That Talk f/Jay-Z",345,29,86,22,3.581,0.456,2,"246",44,345,86,3.581
45,"+1","TYRESE Stay",319,-6,-3,-8,2.18,-0.012,23,"--",45,325,39,2.506
46,"+1","LIL WAYNE Mirror f/Bruno Mars",319,-1,-6,1,2.098,0.093,64,"114",44,447,293,2.098
47,"-3","FAT JOE Another Round f/Chris Brown",311,-22,-53,-15,2.38,-0.115,17,"279",43,371,67,2.647
48,"-5","BIRDMAN Y.U. Mad f/Nicki Minaj",307,-44,-265,-5,0.791,-0.084,117,"381",19,1229,386,4.66
49,"=","MATEO Say It's So",259,-21,-45,-25,0.762,-0.104,27,"--",46,324,47,1.132
50,"=","DRAKE Take Care f/Rihanna",258,3,-7,6,3.431,0.083,3,"35",50,268,45,3.626
