"Pos","Pos+","Artist and Title","Spins","Spins+","Bullet","Bullet+","Aud","Aud+","Days","iTunes","PkPos","PkSpins","PkBllt","PkAud"
1,"=","DRAKE Headlines",5215,49,350,-26,33.845,0.253,69,"21",1,5215,689,33.845
2,"=","LIL WAYNE How To Love",4693,-104,-446,-60,29.642,-0.837,136,"28",1,6857,984,40.803
3,"=","LIL WAYNE She Will f/Drake",4658,80,552,-22,29.84,0.364,58,"256",3,4658,679,29.84
4,"=","BAD MEETS EVIL Lighters f/Bruno Mars",4236,-98,-659,-39,24.153,-0.387,116,"36",2,5657,850,32.913
5,"=","LMFAO Party Rock Anthem",3822,-28,-67,-1,25.676,-0.249,156,"12",2,6094,1062,37.822
6,"=","NEW BOYZ Better With the Lights Off",3797,-9,-187,-18,16.574,-0.06,138,"34",5,3984,452,17.527
7,"=","DJ KHALED I'm On One f/Drake, Rick Ross",3707,-49,-383,14,27.164,-0.48,148,"88",2,5875,821,38.385
8,"=","BIG SEAN Marvin & Chardonnay",3598,-9,46,-37,19.061,0.052,87,"49",8,3620,589,19.061
9,"=","DEV In The Dark",3491,80,206,64,20.493,0.348,139,"16",9,3491,285,20.493
10,"=","PITBULL Give Me Everything f/Ne-Yo",3313,-61,-238,-40,22.473,-0.469,156,"40",1,6478,925,38.999
11,"=","RIHANNA Cheers (Drink To That)",2904,-153,-700,-91,13.128,-0.599,75,"15",7,3707,697,16.853
12,"+1","JAY Z & KANYE WEST N***** In Paris",2683,100,534,39,19.941,0.393,40,"26",12,2683,607,19.941
13,"-1","NICKI MINAJ Super Bass",2641,-21,-455,82,14.634,-0.266,156,"17",1,6438,904,36.328
14,"=","NICKI MINAJ Fly f/Rihanna",2619,71,242,49,12.409,0.362,51,"46",13,2619,526,12.409
15,"=","J. COLE Workout",2443,68,354,19,15.892,0.272,82,"--",15,2443,450,15.892
16,"=","GYM CLASS HEROES Stereo Hearts f/Adam Le...",2337,45,244,9,12.957,0.361,64,"6",16,2337,373,12.957
17,"+1","LMFAO Sexy And I Know It",2286,100,738,9,13.833,0.512,28,"3",17,2286,738,13.833
18,"-1","DAVID GUETTA Without You f/Usher",2264,69,346,28,11.173,0.33,40,"8",17,2264,465,11.173
19,"=","MAROON 5 F/CHRISTINA AGUILERA Moves Like...",2162,41,309,-37,14.576,0.154,33,"7",19,2162,617,14.576
20,"=","T-PAIN 5 O'clock f/Wiz Khalifa",2115,96,621,-5,10.759,0.564,22,"14",20,2115,676,10.759
21,"=","SEAN PAUL Got 2 Luv U f/Alexis Jordan",1888,-52,-246,-48,9.206,-0.304,76,"82",16,2157,266,10.761
22,"=","RIHANNA We Found Love f/Calvin Harris",1779,77,565,-12,11.223,0.471,17,"4",22,1779,655,11.223
23,"+2","ACE HOOD Body 2 Body f/Chris Brown",1561,21,48,9,10.214,0.347,62,"--",23,1561,251,10.214
24,"-1","TYGA Far Away f/Chris Richardson",1552,-77,-785,42,8.964,-0.144,120,"160",13,2875,380,13.836
25,"+2","COBRA STARSHIP You Make Me Feel... f/Sab...",1518,11,21,-8,10.028,0.196,53,"9",25,1523,336,10.028
26,"-2","BEYONCE Best Thing I Never Had",1514,-63,-743,66,8.238,-0.244,128,"117",5,4038,440,19.519
27,"-1","MIGUEL Quickie",1462,-62,-365,-19,8.016,-0.233,85,"252",18,1990,295,10.351
28,"=","KELLY ROWLAND Lay It On Me f/Big Sean",1412,-91,-321,-88,5.684,-0.173,56,"143",22,1745,422,7.438
29,"=","JASON DERULO It Girl",1370,19,101,19,6.316,0.233,53,"11",29,1370,201,6.316
30,"=","WALE That Way f/Jeremih & Rick Ross",1193,40,166,38,7.317,0.288,73,"124",30,1193,166,7.317
31,"=","KATY PERRY Last Friday Night (T.G.I.F.)",1105,-36,-343,31,5.434,-0.183,124,"57",9,3627,507,18.775
32,"=","DRAKE Marvin's Room",1075,-24,-108,-16,11.326,-0.265,94,"78",17,2253,456,16.484
33,"=","MINDLESS BEHAVIOR Mrs. Right f/Diggy Sim...",1067,-6,-37,-11,4.741,0.03,44,"123",32,1107,240,5.099
34,"=","LLOYD Dedication To My Ex...",1007,-8,-36,-12,3.673,-0.018,71,"139",28,1055,201,4.002
35,"=","JAY Z & KANYE WEST Otis f/Otis Redding",991,-8,-321,64,8.22,0.009,82,"90",9,3026,689,20.091
36,"+1","FOSTER THE PEOPLE Pumped Up Kicks",891,6,40,-2,5.985,-0.024,40,"5",36,891,213,6.031
37,"-1","KREAYSHAWN Gucci Gucci",886,-66,-322,-24,4.352,-0.4,109,"119",16,2530,367,11.812
38,"=","CHRIS BROWN Wet The Bed",879,4,95,-11,6.185,0.088,46,"243",38,879,139,6.185
39,"=","ADELE Someone Like You",875,6,226,-61,7.152,0.153,14,"2",38,875,354,7.152
40,"=","ALEXANDRA STAN Mr. Saxobeat",819,-10,-70,-2,5.413,-0.035,62,"27",31,920,202,6.722
41,"=","AFROJACK Take Over Control f/Eva Simons",706,-5,-64,2,5.289,-0.172,142,"73",29,778,164,6.67
42,"=","LIL PLAYY Birthday Dress",646,-43,-119,-30,1.726,-0.115,47,"--",36,792,182,2.856
43,"=","FLO RIDA Good Feeling",574,32,84,31,2.625,0.039,17,"24",43,574,206,2.625
44,"=","BEYONCE Party f/Kanye & Andre",537,12,80,-30,5.038,-0.126,10,"229",44,537,235,5.164
45,"+3","BIG SEAN Dance (A$$)",488,41,232,11,3.919,0.176,6,"--",45,488,232,3.919
46,"=","MEEK MILL Ima Boss f/Rick Ross",479,6,22,7,4.203,-0.054,47,"215",45,479,68,4.296
47,"-2","BEI MAEJOR Trouble f/J. Cole",477,2,71,-3,1.775,0.027,19,"344",45,477,173,1.775
48,"-1","BEYONCE Countdown",473,18,324,-25,1.676,0.042,5,"--",47,473,349,1.676
49,"+1","BRUNO MARS It Will Rain",423,34,235,8,1.41,0.179,3,"45",49,423,235,1.41
50,"-1","CHRIS BROWN Beautiful People f/B. Benass...",383,-21,-76,-18,2.133,-0.124,59,"190",44,564,98,3.885
