"Pos","Pos+","Artist and Title","Spins","Spins+","Bullet","Bullet+","Aud","Aud+","Days","iTunes","PkPos","PkSpins","PkBllt","PkAud"
1,"=","LIL WAYNE How To Love",6832,-19,100,-46,38.266,-0.189,70,"7",1,6857,984,38.819
2,"=","LMFAO Party Rock Anthem",6055,35,168,8,37.295,0.141,90,"2",2,6055,1062,37.295
3,"+1","DJ KHALED I'm On One f/Drake, Rick Ross",5829,14,181,-29,38.148,0.085,82,"29",3,5829,821,38.148
4,"-1","NICKI MINAJ Super Bass",5805,-87,-373,-65,32.849,-0.944,90,"8",1,6438,904,36.328
5,"=","PITBULL Give Me Everything f/Ne-Yo",4822,-95,-587,-57,31.137,-0.546,90,"10",1,6478,925,38.999
6,"=","KELLY ROWLAND Motivation f/Lil Wayne",4552,-105,-594,-37,27.812,-0.795,90,"43",3,5903,628,34.391
7,"=","BAD MEETS EVIL Lighters f/Bruno Mars",4214,129,661,69,22.234,0.614,50,"4/90",7,4214,850,22.234
8,"=","LUPE FIASCO Out Of My Head f/Trey Songz",4007,48,318,9,22.502,0.071,90,"94",7,4007,418,22.502
9,"=","KATY PERRY Last Friday Night (T.G.I.F.)",3430,27,288,-55,18.543,0.139,58,"5",9,3430,507,18.543
10,"=","BIG SEAN My Last f/Chris Brown",3158,-44,-395,26,24.749,-0.016,90,"137",4,4788,381,28.487
11,"=","BEYONCE Best Thing I Never Had",2949,32,211,-9,14.645,0.202,62,"21",11,2949,440,14.645
12,"=","MIGUEL Sure Thing",2389,-3,-159,47,16.385,-0.073,90,"97",9,3423,446,19.52
13,"=","CHRIS BROWN She Ain't You",2265,-36,-290,5,12.032,-0.133,90,"51",5,4046,422,22.024
14,"=","NEW BOYZ Better With the Lights Off",2244,10,188,-26,10.075,0.02,72,"61",14,2244,283,10.153
15,"=","TYGA Far Away f/Chris Richardson",2029,23,207,-8,9.645,0.157,54,"160",15,2029,380,9.645
16,"=","KREAYSHAWN Gucci Gucci",1725,24,234,-5,7.705,-0.138,43,"80",16,1725,367,7.992
17,"=","JAY Z & KANYE WEST Otis f/Otis Redding",1665,84,648,-2,11.619,0.2,16,"68",17,1665,689,11.619
18,"=","BIG SEAN Marvin & Chardonnay",1642,62,575,-14,10.154,0.203,21,"89",18,1642,589,10.154
19,"=","DEV In The Dark",1560,18,135,-5,7.447,0.095,73,"141",18,1560,210,7.447
20,"=","DRAKE Marvin's Room",1445,14,281,-64,8.098,-0.009,28,"30",20,1445,456,8.107
21,"=","TINIE TEMPAH Till I'm Gone f/Wiz Khalifa",1412,19,148,7,5.964,0.044,44,"165",21,1412,252,5.964
22,"+1","BRITNEY SPEARS I Wanna Go",1344,41,238,-1,8.545,0.341,37,"9",22,1344,295,8.545
23,"-1","ADELE Rolling In The Deep",1290,-28,-92,-26,8.627,-0.009,88,"13",16,2377,450,13.832
24,"+1","PITBULL Rain Over Me",1278,14,155,11,6.087,-0.022,49,"22",24,1278,279,6.122
25,"+1","TREY SONGZ Unusual f/Drake",1215,-24,-191,3,8.248,0.008,86,"428",20,1574,280,10.765
26,"+1","WIZ KHALIFA No Sleep",1196,17,132,-22,4.958,0.163,37,"154",26,1196,258,4.958
27,"-3","FRANK OCEAN Novacane",1188,-82,-603,-25,6.364,-0.291,76,"309",16,1939,309,11.147
28,"+1","MANN The Mack",1135,13,117,1,4.705,-0.062,34,"--",28,1135,325,4.824
29,"+1","RIHANNA Cheers (Drink To That)",1060,94,669,35,6.173,0.587,9,"32",29,1060,669,6.173
30,"-2","JASON DERULO Don't Wanna Go Home",1026,-100,-817,-22,4.352,-0.561,87,"35",13,2408,471,11.681
31,"=","GAME Pot Of Gold f/Chris Brown",873,8,50,-2,2.87,-0.025,25,"243",31,873,257,2.895
32,"=","RIHANNA Man Down",811,-9,-207,71,6.149,-0.122,90,"159",14,2462,380,14.98
33,"=","MIGUEL Quickie",800,52,233,45,4.204,0.146,19,"196",33,800,233,4.204
34,"=","AFROJACK Take Over Control f/Eva Simons",725,-9,-23,-15,6.23,-0.078,76,"78",34,762,164,6.67
35,"=","T-PAIN Best Love Song f/Chris Brown",675,-27,-179,-6,4.351,-0.29,90,"45",25,1333,122,7.143
36,"=","YC Racks f/Future",668,-32,-107,-40,4.464,-0.189,90,"--",10,3036,347,15.983
37,"+2","SEAN PAUL Got 2 Luv U f/Alexis Jordan",664,32,225,-4,3.597,0.085,10,"537",37,664,257,3.597
38,"-1","LADY GAGA The Edge Of Glory",638,-7,-52,-12,4.105,-0.029,76,"18",32,1005,189,4.809
39,"-1","DAVID GUETTA/FLO RIDA/NICKI M. Where The...",622,-12,12,2,3.039,-0.032,85,"25",24,1360,367,6.023
40,"=","WIZ KHALIFA On My Level f/Too Short",594,-12,-21,-16,5.54,-0.122,51,"--",37,630,167,6.724
41,"=","J. COLE Workout",539,42,160,57,2.902,0.157,16,"--",41,539,160,2.919
42,"+1","DRAKE Headlines",502,33,464,-5,5.475,0.272,3,"24",42,502,469,5.475
43,"-1","RAY J Bananas",500,8,74,-19,1.722,-0.011,12,"354",42,500,200,1.775
44,"=","LLOYD Dedication To My Ex...",450,14,188,-7,1.752,-0.037,5,"--",44,450,201,1.789
45,"=","WALE That Way f/Jeremih & Rick Ross",422,22,87,11,2.539,0.128,7,"316",45,422,87,2.539
46,"=","T-PAIN Booty Wurk (One Cheek At A...",401,5,-14,7,3.056,0.051,50,"59",41,445,112,3.312
47,"=","BLACK EYED PEAS Don't Stop The Party",392,-2,30,-10,1.664,-0.048,14,"128",46,409,248,1.845
48,"=","DAVID GUETTA Little Bad Girl f/Taio Cruz",389,-5,-10,-16,1.324,-0.023,16,"353",44,417,92,1.441
49,"=","DJ DRAMA Oh My f/Fab, Wiz, Roscoe",356,-1,17,12,2.478,-0.013,43,"296",42,490,121,2.663
50,"=","YOUNG JEEZY Ballin f/Lil Wayne",317,-14,-23,-7,2.632,-0.052,16,"713",47,350,127,2.836
