"Pos","Pos+","Artist and Title","Spins","Spins+","Bullet","Bullet+","Aud","Aud+","Days","iTunes","PkPos","PkSpins","PkBllt","PkAud"
1,"=","DRAKE Take Care f/Rihanna",5325,"+5",0,"+64",36.773,"-0.059",151,"34",1,5759,749,42.959
2,"=","DRAKE The Motto f/Lil Wayne",4962,"-36",-108,"-28",41.384,"-0.270",172,"38",1,5837,748,46.701
3,"=","KIRKO BANGZ Drank In My Cup",4829,"+40",248,"-41",31.002,"+0.491",104,"73",3,4829,562,31.002
4,"=","RIHANNA Birthday Cake",4573,"+76",515,"+7",33.757,"+0.183",65,"48",4,4573,693,33.757
5,"=","FLO RIDA Wild Ones f/Sia",4314,"+24",260,"-88",27.073,"+0.094",68,"8",4,4314,738,27.073
6,"=","USHER Climax",4191,"+22",165,"-33",29.508,"+0.265",61,"35",5,4191,732,29.508
7,"=","LOVERANCE Up! f/IAMSU! & Skipper",3330,"+66",160,"+94",26.711,"+0.677",169,"--",7,3330,410,26.711
8,"+1","NICKI MINAJ Starships",3079,"+48",251,"+5",20.608,"+0.314",73,"11/41",8,3079,669,20.608
9,"-1","RIHANNA Talk That Talk f/Jay-Z",3025,"-91",-422,"-20",17.695,"-0.500",139,"--",3,4202,593,26.436
10,"=","JUSTIN BIEBER Boyfriend",2998,"-3",35,"-11",18.617,"-0.054",35,"5",10,3001,1416,18.713
11,"+1","YOUNG JEEZY Leave You Alone f/Ne-Yo",2990,"+36",410,"-40",20.678,"+0.222",48,"--",11,2990,462,20.678
12,"-1","TYGA Rack City",2899,"-68",-431,"+11",18.569,"-0.346",163,"75",3,5313,712,34.371
13,"+1","B.O.B So Good",2403,"-20",34,"-38",14.114,"-0.152",58,"15",13,2434,554,14.266
14,"-1","DAVID GUETTA Turn Me On f/Nicki Minaj",2354,"-82",-491,"-26",15.477,"-0.414",144,"69",5,4310,539,27.044
15,"+1","TYGA Faded f/Lil Wayne",2099,"+61",280,"+26",17.55,"+0.428",53,"62",15,2099,329,17.55
16,"-1","NICKI MINAJ Right By My Side f/Chris Bro...",2081,"+12",68,"+0",14.486,"+0.182",37,"--",15,2081,531,14.486
17,"=","THE WANTED Glad You Came",1989,"+17",66,"-9",12.78,"-0.091",68,"10",17,1989,254,13.397
18,"=","TRAVIS PORTER Ayy Ladies f/Tyga",1652,"+1",68,"-42",9.849,"+0.018",72,"67",18,1657,196,10.413
19,"=","CALVIN HARRIS Feel So Close",1487,"-17",-94,"-10",9.021,"-0.160",64,"17",19,1587,456,9.925
20,"=","CHRIS BROWN Turn Up The Music",1423,"-80",-560,"+1",11.174,"-0.751",84,"79",10,2867,518,18.461
21,"+1","FUN. We Are Young f/Janelle Monae",1341,"+30",248,"-11",10.039,"+0.256",30,"4",21,1341,287,10.039
22,"-1","FAT JOE Another Round f/Chris Brown",1284,"-46",-291,"-58",11.554,"-0.637",101,"--",18,1668,281,15.079
23,"=","GYM CLASS HEROES Ass Back Home f/Neon Hi...",1268,"-25",-205,"-11",10.626,"-0.117",107,"82",16,1959,331,13.372
24,"=","CA$H OUT Cashin' Out",1262,"+20",180,"-30",8.003,"-0.028",31,"77",24,1262,289,8.031
25,"=","PITBULL Back In Time",1110,"+23",175,"-4",6.233,"+0.055",25,"26",25,1110,353,6.233
26,"=","TREY SONGZ Heart Attack",1061,"+14",163,"-17",6.774,"+0.053",26,"--",26,1061,271,6.774
27,"=","GOTYE Somebody That I Used To Know",1047,"+43",318,"-25",7.943,"+0.256",16,"1",27,1047,380,7.943
28,"+1","E-40 Function f/YG, iamSU, Problem",997,"+24",130,"+11",8.356,"+0.065",47,"--",28,997,144,8.356
29,"-1","DJ KHALED Take It To The Head",987,"-3",81,"-50",7.117,"+0.115",28,"--",28,990,253,7.117
30,"=","JENNIFER LOPEZ Dance Again f/Pitbull",939,"+4",139,"-6",5.026,"+0.044",27,"20",30,939,393,5.026
31,"=","KANYE WEST Mercy f/Big Sean/Pusha T...",893,"+53",333,"+34",7.971,"+0.348",16,"22",31,893,333,7.971
32,"=","KATY PERRY Part Of Me",792,"-23",-237,"-9",6.155,"-0.164",72,"19",25,1086,446,8.071
33,"=","DRAKE Crew Love f/The Weekend",720,"+5",33,"-4",6.257,"-0.041",38,"--",33,720,134,6.55
34,"+4","DRAKE HYFR (Hell Ya F**kin' Right)",712,"+47",294,"+17",5.892,"+0.314",9,"--",34,712,294,5.892
35,"-1","FUTURE Magic f/T.I.",703,"-11",-77,"+43",4.408,"-0.076",80,"--",21,1433,213,10.217
36,"-1","T-PAIN Turn All The Lights On f/Ne-Yo",699,"-6",12,"-12",3.587,"-0.098",40,"--",35,714,167,3.851
37,"=","KID INK Time Of Your Life",688,"+7",48,"-8",4.683,"+0.056",44,"--",37,688,142,4.683
38,"-2","BEYONCE Love On Top",664,"-32",-213,"-16",6.292,"-0.094",96,"--",23,1509,305,10.083
39,"+1","NICKI MINAJ Beez In The Trap f/2 Chainz",532,"+22",134,"+12",5.853,"-0.031",16,"59",39,532,149,5.884
40,"+1","CASSIE King Of Hearts",507,"+0",-12,"+1",1.385,"-0.015",44,"--",40,521,175,1.618
41,"-2","WALE Sabotage f/Lloyd",506,"-7",-71,"+5",4.946,"+0.037",56,"--",33,803,195,5.693
42,"=","CHRIS RENE Young Homie",505,"+15",65,"+14",1.813,"+0.054",36,"--",42,505,65,1.813
43,"+2","KENDRICK LAMAR The Recipe f/Dr. Dre",450,"+18",115,"+6",3.597,"+0.148",4,"--",43,450,143,3.597
44,"=","FUTURE Same Damn Time",447,"+9",69,"-5",3.097,"+0.048",8,"--",44,447,127,3.097
45,"-2","T. MILLS Vans On",444,"-14",-207,"+38",1.567,"-0.060",95,"--",27,973,195,4.485
46,"+1","DAVID GUETTA Titanium f/Sia",435,"+22",150,"+4",1.702,"+0.099",2,"40",46,435,150,1.702
47,"+3","WIZ KHALIFA Work Hard, Play Hard",431,"+39",398,"+6",5.127,"+0.062",2,"--",47,431,398,5.127
48,"--","RIHANNA Where Have You Been",427,"--",228,"--",3.98,"--",1,"50",48,427,228,3.98
49,"=","ONE DIRECTION What Makes You Beautiful",414,"+15",32,"+24",2.138,"+0.054",13,"6",46,414,85,2.138
50,"-2","WAKA FLOCKA FLAME I Don't Really Care",404,"-2",24,"-15",1.719,"-0.112",9,"--",48,410,65,1.902
