"Pos","Pos+","Artist and Title","Spins","Spins+","Bullet","Bullet+","Aud","Aud+","Days","iTunes","PkPos","PkSpins","PkBllt","PkAud"
1,"=","FLO RIDA Good Feeling",5252,"-9",4,"-31",30.704,"-0.272",127,"7",1,5291,533,32.79
2,"=","JAY Z & KANYE WEST N***** In Paris",5152,"-21",-112,"+41",30.941,"-0.387",150,"19",1,6195,668,41.081
3,"=","RIHANNA We Found Love f/Calvin Harris",4743,"+2",-144,"+31",30.347,"-0.086",127,"14",1,5953,839,35.674
4,"+1","J. COLE Workout",4665,"-50",-271,"-23",33.972,"-0.044",192,"35",1,6176,777,39.536
5,"-1","BIG SEAN Dance (A$$)",4652,"-81",-411,"-72",27.494,"-0.356",116,"32",2,5285,615,33.392
6,"=","DRAKE The Motto f/Lil Wayne",4215,"+57",463,"-60",29.963,"+0.459",82,"16",6,4215,748,29.963
7,"=","WIZ KHALIFA/SNOOP DOGG Young, Wild & Fre...",4176,"+62",504,"-2",25.177,"+0.538",87,"6",7,4176,585,25.177
8,"=","BRUNO MARS It Will Rain",4001,"+15",123,"+3",23.199,"+0.077",113,"21",7,4001,486,23.199
9,"=","DRAKE Make Me Proud f/Nicki Minaj",3923,"+21",34,"+19",25.84,"+0.428",101,"60",6,4140,605,25.852
10,"=","WALE Lotus Flower Bomb f/Miguel",3753,"-1",65,"+3",23.115,"-0.127",87,"108",8,3754,573,23.242
11,"=","TYGA Rack City",3482,"+83",693,"+4",19.474,"+0.431",73,"5",11,3482,693,19.474
12,"=","LMFAO Sexy And I Know It",2918,"-75",-409,"-8",17.2,"-0.318",138,"11",4,4921,738,27.923
13,"=","RIHANNA You Da One",2803,"-62",-232,"-54",12.854,"-0.371",80,"47",12,3067,886,15.227
14,"=","CHRIS BROWN Strip f/Kevin McCall",2754,"+4",125,"-61",15.03,"+0.053",66,"54",14,2760,605,15.4
15,"=","J. COLE Can't Get Enough f/Trey Songz",2735,"+52",173,"+16",19.215,"+0.086",73,"--",15,2735,483,19.215
16,"=","PITBULL F/CHRIS BROWN International Love",2515,"+10",190,"-32",13.441,"+0.013",108,"9",16,2515,314,13.441
17,"=","DAVID GUETTA Turn Me On f/Nicki Minaj",2309,"+39",300,"-13",12.574,"+0.090",54,"4",17,2309,482,12.574
18,"=","DRAKE Take Care f/Rihanna",1926,"+73",294,"+70",16.795,"+0.436",61,"25",18,1926,351,16.795
19,"=","YOUNG JEEZY I Do f/JAY Z & Andre 3000",1695,"+15",102,"-15",9.358,"+0.059",57,"200",19,1695,314,9.392
20,"=","KATY PERRY The One That Got Away",1428,"+9",-43,"+36",7.804,"+0.106",94,"48",20,1525,253,9.713
21,"+2","JAY Z & KANYE WEST Gotta Have It",1375,"+13",156,"-65",8.895,"+0.052",32,"114",21,1378,480,9.002
22,"=","B.O.B Strange Clouds f/Lil Wayne",1350,"-53",-396,"-5",9.649,"-0.235",101,"63",17,2113,334,12.004
23,"-2","T-PAIN 5 O'clock f/Wiz Khalifa",1332,"-75",-594,"+17",7.957,"-0.463",132,"79",6,4656,700,28.003
24,"=","BEYONCE Party f/Kanye & Andre",1111,"-22",-105,"+19",7.259,"-0.184",120,"788",14,2473,395,13.124
25,"+1","RIHANNA Talk That Talk f/Jay-Z",1065,"+49",268,"+33",8.208,"+0.348",49,"112",25,1065,268,8.208
26,"-1","RICK ROSS You The Boss f/Nicki Minaj",1051,"-30",-277,"+3",5.521,"+0.012",101,"169",21,1585,183,8.687
27,"=","WAKA FLOCKA FLAME Round Of Applause f/Dr...",943,"+26",158,"+32",5.985,"+0.167",73,"179",27,943,158,5.985
28,"=","BABY BASH Slide Over",864,"+14",38,"-6",5.947,"-0.034",54,"--",28,864,160,6.068
29,"+1","LOVERANCE Up! f/IAMSU! & Skipper",851,"+44",212,"+21",6.07,"+0.163",79,"962",29,851,212,6.07
30,"-1","MAROON 5 F/CHRISTINA AGUILERA Moves Like...",843,"-4",5,"+1",5.015,"-0.029",143,"29",12,2915,617,17.54
31,"=","DIGGY Do It Like You f/Jeremih",805,"+30",103,"+6",3.603,"+0.095",22,"250",30,805,206,3.603
32,"=","ADELE Set Fire To The Rain",748,"+11",88,"-39",6.189,"+0.111",20,"3",32,748,233,6.189
33,"+1","MINDLESS BEHAVIOR Girls Talkin Bout",693,"+25",154,"+0",2.405,"+0.058",17,"--",33,693,203,2.405
34,"-1","BEI MAEJOR Trouble f/J. Cole",668,"-10",-84,"+2",2.702,"+0.026",129,"527",29,1052,173,3.947
35,"+1","CHILDISH GAMBINO Heartbeat",630,"+16",137,"+3",2.335,"+0.048",28,"208",35,630,137,2.335
36,"+1","GYM CLASS HEROES Ass Back Home f/Neon Hi...",594,"-7",26,"-36",3.367,"-0.050",17,"13",36,603,186,3.417
37,"-2","LIL WAYNE Mirror f/Bruno Mars",593,"-57",-258,"-15",2.504,"-0.143",89,"55",21,1408,323,5.439
38,"=","SELENA GOMEZ & THE SCENE Love You Like A...",564,"+1",13,"-13",3.948,"-0.017",63,"42",38,565,117,4.226
39,"=","MARY J. BLIGE Mr. Wrong",517,"+1",115,"-27",3.316,"+0.047",10,"--",39,517,188,3.316
40,"=","BEYONCE Love On Top",480,"+30",198,"+1",2.241,"+0.135",6,"--",40,480,217,2.241
41,"=","FAT JOE Another Round f/Chris Brown",453,"+11",78,"+2",4.042,"+0.125",11,"163",40,453,94,4.042
42,"=","JESSIE J Domino",452,"+22",75,"+19",3.171,"+0.138",14,"8",42,452,80,3.171
43,"=","KIRKO BANGZ Drank In My Cup",427,"+23",77,"+21",3.669,"+0.079",14,"154",43,427,77,3.669
44,"+2","T. MILLS Vans On",409,"+32",142,"+18",1.687,"+0.116",5,"--",44,409,142,1.687
45,"=","SEAN PAUL She Doesn't Mind",408,"+14",40,"+4",1.454,"+0.053",10,"755",44,408,113,1.454
46,"-2","LMFAO Sorry For Party Rocking",396,"+0",25,"-4",1.487,"+0.014",13,"146",44,396,101,1.487
47,"+3","DEV & ENRIQUE IGLESIAS Naked",346,"+37",233,"+30",1.134,"+0.081",2,"554",47,346,233,1.134
48,"-1","YELAWOLF Let's Roll f/Kid Rock",346,"+2",46,"-2",0.653,"-0.016",4,"373",47,346,48,0.669
49,"-1","CHIDDY BANG Ray Charles",332,"+13",102,"-49",0.787,"+0.027",3,"666",48,332,164,0.787
50,"--","ASHANTI The Woman You Love f/Busta",328,"--",150,"--",1.728,"--",1,"--",50,328,150,1.728
