"Pos","Pos+","Artist and Title","Spins","Spins+","Bullet","Bullet+","Aud","Aud+","Days","iTunes","PkPos","PkSpins","PkBllt","PkAud"
1,"=","KIRKO BANGZ Drank In My Cup",5224,"-34",-316,"-38",38.216,"+0.068",145,"74",1,5609,562,39.395
2,"=","YOUNG JEEZY Leave You Alone f/Ne-Yo",4244,"+31",174,"-24",31.564,"+0.257",89,"177",2,4244,486,31.564
3,"=","FLO RIDA Wild Ones f/Sia",4135,"-30",-434,"-9",26.804,"-0.414",109,"9",2,4837,738,30.647
4,"=","NICKI MINAJ Starships",4049,"-33",-280,"-55",25.109,"-0.167",114,"20/40",3,4327,669,28.422
5,"=","DRAKE Take Care f/Rihanna",3931,"-33",-299,"+3",29.635,"-0.568",192,"105",1,5759,749,42.959
6,"=","TYGA Faded f/Lil Wayne",3597,"-3",-57,"-15",23.554,"+0.018",94,"80",6,3652,605,24.528
7,"=","RIHANNA Birthday Cake",3427,"-48",-257,"-34",26.177,"-0.177",106,"89",3,4670,693,33.894
8,"=","CA$H OUT Cashin' Out",3317,"+68",437,"+14",22.231,"+0.598",72,"46",8,3317,489,22.231
9,"=","JUSTIN BIEBER Boyfriend",2967,"+38",155,"+24",19.669,"+0.322",76,"10",9,3001,1416,19.669
10,"=","RIHANNA Where Have You Been",2877,"+43",437,"+1",20.319,"+0.468",42,"6",10,2877,582,20.319
11,"+1","WIZ KHALIFA Work Hard, Play Hard",2850,"+43",347,"-12",19.7,"+0.508",43,"27",11,2850,545,19.7
12,"+1","USHER Scream",2710,"+37",195,"-8",16.663,"+0.300",38,"12",11,2710,732,16.663
13,"+1","GOTYE Somebody That I Used To Know",2512,"+9",144,"-22",16.996,"+0.014",57,"2",13,2512,530,16.999
14,"+1","TREY SONGZ Heart Attack",2395,"+39",425,"-20",15.162,"+0.600",67,"103",14,2395,454,15.162
15,"+1","KANYE WEST Mercy f/Big Sean/Pusha T...",2313,"+53",330,"+45",19.041,"+0.641",57,"24",15,2313,353,19.041
16,"+1","PITBULL Back In Time",1995,"-3",-43,"-2",11.496,"+0.031",66,"5",16,2052,353,11.916
17,"+2","DRAKE HYFR (Hell Ya F**kin' Right)",1800,"+11",170,"-12",10.167,"+0.111",50,"106",17,1800,374,10.167
18,"=","USHER Climax",1738,"-53",-395,"-7",12.925,"-0.118",102,"86",5,4192,732,29.703
19,"+1","J. COLE Nobody's Perfect",1736,"+55",258,"+23",11.119,"+0.324",40,"--",19,1736,308,11.119
20,"+1","DJ KHALED Take It To The Head",1671,"-8",18,"-24",8.731,"-0.170",69,"102",20,1698,319,9.767
21,"+2","THE WANTED Glad You Came",1568,"-1",-40,"-4",11.864,"+0.197",109,"28",14,2002,254,13.863
22,"=","TRAVIS PORTER Ayy Ladies f/Tyga",1533,"-76",-475,"-35",10.137,"-0.440",113,"108",14,2084,196,14.401
23,"+1","MAROON 5 Payphone f/Wiz Khalifa",1494,"+37",245,"-17",9.596,"+0.165",36,"3",23,1494,287,9.596
24,"+1","NICKI MINAJ Beez In The Trap f/2 Chainz",1478,"+44",375,"-3",9.834,"+0.068",57,"70",24,1478,410,9.834
25,"+1","CALVIN HARRIS Let's Go f/Ne-Yo",1391,"+42",323,"+9",9.415,"+0.256",36,"58",25,1391,323,9.415
26,"+1","NICKI MINAJ Right By My Side f/Chris Bro...",1332,"-16",-185,"-4",10.242,"-0.320",78,"127",13,2101,531,15.014
27,"+1","FUN. We Are Young f/Janelle Monae",1227,"-47",-207,"-60",8.868,"-0.231",71,"16",17,1692,287,12.718
28,"+1","KENDRICK LAMAR The Recipe f/Dr. Dre",1127,"-15",-9,"-18",6.234,"-0.286",45,"220",27,1164,321,7.324
29,"+1","USHER Lemme See f/Rick Ross",1018,"+46",217,"+35",7.289,"+0.215",28,"82",29,1018,293,7.289
30,"+1","DAVID GUETTA Titanium f/Sia",927,"-1",10,"-20",4.641,"+0.080",43,"13",30,931,172,4.641
31,"+1","E-40 Function f/YG, iamSU, Problem",866,"-21",-148,"+5",8.123,"-0.012",88,"--",25,1221,160,9.941
32,"+1","RITA ORA How We Do (Party)",854,"+12",69,"+12",3.611,"+0.057",31,"104",32,854,194,3.622
33,"+1","FUTURE Same Damn Time",849,"+11",64,"+10",5.838,"+0.040",49,"--",33,849,127,6.496
34,"+2","DRIICKY GRAHAM Snapbacks & Tattoos",815,"-2",57,"-13",5.024,"-0.169",29,"91",34,817,162,5.193
35,"=","CALVIN HARRIS Feel So Close",815,"-21",-140,"+14",4.864,"-0.054",105,"31",19,1587,456,9.925
36,"+1","FAT JOE Another Round f/Chris Brown",744,"-12",-59,"-17",8.046,"-0.164",142,"--",18,1668,281,15.079
37,"+9","LIL WAYNE My Homies Still f/Big Sean",647,"+74",528,"+42",4.867,"+0.245",4,"22",37,647,528,4.867
38,"+1","CHRIS BROWN Till I Die f/Wiz Khalifa",642,"+16",38,"+16",4.568,"+0.212",29,"221",38,642,134,4.568
39,"-1","DRAKE Crew Love f/The Weekend",633,"-23",-96,"-35",4.765,"-0.159",79,"251",33,941,134,10.173
40,"=","CHRIS BROWN Turn Up The Music",605,"-12",-146,"-2",4.409,"-0.099",125,"124",10,2867,518,18.461
41,"+1","WAKA FLOCKA FLAME I Don't Really Care",599,"+10",67,"-2",3.182,"+0.076",49,"168",41,599,71,3.182
42,"+2","CARLY RAE JEPSEN Call Me Maybe",594,"+12",150,"-6",4.459,"+0.147",11,"1",42,594,156,4.459
43,"+2","2 CHAINZ No Lie f/Drake",591,"+14",115,"+5",5.45,"+0.342",17,"67",43,591,170,5.45
44,"-1","ONE DIRECTION What Makes You Beautiful",589,"+1",-20,"-5",3.778,"+0.017",54,"7",41,610,95,4.116
45,"+2","MGK Invincible f/Ester Dean",502,"+2",14,"-13",1.307,"+0.047",16,"--",44,512,124,1.307
46,"+3","CHIDDY BANG Mind Your Manners f/Icona Po...",470,"+11",77,"-13",1.382,"+0.055",8,"395",46,470,106,1.382
47,"+1","B.O.B Both Of Us f/Taylor Swift",463,"-3",22,"-21",2.159,"-0.024",12,"60",47,466,163,2.183
48,"+2","BEI MAEJOR Lights Down Low",426,"-11",-45,"-7",2.249,"+0.030",22,"--",46,485,75,2.41
49,"--","TYGA Make It Nasty",425,"--",74,"--",5.07,"--",5,"129",49,425,130,5.07
50,"--","AZEALIA BANKS 212",376,"--",60,"--",2.746,"--",1,"--",50,376,60,2.746
