"Pos","Pos+","Artist and Title","Spins","Spins+","Bullet","Bullet+","Aud","Aud+","Days","iTunes","PkPos","PkSpins","PkBllt","PkAud"
1,"=","FLO RIDA Good Feeling",5042,"-32",-190,"-12",29.047,"-0.097",138,"10",1,5291,533,32.79
2,"=","DRAKE The Motto f/Lil Wayne",5041,"+85",508,"+17",33.499,"+0.205",93,"18",2,5041,748,33.499
3,"=","WIZ KHALIFA/SNOOP DOGG Young, Wild & Fre...",4866,"+14",413,"-61",29.732,"+0.102",98,"13",3,4866,585,29.732
4,"=","RIHANNA We Found Love f/Calvin Harris",4497,"-31",-186,"-23",27.674,"-0.517",138,"23",1,5953,839,35.674
5,"=","JAY Z & KANYE WEST N***** In Paris",4319,"-62",-485,"+35",25.142,"-0.462",161,"21",1,6195,668,41.081
6,"+1","TYGA Rack City",4236,"+90",475,"+51",24.14,"+0.376",84,"9",6,4236,712,24.14
7,"-1","J. COLE Workout",4193,"-30",-277,"-4",29.746,"-0.261",203,"48",1,6176,777,39.536
8,"=","BIG SEAN Dance (A$$)",4018,"-52",-387,"+26",25.029,"-0.097",127,"43",2,5285,615,33.392
9,"=","DRAKE Make Me Proud f/Nicki Minaj",3629,"-56",-223,"-66",24.91,"-0.301",112,"75",6,4140,605,26.004
10,"=","BRUNO MARS It Will Rain",3298,"-63",-528,"-13",17.802,"-0.211",124,"25",7,4001,486,23.199
11,"=","WALE Lotus Flower Bomb f/Miguel",3154,"-86",-471,"-70",18.019,"-0.828",98,"149",8,3754,573,23.242
12,"=","J. COLE Can't Get Enough f/Trey Songz",3061,"+34",152,"-1",18.821,"+0.014",84,"--",12,3061,483,19.591
13,"=","CHRIS BROWN Strip f/Kevin McCall",2977,"+30",144,"-11",16.14,"+0.086",77,"58",13,2977,605,16.14
14,"=","PITBULL F/CHRIS BROWN International Love",2899,"+18",214,"-20",16.269,"+0.009",119,"19",14,2899,314,16.269
15,"=","DRAKE Take Care f/Rihanna",2854,"+48",521,"-67",24.026,"+0.339",72,"24",15,2854,656,24.026
16,"=","DAVID GUETTA Turn Me On f/Nicki Minaj",2780,"+40",254,"-17",15.197,"+0.183",65,"6",15,2780,482,15.197
17,"=","LMFAO Sexy And I Know It",2478,"-32",-235,"+12",14.115,"-0.201",149,"5",4,4921,738,27.923
18,"=","YOUNG JEEZY I Do f/JAY Z & Andre 3000",1901,"+19",92,"-5",10.633,"+0.206",68,"209",18,1901,314,10.633
19,"+1","RIHANNA Talk That Talk f/Jay-Z",1791,"+104",545,"+61",11.481,"+0.636",60,"83",19,1791,545,11.481
20,"-1","JAY Z & KANYE WEST Gotta Have It",1770,"+8",294,"-39",12.194,"+0.279",43,"130",19,1770,480,12.194
21,"=","RIHANNA You Da One",1404,"-78",-882,"+67",6.745,"-0.262",91,"56",12,3067,886,15.227
22,"+2","LOVERANCE Up! f/IAMSU! & Skipper",1140,"+40",173,"+19",7.484,"+0.093",90,"411",22,1140,244,7.484
23,"=","DIGGY Do It Like You f/Jeremih",1127,"+12",182,"-25",5.853,"-0.014",33,"231",23,1127,252,5.867
24,"-2","KATY PERRY The One That Got Away",1119,"-10",-201,"+30",6.734,"-0.046",105,"49",20,1525,253,9.713
25,"=","ADELE Set Fire To The Rain",1053,"+24",184,"-13",8.879,"+0.160",31,"4",25,1053,233,8.879
26,"=","B.O.B Strange Clouds f/Lil Wayne",919,"-47",-315,"-34",5.487,"-0.443",112,"98",17,2113,334,12.004
27,"=","BABY BASH Slide Over",900,"+6",-12,"+5",5.187,"+0.056",65,"--",27,928,160,6.068
28,"=","RICK ROSS You The Boss f/Nicki Minaj",839,"-28",-167,"-7",5.043,"-0.168",112,"250",21,1585,183,8.687
29,"+2","GYM CLASS HEROES Ass Back Home f/Neon Hi...",814,"+21",151,"+6",4.832,"+0.171",28,"12",29,814,186,4.832
30,"-1","WAKA FLOCKA FLAME Round Of Applause f/Dr...",800,"-25",-139,"-11",4.989,"-0.101",84,"222",27,957,158,5.985
31,"+3","BEYONCE Love On Top",789,"+25",193,"-14",3.539,"+0.173",17,"--",31,789,217,3.539
32,"+1","CHILDISH GAMBINO Heartbeat",783,"+11",112,"+0",3.519,"+0.130",39,"245",32,783,137,3.519
33,"-3","BEYONCE Party f/Kanye & Andre",778,"-32",-228,"-18",5.269,"-0.363",131,"890",14,2473,395,13.124
34,"-2","T-PAIN 5 O'clock f/Wiz Khalifa",749,"-33",-332,"+25",3.81,"-0.053",143,"93",6,4656,700,28.003
35,"+1","KIRKO BANGZ Drank In My Cup",717,"+41",187,"+4",4.949,"+0.162",25,"187",35,717,187,4.949
36,"-1","MINDLESS BEHAVIOR Girls Talkin Bout",701,"-2",-34,"-12",2.452,"-0.010",28,"--",32,742,203,2.551
37,"=","FAT JOE Another Round f/Chris Brown",668,"+7",132,"-20",5.23,"-0.031",22,"147",36,668,169,5.261
38,"+1","JESSIE J Domino",614,"+1",76,"-18",4.402,"-0.014",25,"17",38,614,146,4.416
39,"-1","T. MILLS Vans On",612,"-2",94,"-26",2.306,"-0.017",16,"--",38,614,195,2.323
40,"=","BEI MAEJOR Trouble f/J. Cole",602,"+0",-43,"+11",2.722,"-0.002",140,"740",29,1052,173,3.947
41,"=","SEAN PAUL She Doesn't Mind",593,"+10",88,"-26",2.016,"+0.083",21,"721",41,593,163,2.016
42,"+1","CHRIS BROWN Turn Up The Music",592,"+37",314,"-29",4.529,"-0.074",5,"--",42,592,343,4.603
43,"-1","SELENA GOMEZ & THE SCENE Love You Like A...",575,"-5",-20,"-13",4.923,"-0.028",74,"36",37,596,117,5.093
44,"=","DEV & ENRIQUE IGLESIAS Naked",561,"+21",133,"+10",1.887,"+0.070",13,"730",44,561,247,1.887
45,"+1","LMFAO Sorry For Party Rocking",529,"+22",117,"+2",2.067,"+0.232",24,"71",44,529,129,2.067
46,"-1","MARY J. BLIGE Mr. Wrong",521,"+10",12,"+3",3.386,"+0.045",21,"--",39,521,188,3.46
47,"+1","CHIDDY BANG Ray Charles",443,"+8",64,"-3",1.229,"-0.015",14,"873",47,443,164,1.248
48,"--","TREY SONGZ Sex Ain't Better Than Love",411,"--",61,"--",2.94,"--",3,"468",48,411,107,2.94
49,"--","FUTURE Magic f/T.I.",406,"--",94,"--",2.577,"--",1,"301",49,406,94,2.577
50,"--","FRENCH MONTANA Shot Caller",403,"--",102,"--",2.749,"--",2,"434",50,403,102,4.093
