"Pos","Pos+","Artist and Title","Spins","Spins+","Bullet","Bullet+","Aud","Aud+","Days","iTunes","PkPos","PkSpins","PkBllt","PkAud"
1,"=","KIRKO BANGZ Drank In My Cup",5258,-69,-278,-85,38.148,-0.453,144,"75",1,5609,562,39.395
2,"+1","YOUNG JEEZY Leave You Alone f/Ne-Yo",4213,19,198,-31,31.307,-0.123,88,"180",2,4213,486,31.43
3,"-1","FLO RIDA Wild Ones f/Sia",4165,-40,-425,-8,27.218,-0.43,108,"10",2,4837,738,30.647
4,"=","NICKI MINAJ Starships",4082,-36,-225,-68,25.276,-0.169,113,"20/39",3,4327,669,28.422
5,"=","DRAKE Take Care f/Rihanna",3964,-58,-302,-57,30.203,-0.672,191,"104",1,5759,749,42.959
6,"=","TYGA Faded f/Lil Wayne",3600,-9,-42,-30,23.536,-0.4,93,"77",6,3652,605,24.528
7,"=","RIHANNA Birthday Cake",3475,-47,-223,-22,26.354,-0.248,105,"81",3,4670,693,33.894
8,"=","CA$H OUT Cashin' Out",3249,58,423,-26,21.633,0.312,71,"45",8,3249,489,21.633
9,"+1","JUSTIN BIEBER Boyfriend",2929,52,131,37,19.347,0.511,75,"9",9,3001,1416,19.347
10,"+1","RIHANNA Where Have You Been",2834,54,436,9,19.851,0.401,41,"6",10,2834,582,19.851
11,"-2","DRAKE The Motto f/Lil Wayne",2824,-65,-397,-61,23.815,-0.856,212,"46",1,5837,748,46.701
12,"=","WIZ KHALIFA Work Hard, Play Hard",2807,48,359,27,19.192,0.55,42,"27",11,2807,545,19.192
13,"=","USHER Scream",2673,25,203,-37,16.363,0.115,37,"14",11,2673,732,16.363
14,"=","GOTYE Somebody That I Used To Know",2503,16,166,-22,16.982,-0.017,56,"2",13,2503,530,16.999
15,"=","TREY SONGZ Heart Attack",2356,60,445,-9,14.562,0.442,66,"99",15,2356,454,14.562
16,"=","KANYE WEST Mercy f/Big Sean/Pusha T...",2260,46,285,24,18.4,0.338,56,"23",16,2260,353,18.4
17,"=","PITBULL Back In Time",1998,-19,-41,-11,11.465,-0.2,65,"5",16,2052,353,11.916
18,"=","USHER Climax",1791,-66,-388,-35,13.043,-0.363,101,"83",5,4192,732,29.703
19,"=","DRAKE HYFR (Hell Ya F**kin' Right)",1789,32,182,1,10.056,0.204,49,"105",19,1789,374,10.056
20,"+2","J. COLE Nobody's Perfect",1681,14,235,-29,10.795,-0.078,39,"--",20,1681,308,10.873
21,"=","DJ KHALED Take It To The Head",1679,-7,42,-28,8.901,-0.337,68,"98",20,1698,319,9.767
22,"-2","TRAVIS PORTER Ayy Ladies f/Tyga",1609,-102,-440,-105,10.577,-0.637,112,"103",14,2084,196,14.401
23,"=","THE WANTED Glad You Came",1569,1,-36,-7,11.667,0.255,108,"28",14,2002,254,13.863
24,"=","MAROON 5 Payphone f/Wiz Khalifa",1457,35,262,-14,9.431,0.24,35,"3",24,1457,287,9.431
25,"=","NICKI MINAJ Beez In The Trap f/2 Chainz",1434,55,378,14,9.766,0.116,56,"67",25,1434,410,9.78
26,"+2","CALVIN HARRIS Let's Go f/Ne-Yo",1349,55,314,25,9.159,0.392,35,"60",26,1349,314,9.159
27,"-1","NICKI MINAJ Right By My Side f/Chris Bro...",1348,-21,-181,-12,10.562,-0.557,77,"128",13,2101,531,15.014
28,"-1","FUN. We Are Young f/Janelle Monae",1274,-38,-147,-22,9.099,-0.226,70,"--",17,1692,287,12.718
29,"=","KENDRICK LAMAR The Recipe f/Dr. Dre",1142,-2,9,-5,6.52,-0.168,44,"217",27,1164,321,7.324
30,"+1","USHER Lemme See f/Rick Ross",972,63,182,65,7.074,0.336,27,"76",30,972,293,7.074
31,"-1","DAVID GUETTA Titanium f/Sia",928,1,30,-17,4.561,-0.002,42,"15",30,931,172,4.563
32,"=","E-40 Function f/YG, iamSU, Problem",887,-10,-153,28,8.135,-0.001,87,"--",25,1221,160,9.941
33,"+1","RITA ORA How We Do (Party)",842,7,57,5,3.554,0.109,30,"106",33,842,194,3.622
34,"+1","FUTURE Same Damn Time",838,22,54,17,5.798,0.062,48,"--",34,838,127,6.496
35,"-2","CALVIN HARRIS Feel So Close",836,-11,-154,5,4.918,0.016,104,"42",19,1587,456,9.925
36,"=","DRIICKY GRAHAM Snapbacks & Tattoos",817,4,70,-16,5.193,0.106,28,"82",36,817,162,5.193
37,"=","FAT JOE Another Round f/Chris Brown",756,3,-42,20,8.21,0.074,141,"--",18,1668,281,15.079
38,"=","DRAKE Crew Love f/The Weekend",656,-25,-61,-33,4.924,-0.212,78,"241",33,941,134,10.173
39,"+1","CHRIS BROWN Till I Die f/Wiz Khalifa",626,15,22,7,4.356,0.13,28,"237",39,626,134,4.356
40,"-1","CHRIS BROWN Turn Up The Music",617,-13,-144,12,4.508,-0.267,124,"122",10,2867,518,18.461
41,"=","GYM CLASS HEROES Ass Back Home f/Neon Hi...",605,-4,-54,14,5.969,-0.105,147,"224",16,1959,331,13.372
42,"+1","WAKA FLOCKA FLAME I Don't Really Care",589,10,69,-2,3.106,0.121,48,"169",42,589,71,3.106
43,"-1","ONE DIRECTION What Makes You Beautiful",588,-5,-15,-11,3.761,0.035,53,"7",41,610,95,4.116
44,"+1","CARLY RAE JEPSEN Call Me Maybe",582,27,156,12,4.312,0.196,10,"1",44,582,156,4.312
45,"-1","2 CHAINZ No Lie f/Drake",577,10,110,5,5.108,0.266,16,"63",44,577,170,5.108
46,"+1","LIL WAYNE My Homies Still f/Big Sean",573,77,486,33,4.622,0.197,3,"16",46,573,486,4.622
47,"-1","MGK Invincible f/Ester Dean",500,-3,27,-5,1.26,0.018,15,"--",44,512,124,1.275
48,"=","B.O.B Both Of Us f/Taylor Swift",466,4,43,-9,2.183,0.037,11,"71",47,466,163,2.183
49,"=","CHIDDY BANG Mind Your Manners f/Icona Po...",459,2,90,-16,1.327,-0.02,7,"--",48,459,106,1.373
50,"=","BEI MAEJOR Lights Down Low",437,-7,-38,3,2.219,0.017,21,"--",46,485,75,2.41
