"Pos","Pos.","Artist.and.Title","Spins","Spins.","Bullet","Bullet.","Aud","Aud.","Days","PkPos","PkSpins","PkBllt","PkAud"
1,"=","ADELE Rolling In The Deep",13751,-78,-342,-60,91.221,0.122,45,1,14295,2273,96.15
2,"=","PITBULL Give Me Everything f/Ne-Yo",13306,51,953,-131,91.238,0.885,45,2,13306,1811,91.238
3,"+1","LADY GAGA The Edge Of Glory",10416,116,1198,-76,62.07,-0.179,45,3,10416,2193,62.253
4,"-1","BRUNO MARS Lazy Song",10246,-277,-890,-253,50.234,-2.02,45,3,11422,1054,61.587
5,"=","KATY PERRY E.T.",9973,-57,-913,115,74.165,-0.292,45,1,14624,0,96.745
6,"=","BLACK EYED PEAS Just Can't Get Enough",9780,-137,-936,12,65.635,-0.52,45,2,13366,715,84.474
7,"=","LMFAO Party Rock Anthem",9117,282,1859,65,63.23,2.013,45,7,9117,1859,63.23
8,"=","LUPE FIASCO The Show Goes On",8377,61,541,-44,52.59,0.754,45,8,8377,1043,52.59
9,"=","BRITNEY SPEARS Till The World Ends",7469,-243,-1433,-28,47.937,-1.274,45,3,11896,966,75.819
10,"=","JASON DERULO Don't Wanna Go Home",6637,45,711,-17,36.592,-0.404,43,10,6637,1463,37.039
11,"+1","KATY PERRY Last Friday Night (T.G.I.F.)",6452,279,1796,12,41.3,1.755,28,11,6452,2124,41.3
12,"-1","JENNIFER LOPEZ F/PITBULL On The Floor",6118,-291,-1715,-162,40.669,-0.937,45,5,10169,668,65.118
13,"=","HOT CHELLE RAE Tonight Tonight",5910,137,690,57,30.322,0.721,45,12,5910,690,30.322
14,"=","NICKI MINAJ Super Bass",5608,141,1019,-7,34.404,0.751,45,14,5608,1188,34.404
15,"=","ONEREPUBLIC Good Life",5525,87,554,-11,29.534,0.76,45,14,5525,604,29.534
16,"=","WIZ KHALIFA Roll Up",4845,-43,-125,-52,23.743,-0.772,45,14,5043,725,26.478
17,"=","SELENA GOMEZ & THE SCENE Who Says",4418,-44,-32,-68,24.864,-0.663,45,17,4559,707,27.282
18,"=","TINIE TEMPAH Written In The Stars",4040,-157,-1283,24,23.409,-0.686,45,7,8819,756,54.175
19,"=","MARTIN SOLVEIG & DRAGONETTE Hello",3963,-23,-54,-38,23.761,0.039,45,19,4031,605,23.761
20,"=","ENRIQUE IGLESIAS Dirty Dancer f/Usher/Li...",3814,17,175,16,21.943,0.226,43,20,3814,864,21.943
21,"=","TAYLOR SWIFT The Story Of Us",3254,4,98,-2,17.262,-0.041,45,21,3254,587,17.303
22,"=","NICOLE SCHERZINGER Right There",3207,98,711,14,16.825,0.328,29,22,3207,720,16.825
23,"=","RIHANNA California King Bed",2997,23,352,-20,14.655,-0.037,40,23,2997,616,14.846
24,"=","JEREMIH Down On Me f/50 Cent",2902,-50,-368,39,17.723,-0.425,45,10,8052,153,44.2
25,"=","THE BAND PERRY If I Die Young",2862,51,553,-31,14.167,0.357,45,25,2862,655,14.167
26,"=","DAVID GUETTA/FLO RIDA/NICKI M. Where The...",2860,60,482,39,14.202,0.079,45,25,2860,525,14.202
27,"=","JESSIE J Price Tag f/B.O.B",2122,-114,-1105,109,10.725,-0.419,45,12,5959,582,30.453
28,"=","MAROON 5 Never Gonna Leave This Bed",2081,28,227,10,8.712,0.182,45,28,2081,312,8.712
29,"=","BEYONCE Best Thing I Never Had",2050,121,767,26,10.665,0.638,17,29,2050,856,10.665
30,"+1","BRITNEY SPEARS I Wanna Go",2001,235,1257,134,13.636,1.596,11,30,2001,1257,13.636
31,"-1","LADY GAGA Born This Way",1755,-14,-171,-23,10.951,0.064,45,19,3651,0,20.436
32,"+1","CHRIS BROWN She Ain't You",1532,31,250,-22,7.598,0.241,34,32,1532,337,7.598
33,"-1","NEW BOYZ Back Seat f/Cataracs & Dev",1530,-78,-771,54,8.596,-0.334,45,17,4096,331,21.342
34,"+1","LIL WAYNE How To Love",1310,67,395,18,6.641,0.669,20,34,1310,395,6.641
35,"-1","T-PAIN Best Love Song f/Chris Brown",1282,2,218,-36,6.362,-0.028,43,34,1282,260,6.39
36,"+1","JENNIFER LOPEZ I'm Into You f/Lil Wayne",1216,98,472,62,5.957,0.236,20,36,1216,472,5.957
37,"-1","CHRIS BROWN Look At Me Now",1170,-34,-166,-30,8.376,-0.554,45,28,1861,229,12.746
38,"=","AVRIL LAVIGNE Smile",1091,47,186,26,3.397,0.284,27,37,1091,226,3.397
39,"=","IYAZ Pretty Girls",934,7,192,-32,3.308,-0.001,20,39,934,271,3.309
40,"=","CEE LO GREEN Bright Lights Bigger City",834,27,130,11,2.975,0.113,26,40,834,130,2.975
41,"+1","COBRA STARSHIP You Make Me Feel... f/Sab...",711,42,205,24,2.15,0.119,11,41,711,214,2.15
42,"+2","ALL TIME LOW I Feel Like Dancin�",680,39,271,12,1.932,0.101,6,42,680,271,1.932
43,"+2","BIG SEAN My Last f/Chris Brown",653,12,131,-5,2.469,-0.001,20,43,653,169,2.47
44,"-3","STEVEN TYLER (It) Feels So Good",640,-59,-231,-39,2.352,-0.231,34,40,903,326,3.408
45,"-2","SHONTELLE Say Hello To Goodbye",572,-76,-758,44,2.112,-0.208,45,29,1775,174,5.629
46,"=","NEON TREES Your Surrender",537,-98,-416,-66,1.314,-0.248,45,36,1091,173,2.732
47,"=","TRAIN Save Me San Francisco",509,3,18,7,1.938,0.054,25,45,509,92,2.155
48,"+1","AFROJACK Take Over Control f/Eva Simons",375,32,111,37,4.747,0.15,5,48,375,111,4.747
49,"-1","JASON ALDEAN/KELLY CLARKSON Don't You Wa...",355,-2,35,-11,1.002,-0.004,6,48,357,66,1.007
50,"=","CODY SIMPSON On My Mind",347,17,66,13,1.199,0.067,6,49,347,66,1.199
