"Pos","Pos+","Artist and Title","Spins","Spins+","Bullet","Bullet+","Aud","Aud+","Days","iTunes","PkPos","PkSpins","PkBllt","PkAud"
1,"=","RED HOT CHILI PEPPERS Adventures Of Rain...",1979,-6,45,-21,8.776,-0.135,29,"136",1,2046,1306,9.098
2,"=","FOO FIGHTERS Walk",1908,-5,20,7,9.237,-0.046,77,"172",1,1966,354,9.467
3,"=","FOSTER THE PEOPLE Pumped Up Kicks",1511,-27,-127,8,7.739,-0.201,95,"2",1,1855,265,9.607
4,"=","BLINK 182 Up All Night",1427,16,66,9,5.564,0.019,30,"299",4,1427,918,5.564
5,"=","AWOLNATION Sail",1266,14,40,32,4.985,0.189,95,"100",5,1270,156,5.048
6,"=","COLDPLAY Every Teardrop Is A Waterfall",1239,-10,-31,38,5.086,-0.037,72,"39",4,1405,829,6.882
7,"=","SUBLIME WITH ROME Panic",1014,-29,-150,13,3.987,-0.183,95,"--",4,1393,513,6.557
8,"=","AIRBORNE TOXIC EVENT Changing",969,-2,-49,46,3.836,0.051,95,"630",4,1304,191,5.776
9,"=","311 Sunset In July",967,0,14,19,3.114,-0.047,69,"--",9,997,323,4.133
10,"=","RISE AGAINST Make It Stop (September's.....",925,10,72,10,3.988,0.078,77,"--",10,925,153,3.988
11,"=","DEATH CAB FOR CUTIE You Are A Tourist",909,-3,-47,34,4.173,0.019,95,"--",2,1688,226,7.892
12,"=","JOY FORMIDABLE Whirring",876,-1,49,6,2.857,0.011,95,"--",12,888,132,2.857
13,"=","BLACK KEYS Howlin' For You",808,-1,2,4,4.251,0.017,95,"254",2,1525,146,6.937
14,"=","FOO FIGHTERS Rope",775,-6,-87,13,5.187,-0.025,95,"--",1,2006,161,12.051
15,"=","MUMFORD & SONS The Cave",770,2,-47,46,3.898,0.004,95,"112",3,1450,89,7.488
16,"=","BUSH The Sound Of Winter",738,8,115,-32,3.43,-0.059,21,"--",16,738,344,3.489
17,"=","MUMFORD & SONS Roll Away Your Stone",691,8,63,-11,2.223,0.039,84,"686",17,691,197,2.244
18,"=","CAKE Long Time",676,10,81,25,2.21,-0.022,95,"--",18,676,104,2.296
19,"=","INCUBUS Adolescents",640,-9,-75,-4,3.856,0.015,95,"--",3,1436,162,8.791
20,"=","CAGE THE ELEPHANT Around My Head",599,-10,-81,13,1.699,-0.005,95,"--",16,798,123,2.698
21,"+1","JANE'S ADDICTION Irresistible Force",576,49,274,-9,1.929,0.119,10,"361",21,576,436,1.975
22,"-1","AVENGED SEVENFOLD So Far Away",559,-7,-33,5,1.907,0.097,95,"587",19,634,115,2.16
23,"=","YOUNG THE GIANT Cough Syrup",473,9,51,-3,1.546,0.015,41,"--",23,473,126,1.546
24,"+1","PARAMORE Monster",455,5,15,-1,1.421,0.007,67,"204",23,455,188,1.498
25,"-1","STAIND Not Again",454,-5,19,-22,1.487,0.027,28,"--",22,463,209,1.537
26,"=","TWO DOOR CINEMA CLUB What You Know",408,-1,-7,-11,1.017,0.032,95,"455",22,495,81,1.701
27,"=","INCUBUS Promises, Promises",398,1,40,11,1.509,-0.007,31,"--",26,401,92,1.63
28,"=","FOSTER THE PEOPLE Helena Beat",339,1,41,6,0.976,0.012,43,"259",28,343,82,1.011
29,"=","KOOKS Junk Of The Heart",319,-3,23,-12,0.858,0.011,23,"--",29,328,81,0.858
30,"+1","SWITCHFOOT Dark Horses",301,16,56,1,1.15,0.055,16,"--",30,301,99,1.15
31,"-1","MIDDLE CLASS RUT Busy Bein' Born",283,-3,-2,-14,0.861,-0.027,91,"--",30,289,46,0.924
32,"+1","SLEEPER AGENT Get It Daddy",275,-1,18,-15,0.617,-0.048,25,"--",32,276,60,0.665
33,"-1","A DAY TO REMEMBER All Signs Point To Lau...",272,-7,-18,10,1.029,0.017,74,"--",27,334,79,1.361
34,"=","THEORY OF A DEADMAN Lowlife",251,2,-8,7,0.852,-0.067,40,"--",31,269,63,0.967
35,"=","TV ON THE RADIO Will Do",226,0,-8,13,0.577,0.006,95,"--",31,272,58,0.72
36,"+1","MY MORNING JACKET Holdin On To Black Met...",219,0,23,-1,0.503,0.003,95,"--",36,219,52,0.678
37,"-1","SEETHER Tonight",218,-2,30,-8,0.977,0.008,13,"--",36,220,86,0.977
38,"=","FLORENCE + THE MACHINE You've Got The Lo...",213,3,-26,15,0.424,-0.002,56,"--",31,271,93,0.764
39,"+1","GROUPLOVE Colours",202,7,10,4,0.813,0.008,13,"--",38,202,74,0.813
40,"-1","PORTUGAL. THE MAN Got It All (This Can't...",202,2,-2,-5,0.411,0.006,49,"--",37,207,33,0.428
41,"=","BLUE OCTOBER The Chills",192,3,9,-2,1.038,-0.011,17,"--",41,192,40,1.105
42,"=","GIVERS Up Up Up",179,3,19,6,0.367,0.029,35,"--",42,179,37,0.367
43,"+6","EVANESCENCE What You Want",173,44,173,44,0.761,0.175,2,"57",43,173,173,0.761
44,"-1","BEASTIE BOYS Don't Play No Game That I.....",164,5,-5,9,0.214,0.014,28,"--",41,181,44,0.264
45,"-1","ADELE Rumour Has It",148,11,28,10,0.483,0.037,7,"83",44,148,28,0.483
46,"-1","COMPANY OF THIEVES Death Of Communicatio...",137,1,-2,1,0.377,-0.034,81,"--",41,170,46,0.622
47,"-1","TAKING BACK SUNDAY Faith (When I Let You...",133,-2,0,-4,0.326,-0.002,46,"--",40,179,51,0.422
48,"-1","VIVA BROTHER Darling Buds Of May",132,-2,-13,-2,0.262,-0.008,27,"--",45,160,31,0.413
49,"+1","ALTER BRIDGE Ghost Of Days Gone By",127,-2,-11,2,0.343,-0.03,17,"--",48,143,13,0.424
50,"-2","ADELITAS WAY Sick",126,-5,-33,-3,0.323,-0.025,74,"--",39,186,49,0.627
