"Pos","Pos+","Artist and Title","Spins","Spins+","Bullet","Bullet+","Aud","Aud+","Days","iTunes","PkPos","PkSpins","PkBllt","PkAud"
1,"=","FOO FIGHTERS Walk",1872,"+0",-33,"+24",10.658,"+0.164",126,"238",1,2051,354,10.658
2,"=","RED HOT CHILI PEPPERS Adventures Of Rain...",1791,"-29",-51,"-34",8.45,"-0.129",78,"67",1,2071,1306,9.352
3,"=","BLINK 182 Up All Night",1539,"+4",-2,"+8",6.533,"+0.030",79,"--",3,1607,918,6.533
4,"=","BUSH The Sound Of Winter",1512,"+24",132,"+9",7.333,"+0.166",70,"--",4,1512,344,7.333
5,"=","FOSTER THE PEOPLE Pumped Up Kicks",1463,"+4",-6,"+1",8.846,"-0.058",144,"3",1,1855,265,9.607
6,"=","AWOLNATION Sail",1153,"+13",18,"+26",5.182,"+0.143",144,"57",5,1325,156,5.774
7,"=","RISE AGAINST Make It Stop (September's.....",1139,"+14",63,"+18",5.497,"+0.068",126,"--",6,1139,153,5.497
8,"+1","YOUNG THE GIANT Cough Syrup",993,"+4",80,"-15",4.023,"+0.095",90,"376",8,993,152,4.023
9,"-1","JOY FORMIDABLE Whirring",987,"-7",-57,"-12",2.942,"-0.078",144,"870",7,1096,163,3.705
10,"=","MUMFORD & SONS Roll Away Your Stone",940,"+9",26,"+4",3.37,"-0.054",133,"425",9,940,197,3.674
11,"+1","FOSTER THE PEOPLE Helena Beat",870,"+31",107,"+25",3.44,"+0.201",92,"150",11,870,119,3.44
12,"-1","JANE'S ADDICTION Irresistible Force",853,"-4",11,"-5",2.362,"+0.033",59,"893",10,866,436,2.59
13,"=","COLDPLAY Paradise",728,"+27",161,"-23",3.561,"+0.196",18,"49",13,728,369,3.561
14,"=","INCUBUS Promises, Promises",687,"+12",-1,"+22",3.158,"-0.024",80,"--",14,698,103,3.182
15,"=","AIRBORNE TOXIC EVENT Changing",676,"+5",-32,"+19",2.725,"-0.006",144,"--",4,1304,191,5.776
16,"=","SWITCHFOOT Dark Horses",658,"+16",38,"+3",2.539,"+0.125",65,"--",16,658,106,2.539
17,"+2","GROUPLOVE Colours",538,"+17",55,"+19",1.72,"+0.106",62,"1005",17,538,106,1.72
18,"=","STAIND Not Again",534,"+2",7,"-4",1.931,"+0.121",77,"--",17,545,209,1.934
19,"-2","311 Sunset In July",524,"-28",-194,"+6",2.059,"-0.098",118,"--",7,1029,323,4.133
20,"+1","EVANESCENCE What You Want",510,"+13",42,"+6",1.847,"-0.066",51,"528",20,510,238,1.961
21,"-1","SEETHER Tonight",507,"+10",49,"+12",1.892,"+0.123",62,"303",20,507,86,1.977
22,"+1","CAGE THE ELEPHANT Aberdeen",439,"+11",72,"+6",1.231,"+0.082",28,"--",22,439,105,1.231
23,"-1","SUBLIME WITH ROME Panic",435,"-4",-51,"+9",2.118,"-0.005",144,"--",4,1393,513,6.557
24,"=","KOOKS Junk Of The Heart",405,"+4",24,"+3",0.947,"+0.045",72,"--",23,405,81,1.023
25,"+1","MIDDLE CLASS RUT Busy Bein' Born",398,"+9",27,"+9",1.306,"+0.075",140,"--",24,398,46,1.306
26,"-1","SLEEPER AGENT Get It Daddy",395,"+0",27,"+7",0.802,"+0.007",74,"--",24,395,60,0.802
27,"=","SUBLIME WITH ROME Take It Or Leave It",357,"+1",49,"-11",1.933,"+0.171",35,"--",27,357,78,1.933
28,"=","BLUE OCTOBER The Chills",349,"+0",-9,"-4",1.126,"-0.009",66,"--",27,358,67,1.498
29,"=","AIRBORNE TOXIC EVENT All I Ever Wanted",334,"+2",30,"-6",0.673,"+0.024",38,"--",28,334,108,0.673
30,"=","NAKED AND FAMOUS Punching In A Dream",330,"+15",60,"+21",0.838,"+0.051",46,"--",30,330,79,0.838
31,"+1","NOEL GALLAGHER If I Had A Gun",311,"+10",60,"+12",1.21,"-0.016",27,"--",31,311,107,1.238
32,"-1","FLORENCE + THE MACHINE What The Water Ga...",301,"-13",-17,"-29",0.889,"-0.147",29,"335",28,340,104,1.402
33,"=","DEATH CAB FOR CUTIE Stay Young, Go Danci...",272,"+6",50,"-1",0.754,"+0.013",28,"--",33,272,63,0.763
34,"=","EVERLAST I Get By",249,"-4",-4,"-12",0.717,"-0.008",39,"--",33,256,53,0.907
35,"=","COLDPLAY Every Teardrop Is A Waterfall",229,"-12",-120,"+27",0.758,"-0.072",121,"110",4,1405,829,6.882
36,"=","SHE WANTS REVENGE Take The World",195,"+2",16,"-1",0.894,"+0.031",35,"--",36,195,40,0.894
37,"=","MUTEMATH Blood Pressure",185,"-3",25,"-8",0.415,"+0.007",26,"--",37,188,49,0.415
38,"+3","NICKELBACK Bottoms Up",168,"+20",139,"+6",0.748,"+0.061",4,"97",38,168,139,0.748
39,"+1","FOO FIGHTERS These Days",165,"+13",49,"+11",1.044,"+0.134",14,"--",39,165,49,1.044
40,"-2","PARAMORE Monster",162,"-3",-9,"+0",0.66,"-0.052",116,"627",21,490,188,1.744
41,"-2","FIVE FINGER DEATH PUNCH Under And Over I...",161,"+3",17,"+6",0.441,"+0.019",49,"195",38,161,25,0.498
42,"+7","CHEVELLE Face To The Floor",146,"+36",146,"+36",1.135,"+0.195",2,"--",42,146,146,1.135
43,"-1","THEORY OF A DEADMAN Lowlife",128,"+0",-37,"+7",0.186,"-0.001",89,"--",30,269,63,0.967
44,"=","ADELE Rumour Has It",123,"+0",-1,"+4",0.617,"+0.009",56,"85",35,183,48,0.669
45,"-2","VIVA BROTHER Darling Buds Of May",121,"-5",-12,"-2",0.219,"-0.007",76,"--",37,172,31,0.413
46,"+4","AWOLNATION Not Your Fault",118,"+8",61,"+3",0.363,"+0.018",4,"--",46,118,61,0.363
47,"-2","REDLIGHT KING Bullet In My Hand",113,"-3",-5,"-4",0.35,"+0.000",28,"--",44,125,27,0.392
48,"=","HOLLYWOOD UNDEAD Bullet",112,"-1",-9,"-6",0.269,"-0.003",16,"--",44,122,26,0.281
49,"-2","BREAKING BENJAMIN Blow Me Away f/Valora",112,"-3",-25,"-2",0.265,"-0.007",35,"--",40,145,26,0.316
50,"--","AVENGED SEVENFOLD Buried Alive",111,"--",46,"--",0.316,"--",2,"--",50,111,46,0.334
