"Pos","Pos+","Artist and Title","Spins","Spins+","Bullet","Bullet+","Aud","Aud+","Days","iTunes","PkPos","PkSpins","PkBllt","PkAud"
1,"=","RED HOT CHILI PEPPERS Adventures Of Rain...",1991,"+12",2,"-43",8.753,"-0.023",30,"148",1,2046,1306,9.098
2,"=","FOO FIGHTERS Walk",1917,"+9",-17,"-37",9.266,"+0.029",78,"169",1,1966,354,9.467
3,"=","FOSTER THE PEOPLE Pumped Up Kicks",1512,"+1",-139,"-12",7.725,"-0.014",96,"2",1,1855,265,9.607
4,"=","BLINK 182 Up All Night",1445,"+18",48,"-18",5.627,"+0.063",31,"317",4,1445,918,5.627
5,"=","AWOLNATION Sail",1278,"+12",15,"-25",5.034,"+0.049",96,"108",5,1278,156,5.048
6,"=","COLDPLAY Every Teardrop Is A Waterfall",1226,"-13",-91,"-60",5.032,"-0.054",73,"40",4,1405,829,6.882
7,"=","SUBLIME WITH ROME Panic",1011,"-3",-184,"-34",3.919,"-0.068",96,"--",4,1393,513,6.557
8,"+1","311 Sunset In July",976,"+9",-4,"-18",3.075,"-0.039",70,"--",8,997,323,4.133
9,"-1","AIRBORNE TOXIC EVENT Changing",963,"-6",-82,"-33",3.819,"-0.017",96,"674",4,1304,191,5.776
10,"=","RISE AGAINST Make It Stop (September's.....",921,"-4",44,"-28",4.043,"+0.055",78,"--",10,925,153,4.043
11,"=","DEATH CAB FOR CUTIE You Are A Tourist",913,"+4",-64,"-17",4.188,"+0.015",96,"--",2,1688,226,7.892
12,"=","JOY FORMIDABLE Whirring",875,"-1",20,"-29",2.852,"-0.005",96,"--",12,888,132,2.857
13,"=","BLACK KEYS Howlin' For You",795,"-13",-18,"-20",4.233,"-0.018",96,"279",2,1525,146,6.937
14,"=","FOO FIGHTERS Rope",775,"+0",-61,"+26",5.131,"-0.056",96,"--",1,2006,161,12.051
15,"+1","BUSH The Sound Of Winter",748,"+10",80,"-35",3.487,"+0.057",22,"--",15,748,344,3.489
16,"+1","MUMFORD & SONS Roll Away Your Stone",701,"+10",55,"-8",2.294,"+0.071",85,"759",16,701,197,2.294
17,"+1","CAKE Long Time",678,"+2",52,"-29",2.211,"+0.001",96,"--",17,678,104,2.296
18,"+1","INCUBUS Adolescents",645,"+5",-61,"+14",4.017,"+0.161",96,"--",3,1436,162,8.791
19,"+2","JANE'S ADDICTION Irresistible Force",608,"+32",246,"-28",1.939,"+0.010",11,"539",19,608,436,1.975
20,"=","CAGE THE ELEPHANT Around My Head",578,"-21",-91,"-10",1.614,"-0.085",96,"--",16,798,123,2.698
21,"+1","AVENGED SEVENFOLD So Far Away",563,"+4",-21,"+12",2.002,"+0.095",96,"597",19,634,115,2.16
22,"+1","YOUNG THE GIANT Cough Syrup",485,"+12",48,"-3",1.585,"+0.039",42,"--",22,485,126,1.585
23,"+1","PARAMORE Monster",456,"+1",13,"-2",1.455,"+0.034",68,"214",23,456,188,1.498
24,"+1","STAIND Not Again",456,"+2",8,"-11",1.437,"-0.050",29,"--",22,463,209,1.537
25,"+1","TWO DOOR CINEMA CLUB What You Know",400,"-8",-18,"-11",1.032,"+0.015",96,"447",22,495,81,1.701
26,"+1","INCUBUS Promises, Promises",396,"-2",11,"-29",1.492,"-0.017",32,"--",26,401,92,1.63
27,"+1","FOSTER THE PEOPLE Helena Beat",340,"+1",19,"-22",0.994,"+0.018",44,"274",27,343,82,1.011
28,"+1","KOOKS Junk Of The Heart",314,"-5",11,"-12",0.817,"-0.041",24,"--",28,328,81,0.858
29,"+1","SWITCHFOOT Dark Horses",307,"+6",55,"-1",1.155,"+0.005",17,"--",29,307,99,1.155
30,"+1","MIDDLE CLASS RUT Busy Bein' Born",286,"+3",2,"+4",0.855,"-0.006",92,"--",30,289,46,0.924
31,"+1","SLEEPER AGENT Get It Daddy",272,"-3",4,"-14",0.614,"-0.003",26,"--",31,276,60,0.665
32,"+1","A DAY TO REMEMBER All Signs Point To Lau...",265,"-7",-40,"-22",1.028,"-0.001",75,"--",27,334,79,1.361
33,"+1","THEORY OF A DEADMAN Lowlife",250,"-1",-6,"+2",0.832,"-0.020",41,"--",31,269,63,0.967
34,"+2","MY MORNING JACKET Holdin On To Black Met...",222,"+3",25,"+2",0.51,"+0.007",96,"--",34,222,52,0.678
35,"=","TV ON THE RADIO Will Do",221,"-5",-25,"-17",0.558,"-0.019",96,"--",31,272,58,0.72
36,"+1","SEETHER Tonight",217,"-1",24,"-6",0.988,"+0.011",14,"--",36,220,86,0.988
37,"+6","EVANESCENCE What You Want",213,"+40",213,"+40",0.935,"+0.174",3,"75",37,213,213,0.935
39,"-1","FLORENCE + THE MACHINE You've Got The Lo...",208,"-5",-21,"+5",0.4,"-0.024",57,"--",31,271,93,0.764
38,"+1","GROUPLOVE Colours",208,"+6",10,"+0",0.821,"+0.008",14,"--",38,208,74,0.821
40,"=","PORTUGAL. THE MAN Got It All (This Can't...",198,"-4",-9,"-7",0.398,"-0.013",50,"--",37,207,33,0.428
41,"=","BLUE OCTOBER The Chills",193,"+1",6,"-3",1.061,"+0.023",18,"--",41,193,40,1.105
42,"=","GIVERS Up Up Up",179,"+0",20,"+1",0.37,"+0.003",36,"--",42,179,37,0.37
43,"+1","BEASTIE BOYS Don't Play No Game That I.....",162,"-2",-5,"+0",0.216,"+0.002",29,"--",41,181,44,0.264
44,"+1","ADELE Rumour Has It",154,"+6",32,"+4",0.502,"+0.019",8,"69",44,154,32,0.502
45,"+1","COMPANY OF THIEVES Death Of Communicatio...",135,"-2",-4,"-2",0.34,"-0.037",82,"--",41,170,46,0.622
46,"+1","TAKING BACK SUNDAY Faith (When I Let You...",131,"-2",-6,"-6",0.306,"-0.020",47,"--",40,179,51,0.422
47,"+1","VIVA BROTHER Darling Buds Of May",130,"-2",-9,"+4",0.258,"-0.004",28,"--",45,160,31,0.413
48,"+1","ALTER BRIDGE Ghost Of Days Gone By",124,"-3",-13,"-2",0.32,"-0.023",18,"--",48,143,13,0.424
49,"--","FIVE FINGER DEATH PUNCH Under And Over I...",118,"--",13,"--",0.293,"--",1,"155",49,118,13,0.293
50,"--","HOLLYWOOD UNDEAD Been To Hell",116,"--",9,"--",0.491,"--",1,"--",50,116,9,0.491
