"Pos","Pos+","Artist and Title","Spins","Spins+","Bullet","Bullet+","Aud","Aud+","Days","iTunes","PkPos","PkSpins","PkBllt","PkAud"
1,"=","BUSH The Sound Of Winter",1744,"+0",77,"-10",9.172,"+0.177",101,"380",1,1764,344,9.172
2,"=","FOO FIGHTERS Walk",1516,"-11",70,"+18",9.015,"-0.057",157,"334",1,2051,354,10.915
3,"=","YOUNG THE GIANT Cough Syrup",1386,"+5",47,"-23",5.412,"-0.073",121,"346",3,1386,155,5.575
4,"=","RED HOT CHILI PEPPERS Adventures Of Rain...",1257,"-6",-124,"+30",6.287,"-0.009",109,"164",1,2071,1306,9.352
5,"=","FOSTER THE PEOPLE Pumped Up Kicks",1250,"-8",-28,"+16",7.426,"+0.030",175,"5",1,1855,265,9.607
6,"=","COLDPLAY Paradise",1220,"+33",165,"+18",5.762,"+0.264",49,"390",6,1220,369,5.762
7,"=","AWOLNATION Sail",1141,"+2",30,"+1",5.047,"-0.185",175,"87",5,1325,156,5.774
8,"=","FOSTER THE PEOPLE Helena Beat",1122,"+11",80,"+18",4.27,"+0.206",123,"210",7,1129,149,4.333
9,"=","SWITCHFOOT Dark Horses",977,"+15",85,"+12",3.631,"+0.093",96,"--",9,977,121,3.631
10,"+3","BLACK KEYS Lonely Boy",963,"+153",963,"+153",4.814,"+0.678",7,"131",10,963,963,4.814
11,"-1","RISE AGAINST Make It Stop (September's.....",932,"-10",-46,"-11",4.174,"-0.179",157,"897",6,1150,153,5.557
12,"-1","BLINK 182 Up All Night",901,"-24",-161,"+1",3.544,"-0.103",110,"--",3,1607,918,7.107
13,"-1","MUMFORD & SONS Roll Away Your Stone",888,"-10",-46,"+10",3.806,"-0.016",164,"672",9,987,197,3.987
14,"=","CAGE THE ELEPHANT Aberdeen",797,"+10",127,"-8",2.4,"+0.030",59,"--",13,797,191,2.4
15,"+1","SEETHER Tonight",782,"+8",138,"-8",2.773,"+0.053",93,"238",15,782,146,2.773
16,"-1","GROUPLOVE Colours",781,"+5",50,"-4",2.919,"-0.005",93,"934",14,781,106,2.924
17,"=","CHEVELLE Face To The Floor",768,"+9",70,"-5",2.512,"+0.074",33,"298",15,768,275,2.573
18,"=","INCUBUS Promises, Promises",756,"-3",-39,"-6",3.886,"+0.071",111,"--",13,794,103,4.761
19,"=","EVANESCENCE What You Want",688,"-15",29,"-34",2.644,"-0.045",82,"--",17,708,238,2.813
20,"=","JANE'S ADDICTION Irresistible Force",583,"-28",-121,"-18",1.504,"-0.086",90,"--",10,868,436,2.59
21,"=","NAKED AND FAMOUS Punching In A Dream",548,"-8",1,"-14",1.439,"-0.042",77,"690",20,560,105,1.501
22,"+1","BLINK 182 After Midnight",534,"+13",90,"-14",1.938,"-0.001",31,"--",22,534,147,2.134
23,"-1","FOO FIGHTERS These Days",526,"-3",85,"-22",2.027,"-0.046",45,"--",21,529,198,2.073
24,"=","FLORENCE + THE MACHINE Shake It Out",506,"+12",116,"-6",2.111,"+0.073",29,"195",22,506,148,2.111
25,"=","SUBLIME WITH ROME Take It Or Leave It",464,"+7",5,"+2",2.008,"+0.031",66,"--",21,467,78,2.283
26,"=","AIRBORNE TOXIC EVENT All I Ever Wanted",450,"+5",17,"-3",1.082,"+0.043",69,"--",23,460,108,1.394
27,"=","RED HOT CHILI PEPPERS Monarchy Of Roses",434,"+19",183,"-8",1.288,"+0.017",17,"--",27,434,191,1.288
28,"=","SLEEPER AGENT Get It Daddy",394,"-2",-30,"+3",0.883,"+0.009",105,"--",22,437,60,0.949
29,"+2","EVERLAST I Get By",377,"+5",35,"+7",1.213,"+0.035",70,"--",28,377,53,1.388
30,"=","KOOKS Junk Of The Heart",371,"-11",-44,"-13",0.751,"-0.020",103,"--",21,451,81,1.034
31,"-2","STAIND Not Again",370,"-15",-69,"-10",1.208,"-0.063",108,"--",17,545,209,2.07
32,"+1","AWOLNATION Not Your Fault",327,"+8",58,"-1",0.7,"-0.008",35,"--",32,327,94,0.729
33,"-1","MIDDLE CLASS RUT Busy Bein' Born",322,"-3",-29,"-4",1.009,"+0.003",171,"--",24,406,46,1.465
34,"=","NOEL GALLAGHER If I Had A Gun",315,"-1",-25,"+2",1.059,"-0.025",58,"--",30,343,107,1.238
35,"=","MUTEMATH Blood Pressure",299,"-2",17,"-10",0.56,"-0.011",57,"--",32,317,74,0.599
36,"=","DEATH CAB FOR CUTIE Stay Young, Go Danci...",271,"-1",-16,"-2",0.767,"+0.034",59,"--",31,289,63,0.777
37,"+1","KORN F/SKRILLEX/KILL THE NOISE Narcissis...",269,"+7",73,"-12",0.935,"+0.020",15,"165",37,269,106,0.935
38,"-1","NICKELBACK Bottoms Up",263,"-6",-7,"-4",0.866,"-0.027",35,"369",33,290,145,1.393
39,"=","FIVE FINGER DEATH PUNCH Under And Over I...",228,"+8",60,"+8",0.637,"+0.029",80,"518",38,228,60,0.637
40,"=","ADELE Someone Like You",192,"-5",55,"-10",0.673,"-0.013",13,"3",40,202,105,0.743
41,"=","311 Count Me In",192,"+4",25,"-2",0.663,"+0.049",18,"--",41,192,77,0.663
42,"=","SHE WANTS REVENGE Take The World",172,"+0",-10,"+5",0.428,"-0.039",66,"--",35,201,40,0.957
43,"+1","FRAY Heartbeat",161,"-4",45,"-11",0.533,"+0.014",10,"258",43,175,90,0.832
44,"-1","BLUE OCTOBER The Chills",160,"-9",-98,"+4",0.521,"-0.010",97,"--",27,358,67,1.498
45,"=","AVENGED SEVENFOLD Buried Alive",154,"+5",22,"+3",0.437,"+0.026",33,"--",42,154,46,0.443
46,"=","FOSTER THE PEOPLE Don't Stop (Color On T...",148,"+6",84,"-1",0.835,"-0.022",5,"341",46,148,85,0.857
47,"=","REDLIGHT KING Bullet In My Hand",137,"-1",-6,"-8",0.533,"+0.001",59,"--",41,153,47,0.601
48,"=","KASABIAN Days Are Forgotten",116,"+0",8,"-4",0.187,"-0.014",20,"--",48,116,17,0.201
49,"--","THE PARLOR MOB Into The Sun",114,"--",27,"--",0.205,"--",2,"--",49,114,27,0.205
50,"--","CAKE Mustache Man (Wasted)",113,"--",65,"--",0.278,"--",1,"--",50,113,65,0.278
