"Pos","Pos+","Artist and Title","Spins","Spins+","Bullet","Bullet+","Aud","Aud+","Days","iTunes","PkPos","PkSpins","PkBllt","PkAud"
1,"=","FOO FIGHTERS Walk",1967,"-9",-49,"-82",10.342,"+0.061",113,"249",1,2051,354,10.342
2,"=","RED HOT CHILI PEPPERS Adventures Of Rain...",1827,"-8",-35,"-76",8.549,"-0.032",65,"--",1,2071,1306,9.352
3,"=","BLINK 182 Up All Night",1585,"+4",12,"-46",6.529,"+0.155",66,"691",3,1607,918,6.529
4,"=","FOSTER THE PEOPLE Pumped Up Kicks",1462,"-2",-6,"-46",8.459,"+0.062",131,"3",1,1855,265,9.607
5,"=","BUSH The Sound Of Winter",1257,"+26",134,"-10",5.585,"+0.065",57,"--",5,1257,344,5.585
6,"=","AWOLNATION Sail",1155,"-9",-31,"-44",5.664,"+0.001",131,"63",5,1325,156,5.743
7,"=","JOY FORMIDABLE Whirring",1048,"-3",-34,"-50",3.466,"-0.007",131,"--",7,1096,163,3.705
8,"=","RISE AGAINST Make It Stop (September's.....",1045,"+4",56,"-37",5.114,"-0.007",113,"--",6,1045,153,5.121
9,"=","MUMFORD & SONS Roll Away Your Stone",917,"+3",58,"-39",3.674,"+0.016",120,"697",9,917,197,3.674
10,"=","JANE'S ADDICTION Irresistible Force",843,"-8",19,"-36",2.279,"-0.028",46,"--",10,859,436,2.59
11,"=","311 Sunset In July",797,"-17",-122,"-54",3.015,"-0.022",105,"--",7,1029,323,4.133
12,"=","YOUNG THE GIANT Cough Syrup",782,"+17",101,"-24",2.799,"+0.083",77,"483",12,782,139,2.799
13,"=","AIRBORNE TOXIC EVENT Changing",724,"-4",-29,"-48",2.863,"-0.011",131,"888",4,1304,191,5.776
14,"=","FOSTER THE PEOPLE Helena Beat",694,"+19",92,"-5",2.841,"+0.143",79,"169",14,694,119,2.841
15,"=","INCUBUS Promises, Promises",677,"+10",85,"-16",3.129,"+0.114",67,"--",14,677,103,3.129
16,"=","SWITCHFOOT Dark Horses",562,"+6",65,"-24",1.926,"-0.026",52,"848",16,562,106,1.952
17,"=","SUBLIME WITH ROME Panic",551,"-5",-52,"-28",2.437,"+0.064",131,"--",4,1393,513,6.557
18,"+1","STAIND Not Again",521,"-12",9,"-31",1.879,"-0.055",64,"--",18,533,209,1.934
19,"+1","COLDPLAY Every Teardrop Is A Waterfall",495,"-20",-189,"-36",1.731,"-0.071",108,"59",4,1405,829,6.882
20,"+1","GROUPLOVE Colours",486,"+7",49,"-11",1.539,"-0.123",49,"--",20,486,106,1.662
21,"+1","EVANESCENCE What You Want",457,"+2",-6,"-22",1.622,"+0.011",38,"414",21,470,238,1.76
22,"+1","SEETHER Tonight",426,"+7",51,"-9",1.977,"+0.085",49,"366",22,426,86,1.977
23,"+1","KOOKS Junk Of The Heart",379,"-4",12,"-21",0.844,"-0.016",59,"588",23,383,81,0.894
24,"+4","COLDPLAY Paradise",369,"+61",369,"+61",2.147,"+0.349",5,"10",24,369,369,2.147
25,"=","SLEEPER AGENT Get It Daddy",363,"-3",31,"-14",0.729,"-0.047",61,"--",25,366,60,0.802
26,"=","MIDDLE CLASS RUT Busy Bein' Born",353,"+4",30,"+0",1.139,"+0.020",127,"--",26,353,46,1.139
27,"=","BLUE OCTOBER The Chills",327,"-2",25,"-20",1.479,"-0.014",53,"--",27,329,67,1.497
28,"+1","CAGE THE ELEPHANT Aberdeen",297,"+18",91,"+4",0.858,"+0.090",15,"--",28,297,105,0.858
29,"+1","AIRBORNE TOXIC EVENT All I Ever Wanted",278,"+0",21,"-18",0.537,"-0.014",25,"--",28,281,108,0.598
30,"+2","SUBLIME WITH ROME Take It Or Leave It",262,"+13",49,"+14",0.911,"+0.033",22,"--",30,262,78,0.991
31,"=","FLORENCE + THE MACHINE What The Water Ga...",250,"+1",58,"-21",1.067,"-0.007",16,"263",30,250,104,1.074
32,"+1","NAKED AND FAMOUS Punching In A Dream",246,"+0",33,"-5",0.502,"-0.004",33,"--",30,246,79,0.512
33,"+1","NOEL GALLAGHER If I Had A Gun",235,"+10",68,"-7",0.993,"+0.056",14,"--",33,235,107,0.993
34,"+1","EVERLAST I Get By",211,"+3",32,"-2",0.817,"-0.002",26,"--",34,211,53,0.843
35,"+2","DEATH CAB FOR CUTIE Stay Young, Go Danci...",189,"+2",55,"-8",0.635,"+0.000",15,"--",35,189,63,0.635
36,"=","PARAMORE Monster",185,"-12",-145,"-19",0.882,"-0.078",103,"552",21,490,188,1.744
37,"+1","THEORY OF A DEADMAN Lowlife",184,"+1",-18,"-3",0.326,"+0.001",76,"--",30,269,63,0.967
38,"+1","SHE WANTS REVENGE Take The World",171,"+1",7,"-4",0.717,"+0.058",22,"--",37,171,40,0.717
39,"+1","FIVE FINGER DEATH PUNCH Under And Over I...",151,"-1",-5,"-7",0.462,"+0.009",36,"238",38,156,25,0.498
40,"+2","DIRTY HEADS Believe",145,"-2",-11,"+0",0.511,"-0.001",30,"--",35,162,58,0.605
41,"=","ADELE Rumour Has It",144,"-6",-15,"-12",0.659,"-0.010",43,"103",35,183,48,0.669
42,"+1","BREAKING BENJAMIN Blow Me Away f/Valora",142,"-3",5,"-7",0.313,"+0.003",22,"--",41,145,26,0.316
43,"+2","VIVA BROTHER Darling Buds Of May",141,"+0",-25,"-2",0.325,"+0.005",63,"--",37,172,31,0.413
44,"+3","MUTEMATH Blood Pressure",133,"-3",-3,"-10",0.309,"-0.011",13,"--",44,136,49,0.324
45,"+3","REDLIGHT KING Bullet In My Hand",125,"+4",15,"+5",0.373,"-0.010",15,"--",45,125,27,0.392
46,"+3","FUNERAL PARTY NYC Moves To The Sound Of ...",117,"+3",1,"-2",0.147,"-0.010",10,"--",46,122,24,0.174
47,"--","HOLLYWOOD UNDEAD Bullet",98,"--",0,"--",0.172,"--",3,"--",47,100,6,0.211
48,"+2","DECEMBERISTS Calamity Song",94,"-4",-11,"-10",0.2,"-0.010",9,"--",48,106,11,0.249
49,"--","FOO FIGHTERS These Days",93,"--",44,"--",0.564,"--",1,"--",49,93,44,0.564
51,"--","PAPA ROACH No Matter What",85,"--",-5,"--",0.261,"--",13,"--",44,117,30,0.373
