"Pos","Pos+","Artist and Title","Spins","Spins+","Bullet","Bullet+","Aud","Aud+","Days","iTunes","PkPos","PkSpins","PkBllt","PkAud"
1,"=","BLACK KEYS Lonely Boy",1892,12,30,-11,8.662,0.08,62,"--",1,1892,963,8.662
2,"=","COLDPLAY Paradise",1526,23,-25,51,7.999,0.093,104,"36",1,1757,369,8.687
3,"=","YOUNG THE GIANT Cough Syrup",1488,17,52,12,6.643,0.159,176,"379",2,1513,155,6.643
4,"+1","FOO FIGHTERS These Days",1288,20,79,5,6.375,0.038,100,"--",4,1288,204,6.375
5,"-1","BUSH The Sound Of Winter",1279,10,16,13,7.755,-0.019,156,"536",1,1806,344,9.58
6,"=","SWITCHFOOT Dark Horses",1144,-10,-46,-15,4.28,0.014,151,"--",5,1247,121,4.784
7,"=","RED HOT CHILI PEPPERS Monarchy Of Roses",1124,10,52,16,4.897,-0.011,72,"--",7,1124,191,4.908
8,"=","CAGE THE ELEPHANT Aberdeen",1071,20,-7,14,3.877,0.157,114,"--",7,1084,191,3.877
9,"=","SEETHER Tonight",1012,-3,12,-9,4.61,0.029,148,"358",9,1015,146,4.61
10,"=","FOO FIGHTERS Walk",1002,2,-62,10,5.499,-0.022,212,"497",1,2051,354,10.915
11,"=","BLINK 182 After Midnight",989,18,-4,23,4.361,0.156,86,"--",11,998,147,4.465
12,"=","CHEVELLE Face To The Floor",977,12,-54,16,4.005,0.041,88,"--",9,1035,275,4.359
13,"+2","FLORENCE + THE MACHINE Shake It Out",801,10,37,-8,4.277,0.01,84,"--",13,801,148,4.317
14,"-1","FOSTER THE PEOPLE Don't Stop (Color On T...",801,0,7,-26,3.172,-0.11,60,"197",13,826,213,3.446
15,"-1","FOSTER THE PEOPLE Helena Beat",798,5,-11,8,3.719,-0.066,178,"413",7,1147,149,4.617
16,"=","AWOLNATION Not Your Fault",782,9,45,-12,2.456,0.029,90,"783",16,782,122,2.456
17,"=","RISE AGAINST Satellite",735,23,140,6,3.316,0.025,53,"--",17,735,189,3.316
18,"=","GROUPLOVE Colours",592,-6,-115,27,1.905,-0.083,148,"--",12,962,122,3.41
19,"=","NAKED AND FAMOUS Punching In A Dream",547,7,-47,12,1.805,0.02,132,"969",17,660,105,2.013
20,"=","FUN We Are Young",464,10,60,-1,1.893,0.072,37,"151",20,464,124,1.893
21,"=","KORN F/SKRILLEX/KILL THE NOISE Narcissis...",460,7,12,5,1.874,0.079,70,"--",20,460,106,1.874
22,"=","GOTYE Somebody That I Used To Know",457,6,54,-13,2.093,-0.021,23,"--",20,458,175,2.17
23,"=","GROUPLOVE Tongue Tied",414,6,49,-21,2.002,0.085,17,"215",23,414,194,2.002
24,"=","CAKE Mustache Man (Wasted)",411,4,20,0,0.954,-0.007,56,"--",24,411,87,0.961
25,"=","AIRBORNE TOXIC EVENT All I Ever Wanted",411,4,-44,7,1.184,0.019,124,"--",19,542,108,1.714
26,"=","EVERLAST I Get By",389,0,-23,-5,0.994,0.026,125,"--",22,445,53,1.508
27,"=","EVANESCENCE What You Want",368,-3,-34,-2,1.669,-0.049,137,"--",16,762,238,2.813
28,"=","JANE'S ADDICTION Underground",360,2,23,0,0.628,0.015,41,"--",26,360,106,0.628
29,"=","JOY FORMIDABLE Heavy Abacus",305,5,5,-2,0.812,0.028,39,"--",27,308,78,0.812
30,"=","NEON TREES Everybody Talks",264,3,26,-9,0.83,0.04,16,"148",30,264,183,0.858
31,"=","AVENGED SEVENFOLD Buried Alive",261,9,21,8,0.741,0.034,88,"612",30,261,46,0.741
32,"=","M83 Midnight City",252,10,30,11,1.23,0.032,28,"196",31,252,96,1.383
33,"=","ADELE Set Fire To The Rain",199,7,12,3,0.546,0.015,31,"5",33,199,84,0.546
34,"=","311 Count Me In",181,-2,-1,3,0.842,0.005,73,"--",29,234,77,0.92
35,"=","SILVERSUN PICKUPS Broken Bottles",180,0,5,-12,0.586,-0.018,15,"--",33,193,73,0.822
36,"+1","MASTODON Curl Of The Burl",175,7,11,16,0.502,0.027,78,"--",35,190,49,0.528
37,"-1","OF MONSTERS AND MEN Little Talks",171,1,11,-5,0.552,-0.028,22,"--",36,172,33,0.646
38,"=","NICKELBACK Bottoms Up",164,1,1,6,0.306,0.002,90,"--",33,290,145,1.393
39,"=","A DAY TO REMEMBER It's Complicated",151,-2,-12,-6,0.37,-0.011,32,"--",37,164,34,0.424
40,"=","MUTEMATH Blood Pressure",145,4,-13,20,0.174,0.013,112,"--",26,318,74,0.599
41,"=","FRAY Heartbeat",134,0,10,-1,0.205,-0.004,49,"92",41,181,90,0.832
42,"=","SLEEPER AGENT Get It Daddy",133,2,-28,10,0.549,0.003,160,"--",22,437,60,0.949
43,"=","FIVE FINGER DEATH PUNCH Remember Everyth...",121,-3,-20,-4,0.323,-0.001,21,"474",42,141,51,0.352
44,"=","VOLBEAT A Warrior's Call",117,3,21,-9,0.363,-0.001,8,"500",44,117,46,0.364
45,"=","STAIND Eyes Wide Open",109,1,18,-5,0.409,0.018,9,"--",45,109,27,0.409
46,"+1","KASABIAN Days Are Forgotten",109,5,2,10,0.126,0.009,67,"--",43,159,41,0.272
47,"-1","THEORY OF A DEADMAN Bitch Came Back",107,3,10,-1,0.507,0.011,9,"490",46,107,11,0.507
48,"+1","REDLIGHT KING Bullet In My Hand",94,-2,3,-8,0.433,-0.002,92,"--",41,153,47,0.604
49,"-1","KNUX Razorblade",94,-5,-7,-7,0.061,0.004,34,"--",47,125,27,0.188
50,"=","TWO DOOR CINEMA CLUB Undercover Martyn",88,-2,-26,-1,0.155,0,34,"--",44,132,33,0.277
