"Pos","Pos+","Artist and Title","Spins","Spins+","Bullet","Bullet+","Aud","Aud+","Days","iTunes","PkPos","PkSpins","PkBllt","PkAud"
1,"=","GOTYE Somebody That I Used To Know",2124,"+5",19,"+12",11.373,"+0.103",115,"3",1,2124,270,11.373
2,"=","FUN We Are Young",2060,"+9",46,"-1",11.218,"-0.057",129,"2",2,2060,229,11.275
3,"=","GROUPLOVE Tongue Tied",1417,"+7",16,"+7",6.194,"+0.068",109,"160",3,1429,194,6.194
4,"+1","BLACK KEYS Gold On The Ceiling",1390,"+19",203,"-9",6.588,"+0.037",70,"182",4,1390,266,6.588
5,"-1","AWOLNATION Not Your Fault",1388,"-5",-43,"+10",5.721,"-0.012",182,"247",3,1498,132,6.341
6,"=","FOSTER THE PEOPLE Don't Stop (Color On T...",1306,"-21",-91,"-34",5.592,"-0.127",152,"171",5,1451,213,6.316
7,"+1","M83 Midnight City",1235,"+14",90,"+17",5.155,"+0.046",120,"112",7,1235,167,5.155
8,"-1","BLACK KEYS Lonely Boy",1224,"-20",-183,"-11",6.488,"-0.118",154,"--",1,2170,963,11.053
9,"=","RISE AGAINST Satellite",1079,"-21",-25,"-22",4.189,"-0.102",145,"679",7,1238,189,5.579
10,"=","FOO FIGHTERS These Days",1060,"-7",-125,"+5",5.208,"-0.032",192,"775",2,1683,204,8.614
11,"=","OF MONSTERS AND MEN Little Talks",948,"+12",72,"+13",3.608,"-0.023",114,"--",11,948,114,3.679
12,"=","NEON TREES Everybody Talks",911,"+8",50,"-4",4.041,"+0.053",108,"40",12,911,183,4.041
13,"+1","YOUNG THE GIANT Cough Syrup",878,"-2",-97,"+4",4.707,"+0.024",268,"145",2,1548,155,7.059
14,"-1","JACK WHITE Love Interruption",877,"-13",-36,"-28",2.816,"-0.135",57,"361",12,915,377,3.255
15,"=","RED HOT CHILI PEPPERS Look Around",793,"+10",52,"+6",2.488,"+0.030",50,"--",15,793,197,2.582
16,"=","SHINEDOWN Bully",776,"+4",12,"+9",2.868,"+0.037",83,"--",14,803,360,3.179
17,"=","SHINS Simple Song",763,"+16",47,"+14",2.056,"+0.011",77,"--",17,763,282,2.216
18,"=","BUSH Baby Come Home",734,"-4",2,"-8",2.409,"-0.050",65,"--",16,738,166,2.851
19,"=","COLDPLAY Charlie Brown",645,"+3",44,"+2",3.089,"-0.011",73,"999",19,645,147,3.1
20,"=","IMAGINE DRAGONS It's Time",626,"+14",125,"+1",2.343,"+0.047",35,"585",20,626,134,2.343
21,"=","FOXY SHAZAM I Like It",548,"+8",2,"+17",1.49,"-0.010",59,"--",20,563,145,1.571
22,"=","CIVIL TWILIGHT Fire Escape",397,"+10",48,"+6",1.473,"+0.079",67,"--",22,397,57,1.473
23,"=","SWITCHFOOT Afterlife",349,"+5",74,"-10",1.222,"+0.037",21,"--",23,349,95,1.222
24,"=","USED I Come Alive",290,"+4",-6,"-3",0.734,"+0.107",65,"235",23,302,59,0.801
25,"=","SEETHER No Resolution",282,"+9",21,"+1",0.903,"+0.029",60,"--",25,282,63,0.955
26,"+1","CHEVELLE Hats Off To The Bull",271,"+7",27,"+6",0.884,"+0.005",31,"--",25,271,107,0.884
27,"-1","YOUNG THE GIANT Apartment",262,"-8",23,"-14",0.667,"-0.027",38,"--",26,270,60,0.704
28,"=","SNOW PATROL Called Out In The Dark",255,"-2",12,"-10",1.019,"+0.001",58,"285",26,263,65,1.058
29,"=","MIDDLE CLASS RUT Are You On Your Way",250,"+5",16,"+4",0.649,"+0.024",72,"--",29,250,56,0.649
30,"=","WALK THE MOON Anna Sun",247,"+8",74,"-3",1.127,"+0.013",31,"--",30,247,77,1.127
31,"+1","SANTIGOLD Disparate Youth",231,"+5",-11,"+5",0.599,"+0.004",24,"525",25,246,85,0.685
32,"-1","BAND OF SKULLS Sweet Sour",230,"-5",7,"-7",0.516,"-0.006",99,"--",29,272,64,0.716
33,"+1","SLEEPER AGENT Get Burned",215,"+2",-45,"+7",0.532,"+0.015",72,"--",24,265,51,0.693
34,"+1","EVE 6 Victoria",214,"+5",17,"-1",1.016,"+0.001",24,"--",34,214,81,1.042
35,"-2","CAKE Mustache Man (Wasted)",214,"-5",-8,"-8",0.94,"-0.040",148,"--",21,451,87,1.366
36,"+3","DIRTY HEADS Spread Too Thin",207,"+23",127,"+15",2.066,"+0.152",5,"--",36,207,127,2.066
37,"=","GARBAGE Blood For Poppies",203,"+11",122,"-10",1.136,"+0.018",7,"255",37,203,155,1.136
38,"-2","TWIN ATLANTIC Free",191,"-4",22,"-7",0.373,"-0.014",45,"--",36,195,37,0.387
39,"-1","REDLIGHT KING Bullet In My Hand",184,"-1",12,"-4",0.442,"-0.019",164,"459",36,189,58,0.604
40,"+1","BOMBAY BICYCLE CLUB Shuffle",182,"+4",12,"+2",0.29,"-0.002",85,"--",37,182,38,0.393
41,"-1","ANGELS AND AIRWAVES Surrender",181,"-1",4,"+7",0.977,"+0.008",52,"--",34,199,54,1.145
42,"=","ELECTRIC GUEST This Head I Hold",169,"+1",1,"-5",0.39,"+0.003",22,"--",37,169,33,0.487
43,"=","FLORENCE + THE MACHINE No Light, No Ligh...",159,"+3",53,"-11",0.717,"+0.042",8,"--",42,159,94,0.717
44,"=","FIVE FINGER DEATH PUNCH Remember Everyth...",145,"+1",-4,"-1",0.347,"+0.000",113,"159",33,210,51,0.534
45,"--","SILVERSUN PICKUPS Bloody Mary (Nerve End...",135,"--",135,"--",0.832,"--",1,"562",45,135,135,0.832
46,"-1","FEATURES How It Starts",130,"+3",26,"-1",0.343,"+0.009",15,"--",45,130,27,0.343
47,"=","SKRILLEX Bangarang",127,"+5",6,"+9",0.235,"+0.004",47,"59",43,152,49,0.476
48,"-2","CAGE THE ELEPHANT Always Something",124,"+1",20,"+0",0.233,"+0.001",10,"--",46,124,23,0.241
49,"=","FLOGGING MOLLY Saints & Sinners",119,"+3",-3,"+5",0.297,"-0.014",13,"--",43,125,25,0.336
50,"--","WOMBATS Jump Into The Fog",114,"--",22,"--",0.136,"--",2,"--",50,114,22,0.144
