"Pos","Pos+","Artist and Title","Spins","Spins+","Bullet","Bullet+","Aud","Aud+","Days","iTunes","PkPos","PkSpins","PkBllt","PkAud"
1,"=","BLACK KEYS Lonely Boy",1967,-1,-80,20,9.297,-0.017,112,"--",1,2170,963,11.053
2,"=","GOTYE Somebody That I Used To Know",1829,16,202,-14,9.13,-0.05,73,"--",2,1829,270,9.18
3,"=","FOO FIGHTERS These Days",1516,-38,-100,-56,7.171,-0.148,150,"402",2,1683,204,8.614
4,"=","AWOLNATION Not Your Fault",1326,14,100,6,5,0.153,140,"314",4,1326,122,5
5,"=","FUN We Are Young",1279,36,174,12,5.494,0.279,87,"5",5,1279,229,5.494
6,"=","FOSTER THE PEOPLE Don't Stop (Color On T...",1243,4,71,4,4.546,-0.076,110,"125",6,1243,213,4.622
7,"=","YOUNG THE GIANT Cough Syrup",1220,-16,-91,-13,5.693,0.055,226,"340",2,1548,155,7.059
8,"+1","RISE AGAINST Satellite",1153,18,92,11,5.289,0.045,103,"890",8,1153,189,5.333
9,"-1","COLDPLAY Paradise",1134,-20,-42,-10,6.416,0.053,154,"10",1,1757,369,8.687
10,"=","CHEVELLE Face To The Floor",1076,-10,-4,-19,4.984,0.004,138,"--",8,1103,275,5.372
11,"=","GROUPLOVE Tongue Tied",934,20,108,27,3.909,0.086,67,"264",11,934,194,3.909
12,"=","FLORENCE + THE MACHINE Shake It Out",888,-12,-60,-10,3.66,-0.046,134,"--",11,949,148,4.817
13,"=","BLINK 182 After Midnight",864,-26,-116,-24,4.028,-0.121,136,"--",8,1064,147,4.66
14,"+1","M83 Midnight City",820,4,80,1,3.53,0.022,78,"210",14,820,167,3.714
15,"-1","CAGE THE ELEPHANT Aberdeen",785,-33,-190,-27,3.035,-0.103,164,"--",6,1164,191,4.457
16,"=","SHINEDOWN Bully",697,4,49,-6,2.446,-0.014,41,"--",16,697,360,2.46
17,"+1","JACK WHITE Love Interruption",601,21,207,9,2.224,0.053,15,"401",17,601,377,2.269
18,"-1","NEON TREES Everybody Talks",600,12,89,3,1.929,0.041,66,"1008",17,600,183,1.929
19,"+1","OF MONSTERS AND MEN Little Talks",540,12,91,10,1.683,-0.102,72,"--",19,540,114,1.785
20,"+1","BUSH Baby Come Home",539,20,138,1,2.113,0.034,23,"--",20,539,166,2.113
21,"+1","SHINS Simple Song",530,11,44,16,1.812,0.044,35,"874",20,530,282,1.812
22,"-3","RED HOT CHILI PEPPERS Monarchy Of Roses",529,-40,-282,-16,2.073,-0.246,122,"--",5,1307,191,5.466
23,"=","COLDPLAY Charlie Brown",479,10,97,-8,2.084,-0.036,31,"831",23,479,147,2.12
24,"=","KORN F/SKRILLEX/KILL THE NOISE Narcissis...",462,-1,-11,2,1.741,-0.001,120,"--",20,488,106,2.003
25,"=","CAKE Mustache Man (Wasted)",440,-6,14,-11,1.366,0.007,106,"--",21,451,87,1.366
26,"=","JANE'S ADDICTION Underground",338,-12,-24,-14,0.652,-0.012,91,"--",24,367,106,0.714
27,"=","BLACK KEYS Gold On The Ceiling",325,10,130,-8,2.329,0.165,28,"744",27,325,153,2.329
28,"=","JOY FORMIDABLE Heavy Abacus",301,0,3,4,0.65,0.021,89,"--",25,338,78,0.908
29,"+1","FOXY SHAZAM I Like It",258,6,64,-13,0.761,0.02,17,"--",29,258,85,0.761
30,"-1","BAND OF SKULLS Sweet Sour",254,1,4,1,0.623,0.001,57,"--",29,254,64,0.716
31,"+1","RED HOT CHILI PEPPERS Look Around",238,18,134,0,1.205,0.102,8,"--",31,238,134,1.205
32,"-1","VOLBEAT A Warrior's Call",233,2,19,4,0.533,0.016,58,"325",30,233,46,0.55
33,"=","SEETHER No Resolution",199,-2,20,-11,0.652,0.02,18,"--",33,201,58,0.652
34,"+1","USED I Come Alive",194,8,27,9,0.382,0.028,23,"--",33,194,46,0.501
35,"-1","SLEEPER AGENT Get Burned",191,5,25,5,0.331,0.006,30,"--",33,191,39,0.37
36,"=","FIVE FINGER DEATH PUNCH Remember Everyth...",185,6,29,0,0.512,0.019,71,"370",33,185,51,0.512
37,"+1","CIVIL TWILIGHT Fire Escape",183,14,53,13,0.641,0.067,25,"--",37,183,53,0.641
38,"-1","ADELE Set Fire To The Rain",182,3,-36,12,0.265,0.008,81,"4",28,257,84,0.666
39,"=","KASABIAN Days Are Forgotten",168,2,23,-4,0.26,0.012,117,"--",35,168,41,0.272
40,"=","MIDDLE CLASS RUT Are You On Your Way",165,0,24,-5,0.372,0.005,30,"--",39,165,56,0.373
41,"=","SNOW PATROL Called Out In The Dark",159,4,6,2,0.571,-0.011,16,"245",38,164,65,0.619
42,"+3","ANGELS AND AIRWAVES Surrender",148,13,47,5,0.946,0.034,10,"--",42,148,47,0.946
43,"-1","STAIND Eyes Wide Open",146,-1,-8,-5,0.351,0.007,57,"--",39,157,32,0.468
44,"=","BOMBAY BICYCLE CLUB Shuffle",139,3,5,0,0.205,0.019,43,"--",40,139,23,0.228
45,"+1","SKRILLEX Bangarang",132,3,49,3,0.391,0.01,5,"114",45,132,49,0.391
46,"-3","AVENGED SEVENFOLD Buried Alive",127,-10,-72,4,0.295,-0.04,138,"--",27,273,46,0.782
47,"+1","REDLIGHT KING Bullet In My Hand",117,4,13,2,0.332,0.016,122,"--",41,153,47,0.604
48,"-1","KOOKS How'd You Like That",116,-2,-10,3,0.151,-0.002,19,"--",44,131,42,0.168
49,"+1","TWIN ATLANTIC Free",103,7,37,7,0.074,0.005,3,"--",49,103,37,0.074
50,"-1","DEATH CAB FOR CUTIE Underneath The Sycam...",102,2,-12,5,0.166,-0.004,35,"--",38,136,38,0.333
