"Pos","Pos+","Artist and Title","Spins","Spins+","Bullet","Bullet+","Aud","Aud+","Days","iTunes","PkPos","PkSpins","PkBllt","PkAud"
1,"=","GOTYE Somebody That I Used To Know",2133,-12,13,-22,11.623,0.004,121,"3",1,2145,270,11.623
2,"=","FUN We Are Young",2099,11,47,5,11.684,0.039,135,"1",2,2099,229,11.684
3,"=","BLACK KEYS Gold On The Ceiling",1509,25,138,-2,7.383,0.132,76,"189",3,1509,266,7.383
4,"=","GROUPLOVE Tongue Tied",1476,22,65,32,6.25,0.068,115,"199",3,1476,194,6.25
5,"=","M83 Midnight City",1298,11,74,-7,5.753,0.12,126,"143",5,1298,167,5.753
6,"=","AWOLNATION Not Your Fault",1219,-30,-174,-31,4.876,-0.201,188,"314",3,1498,132,6.341
7,"=","FOSTER THE PEOPLE Don't Stop (Color On T...",1203,-27,-124,-15,5.424,-0.063,158,"223",5,1451,213,6.316
8,"=","BLACK KEYS Lonely Boy",1103,-22,-143,5,5.834,-0.134,160,"--",1,2170,963,11.053
9,"=","RISE AGAINST Satellite",1053,-7,-48,-2,4.075,-0.051,151,"732",7,1238,189,5.579
10,"+1","OF MONSTERS AND MEN Little Talks",1027,6,90,1,3.574,-0.018,120,"--",10,1027,114,3.679
11,"-1","FOO FIGHTERS These Days",1021,-1,-47,20,4.882,-0.083,198,"864",2,1683,204,8.614
12,"=","NEON TREES Everybody Talks",984,5,81,-9,4.663,0.118,114,"33",12,984,183,4.663
13,"=","JACK WHITE Love Interruption",858,-13,-32,-10,2.479,-0.1,63,"461",12,915,377,3.255
14,"+1","SHINS Simple Song",812,12,64,1,2.288,0.005,83,"--",14,812,282,2.288
15,"-1","RED HOT CHILI PEPPERS Look Around",808,-6,25,-21,2.325,-0.029,56,"--",14,814,197,2.582
16,"=","SHINEDOWN Bully",769,-7,-3,-3,2.855,-0.012,89,"--",14,803,360,3.179
17,"=","IMAGINE DRAGONS It's Time",723,8,111,-17,2.566,-0.022,41,"493",17,723,134,2.588
18,"=","BUSH Baby Come Home",712,2,-26,2,2.511,0.042,71,"--",16,738,166,2.851
19,"=","COLDPLAY Charlie Brown",708,0,66,-13,3.14,-0.022,79,"917",19,708,147,3.162
20,"=","FOXY SHAZAM I Like It",561,4,21,6,1.601,0.044,65,"--",20,563,145,1.601
21,"=","SILVERSUN PICKUPS Bloody Mary (Nerve End...",508,12,423,-53,2.267,-0.155,7,"--",21,508,476,2.422
22,"=","CIVIL TWILIGHT Fire Escape",422,7,35,0,1.502,0.005,73,"--",22,422,58,1.504
23,"=","SWITCHFOOT Afterlife",367,7,23,2,1.312,0.018,27,"--",23,367,95,1.312
24,"=","DIRTY HEADS Spread Too Thin",317,16,133,-6,2.662,0.127,11,"--",24,317,144,2.662
25,"=","SEETHER No Resolution",309,9,36,15,0.913,0.036,66,"--",24,309,63,0.955
26,"+3","GARBAGE Blood For Poppies",303,27,111,21,1.639,0.151,13,"547",26,303,155,1.639
27,"-1","USED I Come Alive",299,4,13,9,0.811,-0.005,71,"444",23,302,59,0.816
28,"-1","WALK THE MOON Anna Sun",286,4,47,-7,1.317,-0.007,37,"--",27,286,86,1.381
29,"-1","CHEVELLE Hats Off To The Bull",275,-2,11,-10,0.861,-0.026,37,"--",25,283,107,0.908
30,"+2","EVE 6 Victoria",251,9,42,10,1.151,0.026,30,"--",30,251,81,1.151
31,"=","SANTIGOLD Disparate Youth",250,2,24,-5,0.736,0.083,30,"643",25,250,85,0.736
32,"+1","YOUNG THE GIANT Apartment",247,9,-23,9,0.562,0.019,44,"--",26,270,60,0.704
33,"-3","MIDDLE CLASS RUT Are You On Your Way",246,-3,1,-5,0.651,-0.016,78,"--",28,256,56,0.678
34,"=","SNOW PATROL Called Out In The Dark",228,-3,-29,-1,0.742,-0.035,64,"317",26,263,65,1.058
35,"+2","FLORENCE + THE MACHINE No Light, No Ligh...",213,14,57,10,0.805,0.018,14,"--",35,213,94,0.805
36,"-1","TWIN ATLANTIC Free",201,-2,6,-6,0.36,-0.005,51,"--",35,203,37,0.387
37,"-1","BAND OF SKULLS Sweet Sour",187,-14,-48,-22,0.46,-0.005,105,"--",29,272,64,0.716
38,"=","SLEEPER AGENT Get Burned",185,-2,-28,9,0.472,-0.009,78,"--",24,265,51,0.693
39,"=","REDLIGHT KING Bullet In My Hand",180,1,-5,0,0.428,0.023,170,"414",36,189,58,0.604
40,"=","BOMBAY BICYCLE CLUB Shuffle",176,4,-2,6,0.294,0.005,91,"--",37,184,38,0.393
41,"=","FOO FIGHTERS Bridge Burning",162,7,52,3,0.345,0.006,6,"--",41,162,52,0.345
42,"=","ELECTRIC GUEST This Head I Hold",151,-4,-17,-8,0.38,0.003,28,"--",37,170,33,0.487
43,"=","FEATURES How It Starts",136,3,9,2,0.369,0,21,"--",43,136,27,0.369
44,"+1","CAGE THE ELEPHANT Always Something",128,7,5,8,0.312,0.015,16,"--",44,128,23,0.312
45,"-1","DELTA SPIRIT California",121,-1,13,-5,0.328,-0.029,4,"--",44,124,21,0.357
46,"=","FLOGGING MOLLY Saints & Sinners",120,0,4,2,0.281,-0.013,17,"--",43,125,25,0.336
47,"=","SKRILLEX Bangarang",119,-1,-3,2,0.244,0.016,53,"68",43,152,49,0.476
48,"+1","ANIMAL KINGDOM Strange Attractor",116,5,3,10,0.177,0.002,12,"--",43,126,43,0.297
49,"-1","WOMBATS Jump Into The Fog",112,0,3,-4,0.122,-0.003,4,"--",48,114,22,0.144
50,"=","WEAVING THE FATE Rack City",96,1,18,4,0.169,0.005,3,"--",48,103,18,0.298
