"Pos","Pos+","Artist and Title","Spins","Spins+","Bullet","Bullet+","Aud","Aud+","Days","iTunes","PkPos","PkSpins","PkBllt","PkAud"
1,"=","BLACK KEYS Lonely Boy",2064,"-21",-74,"-26",9.858,"-0.244",103,"--",1,2170,963,11.053
2,"=","FOO FIGHTERS These Days",1610,"-2",-57,"-1",7.486,"-0.140",141,"584",2,1683,204,8.614
3,"=","GOTYE Somebody That I Used To Know",1562,"+30",267,"+11",7.55,"+0.041",64,"--",3,1562,270,7.55
4,"=","YOUNG THE GIANT Cough Syrup",1336,"-32",-127,"-25",5.579,"-0.232",217,"288",2,1548,155,7.059
5,"=","AWOLNATION Not Your Fault",1208,"+11",75,"-1",4.449,"+0.169",131,"296",5,1208,122,4.449
6,"=","COLDPLAY Paradise",1191,"-5",-42,"+5",6.319,"-0.028",145,"26",1,1757,369,8.687
7,"=","FOSTER THE PEOPLE Don't Stop (Color On T...",1162,"+5",86,"+2",4.189,"+0.000",101,"108",7,1162,213,4.348
8,"=","CHEVELLE Face To The Floor",1092,"+4",3,"-1",5.01,"-0.036",129,"--",8,1103,275,5.372
9,"+1","FUN We Are Young",1046,"+14",134,"-11",4.343,"-0.109",78,"8",9,1046,229,4.578
10,"-1","RISE AGAINST Satellite",1039,"-9",43,"-30",4.665,"-0.011",94,"850",9,1048,189,4.676
11,"+1","BLINK 182 After Midnight",993,"-3",-39,"+3",4.031,"-0.026",127,"--",8,1064,147,4.66
12,"-1","CAGE THE ELEPHANT Aberdeen",989,"-20",-100,"-6",3.945,"-0.136",155,"--",6,1164,191,4.457
13,"=","FLORENCE + THE MACHINE Shake It Out",942,"-2",33,"-6",4.018,"-0.056",125,"--",13,944,148,4.817
14,"=","RED HOT CHILI PEPPERS Monarchy Of Roses",880,"-44",-253,"-44",3.6,"-0.141",113,"--",5,1307,191,5.466
15,"=","BUSH The Sound Of Winter",865,"-34",-168,"-27",4.976,"-0.223",197,"628",1,1806,344,9.58
16,"=","GROUPLOVE Tongue Tied",824,"+4",104,"-3",3.085,"-0.094",58,"211",16,824,194,3.179
17,"=","M83 Midnight City",729,"+4",80,"-23",3.116,"-0.214",69,"188",17,729,167,3.714
18,"=","SHINEDOWN Bully",623,"+7",62,"-3",2.273,"+0.008",32,"--",18,623,360,2.273
19,"=","NEON TREES Everybody Talks",496,"-1",19,"-4",1.462,"-0.009",57,"--",19,497,183,1.516
20,"+1","SHINS Simple Song",477,"+18",95,"+22",1.496,"-0.009",26,"826",20,477,282,1.505
21,"-1","KORN F/SKRILLEX/KILL THE NOISE Narcissis...",465,"+3",9,"+10",1.791,"-0.049",111,"--",20,488,106,2.003
22,"=","OF MONSTERS AND MEN Little Talks",443,"-7",32,"-24",1.267,"-0.078",63,"--",21,450,114,1.562
23,"=","CAKE Mustache Man (Wasted)",420,"-9",-10,"-9",1.11,"-0.036",97,"--",21,439,87,1.156
24,"+3","JACK WHITE Love Interruption",377,"+53",377,"+53",2.269,"+0.229",6,"163",24,377,377,2.269
25,"=","BUSH Baby Come Home",366,"+14",148,"-11",1.675,"+0.026",14,"--",25,366,166,1.675
26,"-2","JANE'S ADDICTION Underground",359,"-2",6,"-4",0.692,"+0.013",82,"--",24,367,106,0.692
27,"-1","COLDPLAY Charlie Brown",343,"+10",105,"-10",1.454,"+0.049",22,"610",26,343,147,1.454
28,"=","JOY FORMIDABLE Heavy Abacus",306,"-14",-32,"-20",0.628,"-0.018",80,"--",25,338,78,0.908
29,"=","BAND OF SKULLS Sweet Sour",244,"-2",18,"-1",0.523,"-0.053",48,"--",29,246,64,0.716
30,"=","ADELE Set Fire To The Rain",237,"-3",10,"-4",0.427,"-0.017",72,"3",28,257,84,0.666
31,"=","AVENGED SEVENFOLD Buried Alive",218,"-1",-15,"-2",0.771,"+0.000",129,"--",27,273,46,0.782
32,"=","VOLBEAT A Warrior's Call",216,"+1",12,"+1",0.51,"+0.006",49,"301",31,216,46,0.519
33,"=","USED I Come Alive",165,"+1",27,"-8",0.383,"-0.018",14,"--",33,165,46,0.401
34,"=","SLEEPER AGENT Get Burned",165,"+2",12,"-4",0.356,"+0.004",21,"--",33,165,39,0.356
35,"=","FOXY SHAZAM I Like It",163,"+3",67,"-12",0.442,"+0.014",8,"--",35,163,81,0.442
36,"+1","SEETHER No Resolution",162,"+10",57,"+8",0.439,"+0.048",9,"--",36,162,57,0.439
37,"-1","BLACK KEYS Gold On The Ceiling",158,"+0",10,"+1",0.702,"-0.044",19,"745",35,158,41,0.746
38,"+3","SNOW PATROL Called Out In The Dark",148,"+8",65,"+3",0.532,"+0.041",7,"209",38,148,65,0.532
39,"=","FIVE FINGER DEATH PUNCH Remember Everyth...",146,"+3",2,"+11",0.428,"+0.004",62,"305",33,161,51,0.486
40,"-2","A DAY TO REMEMBER It's Complicated",145,"-4",-25,"-6",0.42,"-0.029",73,"--",32,177,34,0.575
41,"-1","STAIND Eyes Wide Open",144,"+2",28,"+0",0.345,"-0.002",48,"--",40,144,28,0.468
42,"=","KASABIAN Days Are Forgotten",142,"+4",10,"+5",0.204,"-0.001",108,"--",35,159,41,0.272
43,"=","MIDDLE CLASS RUT Are You On Your Way",132,"-1",8,"-2",0.301,"+0.013",21,"--",40,133,56,0.301
44,"=","BOMBAY BICYCLE CLUB Shuffle",130,"-2",6,"-2",0.174,"+0.000",34,"--",40,132,23,0.228
45,"+1","CIVIL TWILIGHT Fire Escape",129,"+5",19,"-1",0.243,"+0.006",16,"--",43,129,38,0.243
46,"-1","KOOKS How'd You Like That",128,"-1",24,"-7",0.163,"+0.000",10,"--",45,129,42,0.168
47,"=","DEATH CAB FOR CUTIE Underneath The Sycam...",119,"-4",-12,"-7",0.218,"-0.025",26,"--",38,136,38,0.333
48,"+1","REDLIGHT KING Bullet In My Hand",100,"+1",11,"+5",0.271,"+0.002",115,"815",41,153,47,0.604
49,"+1","KNUX Razorblade",93,"-6",-11,"-12",0.07,"-0.016",69,"--",41,125,28,0.188
50,"--","ANGELS AND AIRWAVES Surrender",91,"--",14,"--",0.808,"--",1,"--",50,91,14,0.808
