"Pos","Pos.","Artist.and.Title","Spins","Spins.","Bullet","Bullet.","Aud","Aud.","Days","PkPos","PkSpins","PkBllt","PkAud"
1,"=","KATY PERRY E.T.",14567,"-25",-164,"+24",96.031,"-0.555",3,1,14624,0,96.745
2,"=","BLACK EYED PEAS Just Can't Get Enough",13034,"+36",506,"-141",81.882,"-0.090",3,2,13034,715,81.972
3,"=","BRITNEY SPEARS Till The World Ends",11417,"+50",840,"-88",74.14,"+0.622",3,3,11417,966,74.14
4,"=","ADELE Rolling In The Deep",10381,"+293",2160,"-45",69.721,"+1.519",3,4,10381,2273,69.721
5,"+2","JENNIFER LOPEZ F/PITBULL On The Floor",9588,"+21",499,"-91",62.32,"-0.003",3,5,9588,668,62.323
6,"-1","KE$HA Blow",9579,"-280",-1161,"-199",53.311,"-1.323",3,4,10135,0,56.264
7,"-1","RIHANNA S&M",9379,"-345",-2052,"-132",60.246,"-2.247",3,5,10081,0,64.524
8,"=","TINIE TEMPAH Written In The Stars",8494,"+96",727,"-29",52.263,"+0.482",3,8,8494,756,52.263
9,"=","BRUNO MARS Lazy Song",8483,"+125",730,"+0",49.807,"+0.898",3,9,8483,786,49.807
10,"=","JEREMIH Down On Me f/50 Cent",7998,"-54",0,"-112",43.475,"-0.292",3,10,8052,153,44.2
11,"=","THE SCRIPT For The First Time",5911,"+71",345,"+53",33.227,"-0.151",3,11,5911,345,33.625
12,"=","CEE LO GREEN F**k You (Forget You)",5633,"-92",-1275,"+113",31.767,"-0.340",3,11,5830,0,32.865
13,"=","JESSIE J Price Tag f/B.O.B",5629,"+34",466,"-52",29.9,"-0.075",3,13,5629,582,29.975
14,"=","PINK F**kin' Perfect (Perfect)",5180,"-118",-476,"+5",26.885,"-0.592",3,14,5394,0,27.986
15,"=","PITBULL Give Me Everything f/Ne-Yo",4967,"+199",1181,"+89",37.754,"+1.353",3,15,4967,1181,37.754
16,"=","LADY GAGA Judas",4308,"-275",-652,"-302",22.875,"-2.295",3,15,4801,0,27.232
17,"=","LUPE FIASCO The Show Goes On",4256,"+124",748,"+25",27.754,"+0.376",3,17,4256,786,27.754
18,"=","NEW BOYZ Back Seat f/Cataracs & Dev",3709,"+38",274,"-1",18.848,"+0.269",3,18,3709,331,18.848
19,"=","LADY GAGA Born This Way",3509,"-33",-674,"+81",19.171,"-0.473",3,19,3651,0,20.436
20,"=","DR. DRE I Need A Doctor f/Eminem",3257,"-115",-501,"-86",19.804,"-0.882",3,20,3521,0,21.933
21,"=","MIKE POSNER F/LIL WAYNE Bow Chicka Wow W...",3233,"+7",123,"-4",13.54,"-0.110",3,21,3233,127,13.744
22,"=","SELENA GOMEZ & THE SCENE Who Says",3140,"+103",571,"+58",17.877,"+0.691",3,22,3140,571,17.877
23,"=","WIZ KHALIFA Roll Up",3036,"+53",615,"-32",15.336,"+0.091",3,23,3036,725,15.336
24,"+1","HOT CHELLE RAE Tonight Tonight",2695,"+87",488,"+38",11.514,"+0.371",3,24,2695,488,11.514
25,"-1","AVRIL LAVIGNE What The Hell",2641,"-130",-1050,"+37",12.885,"-0.505",3,24,2903,0,13.876
26,"=","ONEREPUBLIC Good Life",2559,"+58",423,"-32",12.384,"+0.463",3,26,2559,456,12.384
27,"=","MARTIN SOLVEIG & DRAGONETTE Hello",2474,"+40",492,"-56",17.54,"+0.287",3,27,2474,560,17.54
28,"=","LMFAO Party Rock Anthem",2425,"+15",285,"-54",14.53,"+0.280",3,27,2425,344,14.53
29,"=","MY CHEMICAL ROMANCE Sing",1972,"-23",-79,"-29",7.826,"-0.134",3,29,2009,0,7.995
30,"+1","TAYLOR SWIFT The Story Of Us",1950,"+33",237,"-10",10.318,"+0.283",3,30,1950,291,10.318
31,"+1","BIG TIME RUSH Boyfriend",1883,"+5",180,"-17",7.085,"+0.195",3,31,1883,197,7.085
32,"-2","NICKI MINAJ Moment 4 Life f/Drake",1875,"-73",-1161,"+200",12.111,"-0.772",3,29,2036,0,13.564
33,"=","CHRIS BROWN Look At Me Now",1692,"+12",198,"+10",11.837,"+0.069",3,33,1692,229,11.837
34,"=","SHONTELLE Say Hello To Goodbye",1371,"+19",114,"-3",3.932,"+0.020",3,34,1371,142,3.932
35,"+1","BEYONCE Run The World (Girls)",1234,"-49",61,"-118",4.882,"-0.305",3,35,1285,242,5.356
36,"-1","THIRTY SECONDS TO MARS Closer To The Edg...",1209,"-91",-348,"-90",4.214,"-0.293",3,34,1390,0,4.829
37,"=","BRITNEY SPEARS Hold It Against Me",1171,"+10",-84,"+31",8.921,"-0.006",3,37,1171,0,8.927
38,"=","KANYE WEST All Of The Lights",1170,"+13",69,"+14",7.48,"+0.180",3,37,1170,71,7.48
39,"+3","LADY GAGA The Edge Of Glory",1082,"+293",1082,"+293",10.476,"+2.444",3,39,1082,1082,10.476
40,"=","MAROON 5 Never Gonna Leave This Bed",961,"+49",299,"+23",3.703,"+0.168",3,40,961,312,3.703
41,"-2","CHRISTINA PERRI Jar Of Hearts",941,"-10",-195,"-2",4.366,"-0.126",3,39,965,0,4.696
42,"-1","THE READY SET Young Forever",883,"+24",31,"+17",2.262,"+0.061",3,41,883,54,2.295
43,"=","NICKI MINAJ Super Bass",866,"+105",550,"+58",6.296,"+0.334",3,43,866,550,6.296
44,"+3","DAVID GUETTA/FLO RIDA/NICKI M. Where The...",688,"+73",478,"+41",2.957,"+0.430",3,44,688,478,2.957
45,"-1","NEON TREES Your Surrender",688,"+2",94,"-47",1.672,"+0.006",3,43,688,173,1.672
46,"-1","KERI HILSON Pretty Girl Rock",657,"-10",-302,"+73",3.003,"-0.041",3,42,691,0,3.188
47,"-1","FAR EAST MOVEMENT If I Was You (OMG) f/S...",638,"-2",89,"-19",2.188,"+0.065",3,45,640,108,2.201
48,"--","JASON DERULO Don't Wanna Go Home",630,"--",627,"--",4.912,"--",1,48,630,627,4.912
49,"--","ENRIQUE IGLESIAS Dirty Dancer f/Usher/Li...",555,"--",501,"--",4.095,"--",1,49,555,501,4.095
50,"-1","THE BAND PERRY If I Die Young",534,"+27",122,"+21",1.863,"+0.050",3,49,534,122,1.863
