"Pos","Pos.","Artist.and.Title","Spins","Spins.","Bullet","Bullet.","Aud","Aud.","Days","iTunes","PkPos","PkSpins","PkBllt","PkAud"
1,"=","KELLY CLARKSON Stronger (What Doesn't Ki...",13050,-98,-355,-93,93.399,-0.278,84,"10",1,13549,2321,99.332
2,"=","WANTED Glad You Came",12549,209,1357,108,88.925,1.635,84,"8",2,12549,1357,88.925
3,"=","DAVID GUETTA Turn Me On f/Nicki Minaj",12134,-77,-331,-61,90.538,-0.228,112,"22",2,12506,1674,92.019
4,"=","GYM CLASS HEROES Ass Back Home",10967,-21,122,-158,71.331,0.213,129,"35",4,10988,1379,73.574
5,"=","FUN. We Are Young f/Janelle Monae",10803,167,2192,-148,87.863,1.1,39,"1",5,10803,2738,87.863
6,"=","KATY PERRY Part Of Me",10170,54,673,-67,69.348,0.619,48,"11",6,10170,3625,69.348
7,"=","ADELE Set Fire To The Rain",9117,-340,-2172,-204,69.24,-2.109,128,"18",1,13928,2301,95.946
8,"=","DRAKE Take Care f/Rihanna",7253,110,85,56,55.868,0.581,85,"23",8,7253,1220,56.44
9,"=","JESSIE J Domino",6853,-161,-891,63,45.858,-1.641,198,"44",2,12024,1524,67.403
10,"=","CALVIN HARRIS Feel So Close",6805,14,326,-83,48.337,0.153,52,"13",10,6805,1329,48.337
11,"=","FLO RIDA Wild Ones f/Sia",6782,102,1081,-63,48.807,0.815,57,"5",11,6782,1182,48.807
12,"=","PITBULL F/CHRIS BROWN International Love",6500,-173,-1298,8,43.569,-1.585,150,"30",5,9155,1086,62.67
13,"=","FLO RIDA Good Feeling",6345,-77,-719,74,50.3,-0.865,189,"34",1,13154,1657,85.747
14,"+1","NICKI MINAJ Starships",6163,38,326,-75,43.352,0.227,47,"7/32",14,6163,1834,43.352
15,"-1","WIZ KHALIFA/SNOOP DOGG Young, Wild & Fre...",6044,-103,-927,-42,38.956,-1.051,129,"15",10,7182,1174,48.863
16,"=","RIHANNA We Found Love f/Calvin Harris",6027,-56,-584,-86,53.981,-0.05,189,"52",1,14238,2184,95.593
17,"=","ONE DIRECTION What Makes You Beautiful",5808,85,1071,-109,35.726,0.64,32,"4",17,5808,1579,35.726
18,"=","OUTASIGHT Tonight Is The Night",5398,-181,-572,-116,32.177,-1.325,152,"54",13,6035,572,36.649
19,"=","CHRIS BROWN Turn Up The Music",4660,-40,-156,32,29.939,-0.323,60,"26",18,4894,987,33.507
20,"=","KARMIN Broken Hearted",4480,40,371,-26,26.094,0.762,42,"16",19,4480,936,26.094
21,"+4","JUSTIN BIEBER Boyfriend",4012,820,4012,820,33.737,6.664,6,"2",21,4012,4012,33.737
22,"-1","TRAIN Drive By",4009,20,311,-15,21.871,0.234,77,"9",20,4009,527,21.871
23,"-1","ADELE Rumour Has It",3783,163,1250,13,20.728,1.242,28,"29",22,3783,1250,20.728
24,"-1","B.O.B So Good",3625,10,496,-194,24.537,-0.034,29,"12",22,3625,1013,24.571
25,"-1","GOTYE Somebody That I Used To Know",3390,180,1006,61,26.386,1.373,31,"3",24,3390,1006,26.386
26,"=","CARLY RAE JEPSEN Call Me Maybe",2392,176,1082,43,15.061,1.188,21,"6",26,2392,1082,15.061
27,"=","RIHANNA Talk That Talk f/Jay Z",2206,7,206,-27,11.987,-0.244,54,"50",25,2206,339,12.882
28,"=","CHRISTINA PERRI A Thousand Years",1799,-35,-227,-7,8.976,-0.16,87,"38",23,2055,280,9.423
29,"+4","TAYLOR SWIFT Eyes Open",1484,178,1162,89,9.279,0.643,7,"14",29,1484,1162,9.279
30,"-1","DEV & ENRIQUE IGLESIAS Naked",1403,-21,-102,-9,8.242,-0.12,71,"172",28,1524,318,8.497
31,"-1","ELLIE GOULDING Lights",1378,2,173,-24,6.743,0.032,51,"73",30,1378,226,6.743
32,"=","K'NAAN F/NELLY FURTADO Is Anybody Out Th...",1329,13,166,-19,7.688,0.09,28,"150",32,1329,461,8.004
33,"-2","DRAKE The Motto f/Lil Wayne",1324,3,123,-3,15.013,-0.212,42,"20",31,1324,237,15.761
34,"=","HAVANA BROWN We Run The Night f/Pitbull",1280,14,80,-24,9.881,0.255,49,"93",33,1280,237,10.526
35,"=","JASON DERULO Breathing",1017,-123,-500,-120,4.406,-0.513,57,"218",28,1573,432,6.812
36,"=","JAY Z & KANYE WEST N***** In Paris",1014,-31,-251,-4,8.491,0.058,147,"65",15,5155,785,36.602
37,"+2","DEMI LOVATO Give Your Heart A Break",984,35,155,11,5.855,-0.046,32,"104",37,984,155,5.956
38,"+3","JENNIFER LOPEZ Dance Again f/Pitbull",970,150,970,150,13.002,1.474,2,"--",38,970,970,13.002
39,"-1","NEON HITCH F U Betta",969,-4,114,-23,2.747,-0.102,28,"701",36,981,215,2.896
40,"-3","COLDPLAY Princess Of China",932,-54,-703,20,4.075,-0.309,127,"81",24,2042,363,10.812
41,"-1","CHRIS RENE Young Homie",881,19,204,5,3.045,0.108,21,"99",40,881,204,3.045
42,"=","WALLPAPER F**king Best Song Everrr",816,2,123,-49,3.453,-0.046,16,"--",40,816,262,3.563
43,"=","ALL-AMERICAN REJECTS Beekeeper's Daughte...",772,-7,-27,-2,2.474,0.059,43,"--",38,804,204,2.758
44,"+1","USHER Climax",770,33,99,16,3.462,-0.03,14,"36",42,770,348,3.492
45,"-1","TYGA Rack City",716,-25,-247,14,2.783,-0.172,65,"28",32,1257,287,8.937
46,"=","SEAN PAUL She Doesn't Mind",517,-2,13,4,1.697,-0.016,21,"484",45,519,158,1.821
47,"+1","J. COLE Can't Get Enough f/Trey Songz",510,11,-17,29,3.098,-0.064,21,"124",43,562,156,3.809
48,"-1","AVICII Levels",479,-27,-19,-54,5.714,-0.055,87,"107",33,1352,260,9.722
49,"=","PITBULL Back In Time",466,77,466,77,5.358,1.221,3,"49",49,466,466,5.358
50,"=","FAR EAST MOVEMENT Live My Life f/Justin ...",393,33,58,16,1.383,0.201,10,"303",48,393,61,1.383
