"Pos","Pos+","Artist and Title","Spins","Spins+","Bullet","Bullet+","Aud","Aud+","Days","iTunes","PkPos","PkSpins","PkBllt","PkAud"
1,"=","ADELE Someone Like You",5223,0,2,-20,28.79,0.056,100,"3",1,5248,683,28.79
2,"=","MAROON 5 F/CHRISTINA AGUILERA Moves Like...",5019,5,-46,28,27.696,-0.069,114,"7",1,5117,599,28.022
3,"=","FOSTER THE PEOPLE Pumped Up Kicks",4028,-15,79,-25,21.252,0.085,125,"4",3,4043,385,21.252
4,"=","THE SCRIPT Nothing",3812,32,226,3,17.235,0.347,103,"39",4,3812,439,17.235
5,"=","HOT CHELLE RAE Tonight Tonight",3582,-63,-323,-7,19.64,-0.403,156,"50",2,4609,408,25.013
6,"=","KELLY CLARKSON Mr. Know It All",3572,10,75,-11,18.133,-0.019,54,"--",6,3572,947,18.505
7,"=","LADY GAGA You And I",3384,30,228,-40,16.944,0.062,70,"17",7,3384,543,16.944
8,"=","ONEREPUBLIC Good Life",3159,-16,-288,35,17.998,0.071,167,"40",1,4888,408,25.509
9,"=","COLBIE CAILLAT Brighter Than The Sun",3055,35,229,27,16.524,0.127,120,"74",9,3055,357,16.524
10,"=","GAVIN DEGRAW Not Over You",2679,20,137,20,11.221,0.086,133,"33",10,2679,348,11.221
11,"=","LADY ANTEBELLUM Just A Kiss",2524,12,272,-59,12.521,0.037,98,"36",11,2524,351,12.521
12,"=","DAUGHTRY Crawling Back To You",2424,25,181,3,11.639,0.163,34,"273",12,2424,901,11.639
13,"+1","NICKELBACK When We Stand Together",2226,32,260,-31,10.037,0.036,31,"57",13,2226,725,10.037
14,"-1","KATY PERRY Last Friday Night (T.G.I.F.)",2210,-63,-403,1,12.526,-0.224,135,"65",1,4794,785,25.04
15,"=","THE BAND PERRY If I Die Young",2122,-3,-175,63,11.018,0.072,150,"44",3,3975,496,19.165
16,"=","LMFAO Party Rock Anthem",1850,-5,34,-4,9.828,-0.136,123,"15",14,1855,181,10.199
17,"=","RED HOT CHILI PEPPERS Adventures Of Rain...",1386,9,100,-4,4.605,0.077,87,"113",17,1386,222,4.605
18,"=","MAT KEARNEY Hey Mama",1367,-6,-37,-11,4.701,0.028,167,"383",18,1404,111,4.732
19,"=","COBRA STARSHIP You Make Me Feel... f/Sab...",1316,20,168,-1,6.058,0.169,79,"10",19,1316,198,6.058
20,"=","GYM CLASS HEROES Stereo Hearts f/Adam Le...",1157,26,230,-3,6.897,0.231,61,"8",20,1157,233,6.897
21,"+2","FRAY Heartbeat",1005,56,477,-5,4.425,0.155,13,"202",21,1005,485,4.425
22,"=","BRUNO MARS It Will Rain",1004,36,262,1,4.119,0.092,24,"21",22,1004,302,4.119
23,"-2","O.A.R. Heaven",995,10,8,5,3.645,0.007,113,"--",21,996,110,3.793
24,"+1","PARACHUTE Kiss Me Slowly",930,8,43,-5,2.494,-0.022,60,"398",24,930,165,2.516
25,"-1","PITBULL Give Me Everything f/Ne-Yo",917,-31,-115,-10,4.846,-0.195,136,"45",17,1414,229,7.639
26,"=","SIMPLE PLAN Jet Lag f/Natasha Bedingfiel...",779,8,32,19,1.799,0.036,64,"--",26,779,118,1.799
27,"=","COLDPLAY Every Teardrop Is A Waterfall",698,-23,-239,-3,2.75,0.012,139,"194",7,2952,560,12.98
28,"=","DEMI LOVATO Skyscraper",663,-11,5,-22,1.799,-0.087,79,"68",28,674,127,1.978
29,"+3","COLDPLAY Paradise",626,29,132,5,2.395,0.16,22,"16",29,626,190,2.395
30,"-1","BRITNEY SPEARS I Wanna Go",614,-17,-162,11,2.945,-0.117,104,"90",20,1242,228,6.438
31,"=","THEORY OF A DEADMAN Out Of My Head",610,10,57,2,0.959,0.034,59,"--",31,610,108,0.959
32,"-2","DURAN DURAN Leave A Light On",603,1,31,3,1.658,0.008,40,"--",30,603,232,1.698
33,"=","ELLIE GOULDING Lights",588,16,86,5,1.233,0.092,41,"145",33,588,180,1.233
34,"=","DAVID GUETTA Without You f/Usher",552,8,52,0,3.075,0.073,32,"6",33,552,133,3.075
35,"=","SARA BAREILLES Gonna Get Over You",453,3,30,-13,0.845,-0.002,28,"372",35,453,183,0.847
36,"=","RACHEL PLATTEN 1000 Ships",433,-2,14,-8,0.843,0.019,90,"--",36,436,63,0.843
37,"=","MARTIN SOLVEIG & DRAGONETTE Hello",409,-4,-57,15,2.64,0.036,67,"99",28,520,144,3.216
38,"+1","KATY PERRY The One That Got Away",405,20,180,-4,2.194,0.034,11,"51",38,405,187,2.194
39,"-1","KID ROCK Care f/Martina Mcbride",393,0,5,-8,1.025,0.001,33,"--",38,393,111,1.025
40,"=","THE CAB Bad",353,2,5,3,0.461,-0.007,70,"--",39,364,61,0.523
41,"=","SNOW PATROL Called Out In The Dark",333,11,64,8,0.292,0.005,38,"560",41,333,68,0.292
42,"=","AVRIL LAVIGNE Wish You Were Here",232,2,4,-9,0.858,0.066,16,"428",42,232,125,0.858
43,"=","RIHANNA We Found Love f/Calvin Harris",200,14,66,6,0.625,0.047,5,"1",43,200,66,0.625
44,"=","BAD MEETS EVIL Lighters f/Bruno Mars",183,4,-9,7,0.763,0.024,51,"58",42,247,61,0.945
45,"+1","PATRICK STUMP This City f/Lupe Fiasco",180,3,23,2,0.304,0.001,14,"219",45,180,34,0.359
46,"+1","LMFAO Sexy And I Know It",179,6,15,0,0.595,0.008,9,"2",45,179,58,0.61
47,"-2","SAFETYSUIT Let Go",176,-1,15,-7,0.198,0.004,9,"--",45,178,39,0.198
48,"=","SCARS ON 45 Heart On Fire",163,6,34,1,0.183,0.007,5,"--",48,163,38,0.183
49,"=","DAVID COOK Fade Into Me",161,6,45,-5,0.436,0.017,3,"--",49,161,60,0.436
50,"=","DEV In The Dark",131,1,-9,0,0.221,-0.018,27,"19",48,152,36,0.374
