"Pos","Pos+","Artist and Title","Spins","Spins+","Bullet","Bullet+","Aud","Aud+","Days","iTunes","PkPos","PkSpins","PkBllt","PkAud"
1,"=","KATY PERRY Last Friday Night (T.G.I.F.)",4753,16,117,11,24.979,-0.009,79,"23",1,4753,785,25.04
2,"=","ONEREPUBLIC Good Life",4561,-41,-234,-43,24.097,-0.053,111,"19",1,4888,408,25.509
3,"=","LADY GAGA The Edge Of Glory",3912,-79,-377,-67,21.383,-0.6,103,"50",2,4442,631,24.134
4,"=","THE BAND PERRY If I Die Young",3908,9,221,-37,19.107,-0.055,94,"22",4,3908,496,19.162
5,"=","HOT CHELLE RAE Tonight Tonight",3724,42,360,-14,20.152,0.364,100,"20",5,3724,408,20.152
6,"=","MAROON 5 F/CHRISTINA AGUILERA Moves Like...",3614,79,497,-4,18.457,0.361,58,"4",6,3614,599,18.457
7,"=","ADELE Rolling In The Deep",3173,-25,-294,32,17.816,0.111,111,"13",1,5540,342,29.393
8,"+1","COLDPLAY Every Teardrop Is A Waterfall",2794,0,77,-20,12.415,0.027,83,"69",8,2794,560,12.415
9,"-1","TRAIN Save Me San Francisco",2763,-78,-488,-67,10.689,-0.406,111,"118",6,3331,355,13.679
10,"+1","FOSTER THE PEOPLE Pumped Up Kicks",2420,53,374,-10,10.651,0.275,69,"2",10,2420,384,10.651
11,"-1","ANDY GRAMMER Keep Your Head Up",2379,-61,-417,-11,10.6,-0.137,111,"99",5,3549,291,16.891
12,"=","THE SCRIPT Nothing",2273,43,313,14,8.913,0.115,47,"66",12,2273,439,8.913
13,"=","ADELE Someone Like You",2235,88,499,40,9.928,0.374,44,"1",13,2235,499,9.928
14,"=","CHRISTINA PERRI Arms",1975,10,61,6,7.643,0.207,111,"147",13,1975,179,7.643
15,"+1","BLACK EYED PEAS Just Can't Get Enough",1904,-6,13,6,11.652,0.011,111,"101",12,2308,292,13.055
16,"-1","BRUNO MARS Lazy Song",1903,-59,-379,-15,11.288,-0.361,111,"72",2,4460,564,22.506
17,"=","MATT NATHANSON Faster",1890,17,166,2,7.356,0.038,111,"160",14,1890,181,7.356
18,"=","GOO GOO DOLLS All That You Are",1579,-9,64,-19,6.97,-0.073,76,"890",17,1588,250,7.234
19,"=","PITBULL Give Me Everything f/Ne-Yo",1383,11,10,-1,7.467,-0.097,80,"14",19,1383,229,7.564
20,"=","COLBIE CAILLAT Brighter Than The Sun",1358,2,159,-14,5.476,0.043,64,"110",20,1358,198,5.476
21,"=","GAVIN DEGRAW Not Over You",1319,19,126,22,4.329,0.002,77,"96",20,1319,237,4.329
22,"+1","LMFAO Party Rock Anthem",1140,22,175,11,6.508,0.143,67,"10",22,1140,175,6.508
23,"+1","MICHELLE BRANCH Loud Music",1122,8,69,-8,3.163,0.008,65,"--",23,1122,154,3.163
24,"-2","THREE DAYS GRACE Lost In You",1119,-11,10,-29,2.681,0.006,111,"842",21,1130,109,2.704
25,"=","JASON ALDEAN/KELLY CLARKSON Don't You Wa...",1098,-13,-106,0,6.348,-0.051,111,"100",10,2719,328,15.106
26,"=","MAT KEARNEY Hey Mama",1085,12,76,4,3.144,0.056,111,"--",24,1085,103,3.144
27,"=","BRITNEY SPEARS I Wanna Go",1029,20,144,18,4.257,0.129,48,"21",27,1029,228,4.257
28,"=","LADY ANTEBELLUM Just A Kiss",895,23,235,-17,4.426,0.09,42,"40",28,895,252,4.426
29,"=","LENNY KRAVITZ Stand",760,3,55,-3,1.487,-0.033,58,"--",28,760,112,1.554
30,"+1","LADY GAGA You And I",732,67,411,37,3.695,0.437,14,"3",30,732,411,3.695
31,"-1","O.A.R. Heaven",668,2,61,-1,2.541,0.073,57,"--",30,668,110,2.609
32,"=","JESSIE J Price Tag f/B.O.B",532,-12,-114,5,3.39,-0.15,111,"76",18,1280,162,6.478
33,"=","NICKI MINAJ Super Bass",361,8,47,-1,1.195,0.042,35,"16",33,361,91,1.195
34,"=","COBRA STARSHIP You Make Me Feel... f/Sab...",353,7,79,-9,1.817,0.039,23,"7",34,353,96,1.817
35,"=","RED HOT CHILI PEPPERS Adventures Of Rain...",346,8,72,-2,1.102,0.058,31,"146",35,346,74,1.102
36,"=","REEVE CARNEY Rise Above 1 f/Bono & The E...",328,-5,-26,-4,0.304,-0.016,59,"--",33,358,44,0.369
37,"+1","DEMI LOVATO Skyscraper",286,9,34,-2,0.945,0.06,23,"52",37,286,84,0.945
38,"-1","CAROLINA LIAR Drown",280,-1,11,-5,0.337,0.01,26,"--",36,285,84,0.426
39,"+1","MARTIN SOLVEIG & DRAGONETTE Hello",266,24,112,16,1.817,0.104,11,"113",39,266,112,1.817
40,"-1","JENNIFER LOPEZ F/PITBULL On The Floor",240,-9,-26,-5,0.859,-0.035,111,"89",24,909,148,4.073
41,"=","SIMPLE PLAN Jet Lag f/Natasha Bedingfiel...",236,9,89,-10,0.521,0.043,8,"--",41,236,113,0.521
42,"+3","PARACHUTE Kiss Me Slowly",225,26,134,24,0.618,0.058,4,"--",42,225,134,0.618
43,"+1","RIHANNA Cheers (Drink To That)",218,13,72,10,1.022,0.022,11,"8",43,218,72,1.022
44,"-2","JARED LEE It's Over (Goodbye)",217,-1,20,-7,0.208,0.013,23,"--",42,218,52,0.208
45,"-2","RACHEL PLATTEN 1000 Ships",215,3,16,5,0.154,0.009,34,"--",43,215,63,0.154
46,"+1","THEORY OF A DEADMAN Out Of My Head",200,12,108,0,0.178,0.009,3,"--",46,200,108,0.178
47,"-1","3 DOORS DOWN Every Time You Go",188,-9,-27,-4,0.151,-0.027,33,"--",39,225,40,0.322
48,"=","GYM CLASS HEROES Stereo Hearts f/Adam Le...",184,8,61,1,1.131,0.049,5,"9",48,184,61,1.131
49,"=","THE CAB Bad",167,3,30,1,0.192,-0.001,14,"--",48,167,31,0.193
50,"=","JERAD FINCK Runaway",154,0,-12,3,0.122,0.003,36,"--",45,178,25,0.122
