"Pos","Pos+","Artist and Title","Spins","Spins+","Bullet","Bullet+","Aud","Aud+","Days","PkPos","PkSpins","PkBllt","PkAud"
1,"=","ADELE Rolling In The Deep",5125,"+49",296,"+36",27.073,"+0.376",5,1,5125,296,27.073
2,"=","PINK F**kin' Perfect (Perfect)",4510,"-7",-27,"-1",24.715,"+0.062",5,2,4534,23,24.858
3,"=","THE SCRIPT For The First Time",4283,"+1",6,"-11",19.2,"-0.113",5,3,4317,123,19.649
4,"=","KATY PERRY E.T.",3658,"+32",393,"-32",17.971,"+0.152",5,4,3658,523,17.971
5,"=","CEE LO GREEN F**k You (Forget You)",3573,"-30",-346,"+22",19.176,"+0.011",5,4,3721,0,19.447
6,"=","MAROON 5 Never Gonna Leave This Bed",3181,"+28",219,"+1",15.309,"+0.276",5,6,3181,246,15.309
7,"=","BRUNO MARS Grenade",2662,"-60",-332,"-49",15.794,"-0.505",5,7,2871,0,17.585
8,"=","KATY PERRY Firework",2451,"-25",-226,"+30",15.518,"+0.071",5,8,2576,0,16.008
9,"=","COLBIE CAILLAT I Do",2337,"-3",103,"-9",10.321,"+0.094",5,9,2340,112,10.321
10,"=","ANDY GRAMMER Keep Your Head Up",2226,"+26",183,"+5",10.501,"+0.001",5,10,2226,263,10.529
11,"=","LIFEHOUSE Falling In",2169,"+4",-2,"+3",10.594,"-0.081",5,10,2169,62,11.084
12,"=","ONEREPUBLIC Good Life",2127,"+32",284,"-12",8.26,"+0.153",5,12,2127,385,8.26
13,"+1","AVRIL LAVIGNE What The Hell",1955,"-23",-103,"-9",9.299,"-0.168",5,13,2015,0,9.547
14,"+1","MY CHEMICAL ROMANCE Sing",1903,"+3",57,"-18",9.098,"-0.032",5,14,1903,184,9.144
15,"+1","LADY GAGA Born This Way",1840,"-22",-225,"+40",8.707,"-0.210",5,15,1960,0,9.458
16,"+1","SARA BAREILLES Uncharted",1672,"+15",80,"+4",5.65,"+0.137",5,16,1672,103,5.65
17,"+2","BRUNO MARS Lazy Song",1405,"+69",529,"+26",7.064,"+0.253",5,17,1405,529,7.064
18,"=","THIRTY SECONDS TO MARS Closer To The Edg...",1354,"+5",87,"-10",4.813,"+0.044",5,18,1354,97,4.813
19,"+1","PARACHUTE Something To Believe In",1259,"-1",34,"+2",4.366,"-0.042",5,19,1262,95,4.526
20,"+1","TRAIN Save Me San Francisco",1130,"+47",335,"+3",3.935,"+0.103",5,20,1130,355,3.935
21,"+1","GRACE POTTER & THE NOCTURNALS Paris (Ooh...",1026,"+13",91,"+6",3.87,"+0.153",5,21,1026,101,3.87
22,"+1","JASON ALDEAN/KELLY CLARKSON Don't You Wa...",966,"+37",181,"+1",5.052,"+0.110",5,22,966,189,5.052
23,"+1","ENRIQUE IGLESIAS Tonight f/Ludacris",876,"-17",-183,"+24",4.286,"-0.132",5,21,974,0,4.971
24,"+1","HE IS WE Happily Ever After",854,"+9",54,"-18",1.904,"+0.031",5,24,854,79,1.904
25,"+1","RIHANNA S&M",802,"+10",64,"-7",4.171,"-0.058",5,25,802,117,4.357
26,"+2","BRITNEY SPEARS Till The World Ends",757,"+9",139,"-24",3.232,"+0.057",5,26,757,164,3.232
27,"=","TAYLOR SWIFT Back To December",746,"-4",-53,"+7",4.666,"-0.006",5,27,778,0,5.118
28,"+3","BLACK EYED PEAS Just Can't Get Enough",733,"+29",199,"+15",3.795,"+0.111",5,28,733,199,3.795
29,"+1","KE$HA Blow",712,"+4",30,"-11",2.778,"+0.060",5,29,713,67,2.778
30,"-1","STONE SOUR Hesitate",704,"-12",0,"-23",1.509,"-0.016",5,28,722,31,1.525
31,"+1","MICHAEL FRANTI & SPEARHEAD I'll Be Waiti...",637,"-6",3,"-14",1.763,"-0.022",5,31,643,27,1.852
32,"+2","3 DOORS DOWN When You're Young",603,"+1",-29,"+1",2.193,"+0.023",5,32,628,35,2.224
33,"=","USHER More",559,"-45",-223,"-22",2.363,"-0.311",5,30,708,0,3.401
34,"+1","NEON TREES Your Surrender",536,"+7",42,"-3",0.888,"+0.013",5,34,536,74,0.993
35,"+1","JENNIFER LOPEZ F/PITBULL On The Floor",520,"+15",93,"+4",1.849,"+0.119",5,35,520,94,1.849
36,"+1","ANDREW ALLEN Loving You Tonight",446,"-5",-12,"-20",0.947,"+0.015",5,36,455,44,0.947
37,"+1","CHRISTINA PERRI Arms",438,"+14",77,"+2",1.225,"+0.037",5,37,438,77,1.225
38,"+1","JESSIE J Price Tag f/B.O.B",421,"+22",123,"+4",1.619,"+0.086",5,38,421,123,1.619
39,"+2","THREE DAYS GRACE Lost In You",374,"+4",23,"-3",0.66,"+0.008",5,39,374,48,0.66
40,"=","DURAN DURAN All You Need Is Now",361,"-11",-37,"-14",1.159,"+0.106",5,38,389,7,1.159
41,"+1","FITZ & THE TANTRUMS MoneyGrabber",345,"-2",-31,"-1",0.353,"-0.012",5,41,351,0,0.381
42,"+1","MATT HIRES Honey, Let Me Sing You A Song",309,"+2",-16,"+7",0.301,"-0.017",5,42,326,5,0.363
43,"+1","MUMFORD & SONS The Cave",304,"-2",2,"-4",1.503,"-0.001",5,43,308,28,1.504
44,"+1","MATT NATHANSON Faster",299,"+10",69,"+3",0.587,"+0.007",5,44,299,70,0.587
45,"+1","MAT KEARNEY Hey Mama",271,"+1",45,"-11",0.574,"+0.004",5,45,271,75,0.579
46,"+1","DAVID COOK Last Goodbye",260,"+6",101,"-1",0.725,"+0.037",3,46,260,102,0.725
47,"+1","HANSON Give A Little",255,"+2",20,"+1",0.526,"+0.021",5,47,255,20,0.526
48,"--","STEVEN TYLER (It) Feels So Good",252,"--",252,"--",1.699,"--",1,48,252,252,1.699
49,"=","MARC BROUSSARD Only Everything",249,"+5",6,"+10",0.281,"+0.020",5,46,251,15,0.301
50,"=","BC JEAN I'll Survive You",237,"+3",4,"+2",0.289,"-0.007",5,49,237,21,0.296
