"Pos","Pos+","Artist and Title","Spins","Spins+","Bullet","Bullet+","Aud","Aud+","Days","iTunes","PkPos","PkSpins","PkBllt","PkAud"
1,"=","KELLY CLARKSON Stronger (What Doesn't Ki...",4999,-13,-126,-30,31.114,0.036,71,"5",1,5134,855,31.337
2,"=","ADELE Set Fire To The Rain",4720,-36,-155,-31,29.917,-0.069,124,"10",1,4955,797,30.378
3,"=","BRUNO MARS It Will Rain",3693,19,-66,49,22.256,0.403,166,"59",3,4267,579,25.509
4,"+2","TRAIN Drive By",3441,25,169,-2,18.161,0.156,65,"7",4,3441,795,18.161
5,"=","JESSIE J Domino",3427,7,134,-25,19.206,0.12,95,"25",4,3433,485,19.206
6,"-2","COLDPLAY Paradise",3411,-19,80,-51,17.977,-0.121,164,"26",4,3433,274,18.446
7,"=","GAVIN DEGRAW Not Over You",3117,-69,-265,-78,16.817,-0.436,275,"44",1,4384,354,25.25
8,"=","KATY PERRY The One That Got Away",2967,-36,-306,14,18.088,-0.143,153,"108",1,4688,472,28.74
9,"=","CHRISTINA PERRI A Thousand Years",2887,36,214,1,14.95,0.219,130,"28",9,2887,299,14.95
10,"=","RIHANNA We Found Love f/Calvin Harris",2800,-37,-203,-16,19.547,-0.294,147,"41",5,3254,361,22.255
11,"=","KATY PERRY Part Of Me",2582,64,425,7,15.611,0.339,30,"9",11,2582,895,15.611
12,"=","JASON MRAZ I Won't Give Up",2235,24,202,-2,11.845,0.072,60,"23",11,2235,462,11.845
13,"=","GOTYE Somebody That I Used To Know",2000,32,292,-21,11.94,0.3,47,"3",13,2000,454,11.94
14,"=","ANDY GRAMMER Fine By Me",1863,7,132,-24,7.199,0.038,116,"144",13,1863,245,7.199
15,"=","DAVID GUETTA Without You f/Usher",1638,-18,-78,4,11.331,-0.078,174,"94",13,2285,313,13.95
16,"=","SNOW PATROL Called Out In The Dark",1586,-28,-111,-35,5.503,-0.176,180,"187",15,1697,209,5.847
17,"=","SELENA GOMEZ & THE SCENE Love You Like A...",1462,-39,-246,-16,6.641,-0.067,105,"75",13,1790,320,8.109
18,"=","ADELE Rumour Has It",1241,101,372,44,8.663,0.388,130,"36",18,1241,436,8.663
19,"+1","NICKELBACK Lullaby",1059,54,175,57,3.804,0.095,59,"426",19,1059,175,3.804
20,"-1","FOSTER THE PEOPLE Don't Stop (Color On T...",1017,-23,-62,-36,2.967,-0.134,95,"122",18,1080,187,3.815
21,"+2","FUN. We Are Young f/Janelle Monae",993,90,516,37,5.417,0.456,17,"1",21,993,516,5.417
22,"=","ADAM LAMBERT Better Than I Know Myself",966,27,110,23,3.584,0.048,62,"444",21,966,225,3.584
23,"-2","MATT NATHANSON Run f/Sugarland",950,2,-3,1,4.179,-0.012,87,"383",20,957,146,4.335
24,"+2","FLO RIDA Good Feeling",854,0,-56,11,4.709,0.03,123,"29",22,923,111,5.003
25,"-1","HOT CHELLE RAE I Like It Like That f/New...",844,-45,-235,-26,3.591,-0.119,100,"78",18,1247,199,4.478
26,"+1","THE WANTED Glad You Came",843,27,126,6,4.141,0.223,36,"2",26,843,314,4.141
27,"-2","FLORENCE + THE MACHINE Shake It Out",821,-36,-144,-29,3.482,-0.022,136,"58",20,990,101,3.839
28,"=","JOHN MAYER Shadow Days",709,19,253,-24,4.775,0.27,14,"70",28,709,346,4.775
29,"=","OUTASIGHT Tonight Is The Night",695,22,103,17,1.805,0.056,89,"38",27,695,114,1.805
30,"=","LMFAO Sexy And I Know It",601,4,21,-6,2.661,0.011,151,"20",27,606,93,3.102
31,"=","THE SCRIPT If You Ever Come Back",560,5,62,-9,1.888,0.027,36,"--",30,560,130,1.888
32,"=","MAT KEARNEY Ships In The Night",519,9,43,1,0.974,0.037,49,"366",32,519,132,0.974
33,"=","ERIC HUTCHINSON Watching You Watch Him",500,12,26,11,0.874,0.037,46,"--",31,500,105,0.874
34,"=","SCARS ON 45 Heart On Fire",433,-43,-139,-37,1.211,-0.061,147,"--",27,598,75,1.459
35,"=","YOUNG THE GIANT Cough Syrup",420,10,34,9,0.694,0.044,59,"117",33,420,95,0.694
36,"+1","DAVID GUETTA Turn Me On f/Nicki Minaj",382,17,54,21,1.155,0.05,53,"17",36,382,82,1.155
37,"-1","PITBULL F/CHRIS BROWN International Love",377,2,43,-8,1.278,0.056,46,"21",36,377,68,1.278
38,"=","JAMES DURBIN Love Me Bad",308,-1,-23,-10,0.402,-0.021,67,"--",36,331,70,0.702
39,"=","DEMI LOVATO Give Your Heart A Break",291,17,35,16,1.461,0.106,32,"226",39,291,63,1.461
40,"=","ALL-AMERICAN REJECTS Beekeeper's Daughte...",258,11,32,6,0.571,0.009,24,"782",40,258,66,0.629
41,"=","GRAFFITI6 Free",258,12,31,0,0.861,0.087,11,"--",40,258,113,0.861
42,"=","SAFETYSUIT These Times",238,2,13,5,0.876,0.011,32,"--",40,238,55,0.876
43,"=","O.A.R. Gotta Be Wrong Sometimes",180,3,-13,3,0.858,0.022,20,"--",43,193,64,1.049
44,"=","MIKEY WAX Counting On You",172,9,21,10,0.16,0.019,16,"--",44,172,26,0.16
45,"=","BLACK KEYS Lonely Boy",155,8,17,13,0.425,0.013,11,"--",45,155,18,0.447
46,"+4","COLBIE CAILLAT Favorite Song",148,32,133,24,1.1,0.219,2,"--",46,148,133,1.1
47,"=","CALVIN HARRIS Feel So Close",142,16,74,9,0.295,0.023,4,"11",47,142,74,0.295
48,"+1","NEEDTOBREATHE Keep Your Eyes Open",127,3,12,4,0.128,0.002,11,"--",48,127,25,0.128
49,"-3","INGRID MICHAELSON Ghost",127,0,1,-3,0.212,-0.011,29,"--",45,154,31,0.274
50,"-2","JOSH TATUM Everything I Need",124,-1,-1,-6,0.122,-0.005,11,"--",46,134,27,0.133
