"Pos","Pos+","Artist and Title","Spins","Spins+","Bullet","Bullet+","Aud","Aud+","Days","iTunes","PkPos","PkSpins","PkBllt","PkAud"
1,"=","ADELE Set Fire To The Rain",4839,"+32",203,"+8",28.017,"+0.273",88,"4",1,4839,797,28.017
2,"=","KATY PERRY The One That Got Away",4596,"-15",-92,"-42",28.74,"+0.176",117,"46",1,4688,472,28.74
3,"=","BRUNO MARS It Will Rain",4261,"-6",81,"-18",25.375,"-0.134",130,"29",3,4267,579,25.509
4,"=","GAVIN DEGRAW Not Over You",3939,"+6",-147,"+41",21.805,"+0.101",239,"19",1,4384,354,25.25
5,"=","RIHANNA We Found Love f/Calvin Harris",3190,"+0",70,"-15",22.156,"-0.002",111,"20",5,3212,361,22.158
6,"+1","KELLY CLARKSON Stronger (What Doesn't Ki...",3108,"+85",717,"-18",20.283,"+0.742",35,"2",6,3108,855,20.283
7,"-1","KELLY CLARKSON Mr. Know It All",2991,"-46",-355,"+19",19.183,"-0.275",160,"70",1,4553,947,27.314
8,"=","DAUGHTRY Crawling Back To You",2875,"-23",-165,"+9",14.431,"-0.255",140,"643",6,3196,901,16.959
9,"=","COLDPLAY Paradise",2804,"+27",145,"+23",15.056,"+0.317",128,"25",9,2804,274,15.056
10,"=","MAROON 5 F/CHRISTINA AGUILERA Moves Like...",2744,"-21",-115,"+7",18.073,"-0.282",220,"28",1,5169,599,29.564
11,"=","FRAY Heartbeat",2711,"-11",-4,"-32",11.281,"-0.098",119,"62",9,2736,528,11.773
12,"=","TRAIN Drive By",2464,"+13",409,"-73",13.064,"+0.081",29,"43",12,2464,795,13.064
13,"=","GYM CLASS HEROES Stereo Hearts f/Adam Le...",2070,"-24",-231,"+9",12.696,"-0.026",167,"--",7,3016,521,19.539
14,"=","DAVID GUETTA Without You f/Usher",2064,"-10",-108,"+4",13.432,"+0.028",138,"58",14,2285,313,13.95
15,"=","CHRISTINA PERRI A Thousand Years",2016,"+11",141,"+6",9.848,"+0.042",94,"21",15,2016,299,9.848
16,"=","JESSIE J Domino",1895,"+53",461,"-24",10.267,"+0.173",59,"15",16,1895,485,10.267
17,"=","SELENA GOMEZ & THE SCENE Love You Like A...",1565,"+1",142,"-35",7.486,"-0.210",69,"40",17,1565,320,7.696
18,"=","SNOW PATROL Called Out In The Dark",1420,"+7",157,"-14",4.221,"+0.019",144,"212",18,1420,209,4.221
19,"=","ANDY GRAMMER Fine By Me",1296,"+12",53,"-5",4.106,"+0.025",80,"489",19,1296,245,4.106
20,"=","ELLIE GOULDING Lights",1253,"-2",70,"-10",5.091,"+0.024",147,"108",17,1261,180,5.091
21,"=","HOT CHELLE RAE I Like It Like That f/New...",1233,"+16",102,"-4",4.267,"+0.081",64,"31",21,1233,199,4.267
22,"=","JASON MRAZ I Won't Give Up",1036,"+56",372,"-16",5.056,"+0.342",24,"57",22,1036,388,5.056
23,"=","FLORENCE + THE MACHINE Shake It Out",850,"+20",93,"+12",2.97,"+0.015",100,"--",23,850,101,2.97
24,"=","FLO RIDA Good Feeling",713,"+9",69,"+15",3.403,"+0.093",87,"8",24,713,99,3.403
25,"=","FOSTER THE PEOPLE Don't Stop (Color On T...",705,"+26",128,"+8",2.584,"+0.170",59,"119",25,705,151,2.584
26,"=","MATT NATHANSON Run f/Sugarland",674,"+9",111,"-15",3.312,"+0.098",51,"201",26,674,146,3.312
27,"=","LMFAO Sexy And I Know It",571,"-6",-16,"-11",2.272,"-0.094",115,"3",27,606,93,2.693
28,"=","SCARS ON 45 Heart On Fire",532,"+3",50,"-9",1.297,"-0.063",111,"--",28,532,72,1.36
29,"=","THE CAB Bad",498,"+6",50,"+9",0.755,"+0.030",176,"957",29,498,93,0.783
30,"=","NICKELBACK Lullaby",462,"+25",175,"+6",1.187,"+0.149",23,"442",30,462,175,1.187
31,"=","ADAM LAMBERT Better Than I Know Myself",404,"+22",107,"+10",1.986,"+0.083",26,"460",31,404,107,1.986
32,"=","GOTYE Somebody That I Used To Know",391,"+45",222,"+29",3.18,"+0.314",11,"--",32,391,222,3.18
33,"=","MADONNA Give Me All Your Luvin'",389,"+44",389,"+44",3.289,"+0.428",4,"--",33,389,389,3.289
34,"=","FITZ & THE TANTRUMS Don't Gotta Work It ...",338,"-7",-20,"-15",1.329,"-0.040",97,"--",33,360,62,1.426
35,"=","LADY GAGA Marry The Night",320,"-19",-127,"+1",1.239,"-0.030",73,"210",24,732,158,2.875
36,"+1","MAT KEARNEY Ships In The Night",299,"+21",132,"+5",0.473,"+0.024",13,"595",36,299,132,0.473
37,"-1","OUTASIGHT Tonight Is The Night",298,"+3",37,"-6",1.204,"-0.005",53,"41",36,298,69,1.264
38,"=","DAVID GUETTA Turn Me On f/Nicki Minaj",268,"+9",34,"+2",0.903,"-0.006",17,"5",37,268,82,0.931
39,"+1","ERIC HUTCHINSON Watching You Watch Him",254,"+11",101,"-4",0.322,"+0.035",10,"187",39,254,105,0.322
40,"-1","BUSH The Sound Of Winter",254,"+1",33,"-5",0.513,"+0.007",33,"706",39,254,87,0.607
41,"=","YOUNG THE GIANT Cough Syrup",239,"+1",20,"-12",0.237,"-0.026",23,"282",41,239,95,0.388
42,"+1","JAMES DURBIN Love Me Bad",223,"+11",44,"+2",0.241,"+0.003",31,"--",42,223,58,0.31
43,"+2","NICKELBACK When We Stand Together",203,"+0",-103,"+29",0.749,"+0.010",137,"307",12,2391,725,10.969
44,"=","EVANESCENCE My Heart Is Broken",192,"-16",-115,"-4",0.329,"-0.025",90,"--",35,378,95,0.745
45,"+1","BREATHE CAROLINA Blackout",191,"-3",33,"-11",0.722,"+0.007",17,"38",45,194,54,0.722
46,"-4","AVRIL LAVIGNE Wish You Were Here",189,"-24",-346,"+53",0.488,"-0.050",122,"579",19,984,143,3.584
47,"=","PITBULL F/CHRIS BROWN International Love",179,"-2",56,"-11",0.494,"-0.003",10,"17",47,181,67,0.497
48,"=","JACK'S MANNEQUIN Release Me",169,"-5",-18,"-7",0.145,"-0.001",64,"--",41,206,40,0.198
49,"=","ADELE Rumour Has It",139,"+1",-10,"+3",0.726,"+0.007",96,"149",41,219,75,1.469
50,"--","INGRID MICHAELSON Ghost",130,"--",19,"--",0.191,"--",1,"--",50,130,19,0.191
