"Pos","Pos+","Artist and Title","Spins","Spins+","Bullet","Bullet+","Aud","Aud+","Days","iTunes","PkPos","PkSpins","PkBllt","PkAud"
1,"=","GOTYE Somebody That I Used To Know",5149,-26,-159,-3,35.233,-0.02,139,"3",1,5383,658,36.712
2,"=","MAROON 5 Payphone f/Wiz Khalifa",4762,12,219,-10,31.822,0.1,59,"4",2,4762,1497,31.822
3,"=","FUN. We Are Young f/Janelle Monae",4681,-32,-216,-16,34.134,-0.115,109,"16",1,5161,911,36.298
4,"=","CARLY RAE JEPSEN Call Me Maybe",4247,76,498,-14,28.494,0.775,72,"1",4,4247,723,28.494
5,"=","THE WANTED Glad You Came",4192,28,35,41,27.959,-0.149,128,"28",4,4192,484,28.519
6,"+1","ONE DIRECTION What Makes You Beautiful",3741,16,205,-19,24.663,-0.004,88,"8",6,3741,529,24.667
7,"-1","TRAIN Drive By",3710,-51,-383,41,23.522,-0.345,157,"24",2,4762,795,32.26
8,"=","KELLY CLARKSON Stronger (What Doesn't Ki...",3361,-56,-307,-23,27.052,-0.453,163,"51",1,5388,855,37.448
9,"=","ADELE Rumour Has It",3251,-79,-591,7,23.178,-0.365,222,"63",2,4794,765,32.405
10,"=","JASON MRAZ I Won't Give Up",3158,-5,-61,-5,20.308,-0.019,152,"21",8,3222,462,20.471
11,"=","NEON TREES Everybody Talks",2914,17,267,-29,15.722,0.376,91,"17",11,2914,466,15.722
12,"=","JOHN MAYER Shadow Days",2315,-26,8,-13,12.699,-0.485,106,"193",12,2361,353,13.329
13,"=","DEMI LOVATO Give Your Heart A Break",1959,30,233,7,10.72,0.25,124,"27",13,1959,313,10.72
14,"+1","KARMIN Broken Hearted",1891,80,409,35,10.583,0.406,53,"15",14,1891,418,10.583
15,"+1","KATY PERRY Wide Awake",1814,94,569,15,11.618,0.655,23,"2",15,1814,654,11.618
16,"-2","KATY PERRY Part Of Me",1793,-46,-231,-10,14.307,-0.273,122,"56",4,4132,895,26.693
17,"=","FLO RIDA Wild Ones f/Sia",1544,28,216,9,8.764,0.229,72,"14",16,1544,254,8.764
18,"=","GRAFFITI6 Free",1437,6,132,-20,6.763,0.033,103,"--",17,1437,261,6.837
19,"=","GAVIN DEGRAW Sweeter",1293,12,93,1,4.853,0.06,90,"132",17,1293,166,4.939
20,"=","ELLIE GOULDING Lights",1033,45,246,21,6.66,0.419,187,"12",17,1261,246,6.66
21,"=","KELLY CLARKSON Dark Side",984,35,393,-31,5.12,0.136,18,"249",21,984,443,5.12
22,"=","CARRIE UNDERWOOD Good Girl",947,11,76,5,4.879,-0.005,92,"34",20,947,122,4.884
23,"=","ED SHEERAN The A Team",914,11,84,19,4.843,0.157,75,"--",22,914,180,4.843
24,"=","DAUGHTRY Outta My Head",852,-3,91,-22,2.533,-0.036,76,"--",23,855,161,2.569
25,"=","NICKI MINAJ Starships",769,28,90,15,4.135,0.154,51,"25/44",25,769,127,4.135
26,"=","NICKELBACK Lullaby",657,-54,-452,16,3.5,-0.226,151,"--",14,1747,281,7.352
27,"=","HALEY REINHART Free",638,-6,32,-17,1.499,0.016,62,"--",27,661,116,1.619
28,"=","ALANIS MORISSETTE Guardian",624,-3,69,-26,2.858,-0.105,32,"--",28,627,189,3.121
29,"=","TRAIN 50 Ways To Say Goodbye",620,48,266,24,2.963,0.252,13,"368",29,620,266,2.963
30,"=","KRIS ALLEN The Vision Of Love",556,2,18,-2,1.382,-0.008,70,"--",29,556,100,1.39
31,"=","USHER Scream",555,15,79,2,3.701,-0.018,35,"--",30,555,134,3.719
32,"+1","RIHANNA Where Have You Been",543,28,100,23,2.929,0.28,34,"7",32,543,125,2.929
33,"-1","GROUPLOVE Tongue Tied",533,14,122,-7,2.647,0.142,33,"50",32,533,129,2.647
34,"=","JUNIOR DOCTOR Uh Oh",450,-2,31,-10,0.712,-0.009,60,"--",34,454,65,0.721
35,"=","JUSTIN BIEBER Boyfriend",438,-3,9,-17,1.437,-0.042,69,"9",34,441,120,1.479
36,"=","ADAM LAMBERT Never Close Our Eyes",417,0,19,-1,1.827,-0.044,47,"--",36,417,111,2.115
37,"+8","MATCHBOX TWENTY She's So Mean",412,124,412,124,3.413,0.849,2,"57",37,412,412,3.413
38,"-1","ERIC HUTCHINSON Watching You Watch Him",362,-45,-323,0,2.112,-0.144,138,"--",19,963,105,3.834
39,"-1","NEEDTOBREATHE Keep Your Eyes Open",346,4,13,3,0.484,0.011,89,"--",37,349,53,0.593
40,"=","PHILLIP PHILLIPS Home",338,7,124,-22,2.471,-0.013,9,"--",40,338,175,2.484
41,"-2","CALVIN HARRIS Feel So Close",337,1,-92,23,3.11,0.2,96,"33",26,664,131,3.533
42,"-1","THEORY OF A DEADMAN Hurricane",323,0,43,-9,0.48,0,37,"--",41,324,61,0.48
43,"=","DANIEL POWTER Cupid",306,-2,-1,-3,0.976,-0.151,54,"--",40,317,70,1.16
44,"-2","MAT KEARNEY Ships In The Night",303,-19,-220,15,1.725,-0.175,141,"266",22,847,132,3.599
45,"-1","GYM CLASS HEROES The Fighter f/Ryan Tedd...",298,1,28,-10,1.055,-0.001,19,"20",44,298,105,1.16
46,"=","ALEX CLARE Too Close",290,4,74,-7,1.038,0.036,15,"41",46,290,81,1.038
47,"=","JON MCLAUGHLIN Summer Is Over f/S. Barei...",266,-9,6,-15,0.418,-0.041,77,"--",42,282,45,0.499
48,"=","RYAN STAR Stay Awhile",262,-1,25,-9,0.818,0.019,28,"--",47,263,56,0.818
49,"=","LINKIN PARK Burn It Down",253,0,80,-10,0.895,0.043,6,"70",48,253,90,0.895
50,"=","REBECCA FERGUSON Nothing's Real But Love",228,4,67,-7,0.59,0.034,6,"--",49,228,77,0.59
