"Pos","Pos+","Artist and Title","Spins","Spins+","Bullet","Bullet+","Aud","Aud+","Days","iTunes","PkPos","PkSpins","PkBllt","PkAud"
1,"=","GAVIN DEGRAW Not Over You",4384,"+8",316,"-38",25.214,"-0.036",223,"20",1,4384,354,25.25
2,"=","KATY PERRY The One That Got Away",4204,"+34",246,"-4",24.653,"+0.317",101,"15",2,4204,472,24.653
3,"=","ADELE Set Fire To The Rain",4182,"+33",456,"-39",24.568,"+0.315",72,"2",3,4182,797,24.568
4,"=","KELLY CLARKSON Mr. Know It All",3957,"-36",-445,"-19",25.414,"-0.124",144,"45",1,4553,947,27.314
5,"=","BRUNO MARS It Will Rain",3940,"+45",365,"-30",23.548,"+0.413",114,"12",5,3940,579,23.548
6,"=","COLBIE CAILLAT Brighter Than The Sun",3424,"-54",-392,"-23",19.86,"-0.653",210,"41",2,3995,396,23.886
7,"=","DAUGHTRY Crawling Back To You",3173,"-6",7,"-28",16.836,"+0.014",124,"365",7,3196,901,16.959
8,"=","MAROON 5 F/CHRISTINA AGUILERA Moves Like...",3125,"-20",-191,"+19",19.354,"-0.125",204,"13",1,5169,599,29.564
9,"=","LADY ANTEBELLUM Just A Kiss",2985,"-37",-343,"+20",17.002,"-0.241",188,"48",4,3692,414,21.571
10,"=","RIHANNA We Found Love f/Calvin Harris",2902,"+44",289,"+36",19.186,"+0.294",95,"6",10,2902,361,19.186
11,"=","GYM CLASS HEROES Stereo Hearts f/Adam Le...",2721,"-29",-208,"+6",17.24,"-0.233",151,"26",7,3016,521,19.539
12,"=","FRAY Heartbeat",2594,"+2",22,"-13",11.048,"+0.240",103,"76",10,2594,528,11.238
13,"+1","COLDPLAY Paradise",2463,"+18",197,"-17",12.967,"+0.068",112,"22",13,2463,274,12.967
14,"+1","DAVID GUETTA Without You f/Usher",2229,"-12",-2,"-15",13.75,"-0.035",122,"29",14,2285,313,13.851
15,"+1","CHRISTINA PERRI A Thousand Years",1787,"+31",90,"+30",8.577,"+0.077",78,"40",15,1787,299,8.589
16,"+1","KELLY CLARKSON Stronger (What Doesn't Ki...",1712,"+102",809,"-9",11.831,"+1.020",19,"3",16,1712,855,11.831
17,"+1","TRAIN Drive By",1334,"+119",732,"+10",6.793,"+0.683",13,"97",17,1334,732,6.793
18,"+1","ELLIE GOULDING Lights",1146,"+7",54,"-11",4.718,"+0.014",131,"119",17,1146,180,4.727
19,"+1","JESSIE J Domino",1047,"+39",319,"-2",6.058,"+0.214",43,"8",19,1047,351,6.058
20,"+1","SELENA GOMEZ & THE SCENE Love You Like A...",1046,"+43",302,"+16",4.655,"+0.181",53,"30",20,1046,302,4.655
21,"+1","SNOW PATROL Called Out In The Dark",1036,"+36",120,"+13",3.183,"+0.175",128,"173",20,1036,123,3.183
22,"+1","ANDY GRAMMER Fine By Me",968,"+28",125,"+10",3.119,"+0.077",64,"547",21,968,214,3.119
23,"+1","AVRIL LAVIGNE Wish You Were Here",935,"-4",-39,"-10",2.951,"+0.006",106,"174",19,984,143,3.584
24,"+1","HOT CHELLE RAE I Like It Like That f/New...",906,"+18",131,"+1",3.475,"+0.016",48,"32",23,906,159,3.475
25,"+1","FLORENCE + THE MACHINE Shake It Out",747,"+11",50,"-8",2.446,"+0.193",84,"--",25,747,101,2.446
26,"+1","LADY GAGA Marry The Night",697,"-15",-21,"-30",2.32,"-0.090",57,"73",24,732,158,2.875
27,"+1","RACHEL PLATTEN 1000 Ships",667,"-5",-8,"+2",2.358,"-0.052",180,"1005",23,735,113,2.41
28,"+2","LMFAO Sexy And I Know It",594,"-5",-2,"-3",2.693,"+0.009",99,"7",28,606,93,2.693
29,"=","NICKELBACK When We Stand Together",588,"-54",-471,"+19",2.38,"-0.239",121,"136",12,2391,725,10.969
30,"+1","FLO RIDA Good Feeling",550,"+2",77,"-18",2.581,"+0.031",71,"4",30,550,99,2.581
31,"+1","THE CAB Bad",448,"+8",1,"+8",0.72,"+0.023",160,"581",30,455,93,0.783
32,"+1","MATT NATHANSON Run f/Sugarland",420,"+17",146,"+5",2.276,"+0.162",35,"724",32,420,146,2.276
33,"+1","SCARS ON 45 Heart On Fire",401,"+0",24,"-9",0.614,"+0.029",95,"--",33,401,58,0.614
34,"+1","FOSTER THE PEOPLE Don't Stop (Color On T...",400,"+14",102,"+5",1.21,"+0.055",43,"93",34,400,102,1.21
35,"+1","EVANESCENCE My Heart Is Broken",353,"-11",-20,"-11",0.661,"-0.032",74,"--",35,378,95,0.745
36,"+2","FITZ & THE TANTRUMS Don't Gotta Work It ...",302,"+1",22,"-5",1.158,"+0.048",81,"--",36,302,62,1.158
37,"+2","JASON MRAZ I Won't Give Up",258,"+16",127,"-17",1.969,"+0.139",8,"60",37,258,165,1.969
38,"+2","DAVID COOK Fade Into Me",228,"-8",-53,"+1",0.585,"-0.030",93,"--",33,342,61,0.846
39,"+3","BUSH The Sound Of Winter",214,"-1",3,"-4",0.457,"+0.009",17,"520",39,216,87,0.607
40,"+1","KID ROCK Care f/Martina Mcbride",207,"-20",-156,"+9",0.758,"-0.035",123,"--",26,622,111,1.724
41,"+2","JACK'S MANNEQUIN Release Me",204,"-2",-1,"-9",0.183,"-0.014",48,"--",41,206,40,0.198
42,"+2","ADAM LAMBERT Better Than I Know Myself",201,"+14",54,"+3",0.723,"+0.057",10,"865",42,201,71,0.723
43,"+3","OUTASIGHT Tonight Is The Night",198,"+14",25,"+12",0.975,"+0.103",37,"38",43,198,69,1.264
44,"+1","ADELE Rumour Has It",176,"-11",-36,"-12",0.791,"-0.122",81,"92",41,219,75,1.469
45,"+3","NICKELBACK Lullaby",155,"+4",39,"-12",0.207,"+0.007",7,"--",45,155,86,0.207
46,"+1","YOUNG THE GIANT Cough Syrup",154,"+2",44,"-15",0.284,"+0.017",7,"293",46,155,95,0.284
47,"--","DAVID GUETTA Turn Me On f/Nicki Minaj",136,"--",62,"--",0.456,"--",1,"1",47,136,62,0.456
48,"+2","JAMES DURBIN Love Me Bad",132,"+4",-4,"+3",0.241,"-0.039",15,"--",46,136,25,0.31
49,"=","GENTLEMEN HALL Gravity Will Break Our Bo...",130,"+0",2,"+3",0.123,"+0.001",24,"--",47,134,25,0.123
50,"--","BREATHE CAROLINA Blackout",123,"--",37,"--",0.415,"--",1,"25",50,123,37,0.415
