"Pos","Pos+","Artist and Title","Spins","Spins+","Bullet","Bullet+","Aud","Aud+","Days","iTunes","PkPos","PkSpins","PkBllt","PkAud"
1,"=","KELLY CLARKSON Stronger (What Doesn't Ki...",5066,"-60",8,"-105",31.195,"-0.030",68,"3",1,5134,855,31.337
2,"=","ADELE Set Fire To The Rain",4803,"-51",-73,"-42",30.138,"+0.231",121,"10",1,4955,797,30.378
3,"=","BRUNO MARS It Will Rain",3685,"-59",-84,"-54",21.415,"+0.256",163,"47",3,4267,579,25.509
4,"+1","JESSIE J Domino",3422,"+55",252,"-2",18.844,"+0.652",92,"22",4,3422,485,18.844
5,"-1","COLDPLAY Paradise",3402,"+23",115,"+49",18.239,"-0.154",161,"27",4,3402,274,18.446
6,"+1","TRAIN Drive By",3354,"+30",172,"-14",17.698,"+0.035",62,"9",6,3354,795,17.698
7,"-1","GAVIN DEGRAW Not Over You",3258,"-69",-154,"-8",17.574,"-0.370",272,"39",1,4384,354,25.25
8,"=","KATY PERRY The One That Got Away",3076,"-117",-353,"-58",18.745,"-0.465",150,"85",1,4688,472,28.74
9,"=","RIHANNA We Found Love f/Calvin Harris",2883,"-55",-207,"-10",19.894,"-0.124",144,"33",5,3254,361,22.255
10,"=","CHRISTINA PERRI A Thousand Years",2808,"+42",239,"+1",14.518,"+0.061",127,"29",10,2808,299,14.518
11,"=","KATY PERRY Part Of Me",2415,"+124",448,"-16",14.607,"+0.857",27,"8",11,2415,895,14.607
12,"=","JASON MRAZ I Won't Give Up",2133,"+31",160,"-3",11.347,"+0.368",57,"30",11,2133,462,11.347
13,"=","GOTYE Somebody That I Used To Know",1882,"+73",302,"-7",11.231,"+0.101",44,"6",13,1882,454,11.231
14,"=","ANDY GRAMMER Fine By Me",1791,"+32",120,"-12",6.617,"+0.561",113,"112",13,1791,245,6.617
15,"=","DAVID GUETTA Without You f/Usher",1702,"-32",-76,"+8",11.828,"+0.116",171,"77",13,2285,313,13.95
16,"=","SNOW PATROL Called Out In The Dark",1633,"-22",-39,"-41",5.847,"+0.079",177,"177",15,1697,209,5.847
17,"=","SELENA GOMEZ & THE SCENE Love You Like A...",1546,"-91",-242,"-89",6.753,"-0.404",102,"64",13,1790,320,8.109
18,"=","FOSTER THE PEOPLE Don't Stop (Color On T...",1047,"-22",-30,"-32",3.26,"-0.097",92,"107",18,1080,187,3.815
19,"+3","ADELE Rumour Has It",1028,"+95",331,"-38",8.164,"-0.210",127,"34",19,1028,436,8.374
20,"-1","HOT CHELLE RAE I Like It Like That f/New...",965,"-82",-168,"-55",3.759,"-0.083",97,"60",18,1247,199,4.478
21,"+2","NICKELBACK Lullaby",958,"+30",92,"-23",3.564,"+0.155",56,"441",21,958,175,3.564
22,"-2","MATT NATHANSON Run f/Sugarland",942,"-11",-5,"-54",4.247,"-0.088",84,"385",20,957,146,4.335
23,"+2","ADAM LAMBERT Better Than I Know Myself",918,"+31",117,"+2",3.43,"+0.093",59,"399",23,918,225,3.43
24,"-3","FLORENCE + THE MACHINE Shake It Out",907,"-35",-71,"-23",3.656,"-0.032",133,"--",20,990,101,3.839
25,"-1","FLO RIDA Good Feeling",886,"-19",-36,"-25",4.801,"-0.077",120,"26",22,923,111,5.003
26,"=","THE WANTED Glad You Came",780,"+33",145,"-62",3.671,"+0.199",33,"2",26,780,314,3.671
27,"=","FUN. We Are Young f/Janelle Monae",730,"+113",389,"+23",4.203,"+0.692",14,"1",27,730,389,4.203
28,"=","OUTASIGHT Tonight Is The Night",640,"+29",83,"+25",1.644,"+0.010",86,"37",27,640,114,1.644
29,"+2","JOHN MAYER Shadow Days",619,"+85",273,"-40",4.034,"+0.607",11,"23",29,619,346,4.034
30,"-1","LMFAO Sexy And I Know It",580,"-2",11,"-7",2.649,"-0.259",148,"13",27,606,93,3.102
31,"-1","SCARS ON 45 Heart On Fire",533,"-39",-47,"-23",1.278,"+0.025",144,"--",27,598,75,1.459
32,"=","THE SCRIPT If You Ever Come Back",521,"+11",51,"-21",1.726,"+0.010",33,"--",30,521,130,1.726
33,"=","MAT KEARNEY Ships In The Night",503,"+10",62,"-7",0.896,"+0.036",46,"520",32,503,132,0.896
34,"=","ERIC HUTCHINSON Watching You Watch Him",477,"-4",11,"-36",0.818,"+0.018",43,"--",31,481,105,0.818
35,"=","YOUNG THE GIANT Cough Syrup",401,"+1",19,"-15",0.611,"+0.045",56,"97",33,401,95,0.611
36,"=","PITBULL F/CHRIS BROWN International Love",358,"+17",60,"+0",1.093,"+0.086",43,"17",36,358,68,1.093
37,"=","DAVID GUETTA Turn Me On f/Nicki Minaj",341,"+5",8,"+8",0.97,"+0.016",50,"15",36,341,82,0.97
38,"=","JAMES DURBIN Love Me Bad",312,"-18",9,"-34",0.43,"-0.074",64,"--",36,331,70,0.702
39,"=","DEMI LOVATO Give Your Heart A Break",265,"+6",18,"-7",1.186,"+0.109",29,"176",39,265,63,1.186
40,"=","GRAFFITI6 Free",248,"+19",69,"-8",0.651,"+0.182",8,"--",40,248,113,0.651
41,"+1","ALL-AMERICAN REJECTS Beekeeper's Daughte...",235,"+8",21,"-1",0.544,"-0.005",21,"759",41,235,66,0.629
42,"-1","SAFETYSUIT These Times",235,"+7",15,"+7",0.848,"-0.022",29,"--",40,235,55,0.87
43,"=","O.A.R. Gotta Be Wrong Sometimes",180,"-11",-6,"-18",0.871,"-0.135",17,"--",43,193,64,1.049
44,"+1","MIKEY WAX Counting On You",151,"+5",-3,"+0",0.143,"-0.006",13,"--",44,154,26,0.159
45,"+1","BLACK KEYS Lonely Boy",143,"+5",3,"+4",0.433,"-0.014",8,"--",45,143,18,0.447
46,"+1","JOSH TATUM Everything I Need",131,"-3",19,"-8",0.133,"+0.004",8,"--",46,134,27,0.133
47,"+1","INGRID MICHAELSON Ghost",127,"-4",-2,"-1",0.239,"-0.015",26,"--",45,154,31,0.274
48,"+1","NEEDTOBREATHE Keep Your Eyes Open",121,"+2",12,"-5",0.124,"+0.002",8,"--",48,121,25,0.124
49,"--","RYAN STAR Stay Awhile",116,"--",14,"--",0.632,"--",1,"--",49,116,14,0.632
50,"--","CALVIN HARRIS Feel So Close",110,"--",60,"--",0.245,"--",1,"14",50,110,60,0.245
