"Pos","Pos+","Artist and Title","Spins","Spins+","Bullet","Bullet+","Aud","Aud+","Days","iTunes","PkPos","PkSpins","PkBllt","PkAud"
1,"=","KELLY CLARKSON Mr. Know It All",4466,2,-57,19,26.874,0.132,133,"47",1,4553,947,27.314
2,"+1","GAVIN DEGRAW Not Over You",3956,46,209,47,21.294,0.299,212,"14",2,3956,348,21.294
3,"-1","COLBIE CAILLAT Brighter Than The Sun",3948,-13,15,-17,23.886,0.082,199,"63",2,3995,396,23.886
4,"=","KATY PERRY The One That Got Away",3788,43,289,38,21.673,0.526,90,"10",4,3788,472,21.673
5,"=","MAROON 5 F/CHRISTINA AGUILERA Moves Like...",3487,-60,-271,-36,20.939,-0.178,193,"22",1,5169,599,29.564
6,"=","LADY ANTEBELLUM Just A Kiss",3477,-43,-76,-49,20.482,-0.224,177,"50",4,3692,414,21.571
7,"+1","ADELE Set Fire To The Rain",3344,89,725,25,20.327,0.494,61,"2",7,3344,725,20.327
8,"+1","BRUNO MARS It Will Rain",3317,84,557,64,19.756,0.637,103,"9",8,3317,557,19.756
9,"-2","ADELE Someone Like You",3306,-94,-470,-28,20.875,-0.627,179,"18",1,5345,683,30.563
10,"=","DAUGHTRY Crawling Back To You",3116,35,201,49,16.631,0.092,113,"556",7,3116,901,16.631
11,"=","GYM CLASS HEROES Stereo Hearts f/Adam Le...",3006,-7,112,-3,19.206,-0.214,140,"24",7,3016,521,19.539
12,"=","FRAY Heartbeat",2558,5,80,11,10.927,-0.12,92,"88",10,2562,528,11.238
13,"=","RIHANNA We Found Love f/Calvin Harris",2530,20,338,-23,15.091,0.286,84,"7",13,2530,361,15.091
14,"=","DAVID GUETTA Without You f/Usher",2199,6,56,3,12.956,0.304,111,"35",14,2206,313,12.956
15,"+1","COLDPLAY Paradise",2164,22,147,16,11.426,0.141,101,"28",15,2164,274,11.426
16,"-1","THE SCRIPT Nothing",2092,-55,-150,-41,12.078,-0.339,182,"196",3,4163,439,21.681
17,"=","CHRISTINA PERRI A Thousand Years",1640,24,176,23,8.134,-0.058,67,"41",17,1640,299,8.322
18,"=","NICKELBACK When We Stand Together",1434,-98,-246,-81,5.523,-0.352,110,"97",12,2391,725,10.969
19,"=","ELLIE GOULDING Lights",1039,6,20,28,4.319,0.039,120,"139",19,1086,180,4.435
20,"=","AVRIL LAVIGNE Wish You Were Here",963,0,85,-10,3.545,0.012,95,"100",20,963,143,3.584
21,"=","SNOW PATROL Called Out In The Dark",838,17,82,20,2.505,0.032,117,"--",21,838,97,2.505
22,"=","ANDY GRAMMER Fine By Me",761,38,187,32,2.736,0.127,53,"1001",22,761,187,2.736
23,"+1","RACHEL PLATTEN 1000 Ships",712,-3,25,1,2.055,-0.066,169,"--",23,735,113,2.184
24,"+1","HOT CHELLE RAE I Like It Like That f/New...",701,24,91,24,2.61,0.063,37,"34",24,701,159,2.61
25,"+2","LADY GAGA Marry The Night",667,16,127,8,2.819,-0.023,46,"54",25,667,158,2.842
26,"=","FLORENCE + THE MACHINE Shake It Out",665,13,67,16,1.986,0.064,73,"--",26,665,101,1.986
27,"-4","PARACHUTE Kiss Me Slowly",664,-56,-159,-53,2.798,-0.166,139,"325",20,1235,165,4.313
28,"=","SELENA GOMEZ & THE SCENE Love You Like A...",645,12,99,-7,2.337,0.094,42,"30",28,645,147,2.337
29,"=","LMFAO Sexy And I Know It",606,17,93,18,2.688,0.027,88,"6",28,606,93,2.688
30,"=","JESSIE J Domino",560,24,205,0,3.248,0.011,32,"13",30,560,205,3.248
31,"=","KID ROCK Care f/Martina Mcbride",493,-35,-88,-29,1.381,-0.115,112,"--",26,622,111,1.724
32,"+2","KELLY CLARKSON Stronger (What Doesn't Ki...",458,78,342,50,3.307,0.378,8,"--",32,458,342,3.307
33,"-1","THE CAB Bad",434,3,-8,3,0.642,0.008,149,"683",30,446,93,0.783
34,"-1","FLO RIDA Good Feeling",428,8,32,16,2.125,0.045,60,"4",31,428,99,2.125
35,"+1","EVANESCENCE My Heart Is Broken",347,10,41,11,0.681,0.036,63,"--",35,347,95,0.727
36,"-1","SCARS ON 45 Heart On Fire",344,1,-1,2,0.332,0,84,"--",34,357,58,0.407
37,"=","DAVID COOK Fade Into Me",299,3,-7,7,0.745,0.002,82,"--",33,342,61,0.846
38,"=","FOSTER THE PEOPLE Don't Stop (Color On T...",276,0,31,-4,1.129,0.034,32,"105",37,276,93,1.129
39,"=","FITZ & THE TANTRUMS Don't Gotta Work It ...",254,13,49,18,0.677,-0.03,70,"--",39,254,49,0.742
40,"=","MATT NATHANSON Run f/Sugarland",231,7,96,-1,1.502,-0.005,24,"--",40,231,97,1.519
41,"=","ADELE Rumour Has It",219,3,46,3,1.437,-0.032,70,"102",41,219,75,1.469
42,"=","T-PAIN 5 O'Clock f/Wiz Khalifa",201,-11,-29,-11,0.436,-0.021,47,"29",39,246,89,0.511
43,"+3","TRAIN Drive By",199,69,199,69,1.245,0.473,2,"25",43,199,199,1.245
44,"=","BUSH The Sound Of Winter",191,12,80,7,0.51,0.048,6,"519",44,191,80,0.51
45,"-2","JACK'S MANNEQUIN Release Me",186,6,21,5,0.174,0.009,37,"--",43,186,40,0.174
46,"-1","OUTASIGHT Tonight Is The Night",176,0,-8,8,0.753,-0.011,26,"36",43,196,69,1.264
47,"=","GENTLEMEN HALL Gravity Will Break Our Bo...",130,2,23,-1,0.116,0,13,"--",47,134,24,0.116
48,"=","HINDER The Life",128,1,3,3,0.125,-0.003,53,"--",46,159,21,0.15
49,"+1","JAMES DURBIN Love Me Bad",124,2,18,0,0.308,0.016,4,"--",49,124,22,0.308
50,"-1","DEV In The Dark",122,-1,-26,0,0.381,-0.004,98,"158",45,175,36,0.51
